"author","author_flair_css_class","author_flair_text","body","created_utc","distinguished","edited","gilded","score","subreddit"
"Rawrr_dinosaurs","","","wat?",1432876191,"","False",0,1,"videos"
"industrialwaste","","","People have too many emotions attached to their dick. ",1426006498,"","False",1,311,"videos"
"TheDigitalRhino","","","I don't understand how Israelis can't see how they look like nazis ",1427991141,"","False",5,3850,"videos"
"The_0ne_Free_Man","","","Why does Ross, the largest friend, not simply eat the other friends?

Edit: Gold for Futurama? Thank you kind Redditor!",1420540928,"","1420578209",1,566,"videos"
"vessel_for_the_soul","","","I'm with the dog, Fuck salad. That's what my food eats! Plus I'm sure he is going to puke ",1425357257,"","False",0,2,"videos"
"StrictScrutiny","","","Just to look at the other side for a really quick second - this is in no way a defense of Islam, Islamic fundamentalism, terrorism, Sky News (fuck Murdoch), or curtailing free speech rights. 

If Sky News wouldn't have shown the cover before the Charlie Hebdo attack, do they have to show it now or be bowing to terrorists? 

If someone in a park is spouting racial epithets (which I know is not the same as Charlie Hebdo - only drawing an analogy here), okay, he might have the freedom of speech to do that. No one has to stand with him or pay any attention. If that person is killed, that murder is obviously horrible and not okay, but do we all then have to stand there and shout racial epithets or otherwise be bowing to terrorism? 

I don't see why Sky News can't make this choice, as long as they are making the choice because they wouldn't normally show that content, and unrelated to the horrible crimes that occurred against innocent people invoking their right to free speech. Is that unreasonable? ",1421276118,"","False",4,591,"videos"
"ShooterMcRenz","","","Omg they need a Marine Corp version of this...

Oh WAIT!
https://www.youtube.com/watch?v=iqsA5XsYW7I

Close enough!",1425192576,"","False",0,0,"videos"
"Beristain25","","","/r/happycrowds ",1423938752,"","False",1,7,"videos"
"mm2222","","","I was turned off by his jean shorts, however for a man with jean shorts he's the most positive and laid back person I have ever seen. The technique he uses, as disgusting as it is, is the most forward thinking and innovative cat pisser. Probably in the world! ",1432482702,"","False",0,102,"videos"
"CoSonfused","","","i don't get it",1432813226,"","False",0,4,"videos"
"doopercooper","","","**Pornhub is shifting accounts to upvote this post and downvote negative comments**",1425006057,"","False",1,55,"videos"
"itsjustmeeshie","","","The problem is the state of Georgia has essentially monopolized country music including the artists and the songwriters. Throw in the fact they are all friends and you get the same sound over and over again.

Top Songwriters = The Peach Pickers (Rhett Akins, Dallas Davidson, &amp; Ben Hayslip) - All from GA and write most hit songs on the radio by you guessed it their GA buddies such as:

* Thomas Rhett (Rhett Akin's son)
* Jason Aldean
* Luke Bryan
* Cole Swindell
* Florida Georgia Line
* Brantley Gilbert
* Kip Moore 
* Sam Hunt

Those are off the top of my head and all have played a part in pop country and perpetuating it.... The same bullshit songs continue to go #1 and everyone is happy except true country music fans unfortunately.

The pop-country (I call it bro-country) fraternity of Georgia needs to be broken up....

For real music listen to: 

* Chris Stapleton
* Whiskey Myers
* Blackberry Smoke
* Brandy Clark
* Dirty Guv'nahs
* The Cadillac Three
* Will Hoge
* Sturgill Simpson

Source: Built one of the biggest country music sites and quit months ago because I couldn't bear putting any more terrible country music up. 

EDIT: Got back from work to GOLD. Thank u kind stranger and god bless country music. Here's to a revival very soon! Also, appreciate all the other artists peeps posted below.... Some great stuff!

",1420745370,"","1420774513",2,498,"videos"
"quarantesept","","","In light of this morning's attacks in Paris, I thought I'd post some Hitchens. Such a shame he isn't around anymore. 

*edit: Thank you for the gold, anonymous comrade.*",1420644320,"","1420666376",2,1710,"videos"
"The_Kurosaki","","","Not only about polemic themes... but if you watch some of their ""best of his show"" vids online, you will see he practically does not know anything about anything. ",1420303338,"","False",0,1,"videos"
"[deleted]","","","[deleted]",1427323906,"","False",0,0,"videos"
"AutoModerator","","","Hello /u/mattdahack,

Thank you for your submission. Unfortunately you have submitted a link to Facebook. To protect users' privacy, links to Facebook are not allowed on /r/videos.

If you can, find or submit a copy of the video on another website like YouTube or Vimeo and resubmit it here.

If this was done in error (and your post is not a link to Facebook), feel free to message us.


*[I am a bot](/r/AutoModerator/comments/q11pu/what_is_automoderator/), and this action was performed automatically. Please [contact the moderators of this subreddit](/message/compose?to=%2Fr%2Fvideos) if you have any questions or concerns.*",1429637327,"moderator","False",0,1,"videos"
"Tucker_MalcolmXI","","","This program was pretty much made for game theory.",1423591879,"","False",0,0,"videos"
"aygoman","","","Omg this is going to be on the front page soon. Say something smart...  
Meesa so excited for the movie!  
  
Uh shit",1429208128,"","False",1,3278,"videos"
"possiblyajerk","","","It's like they walked into their kid having an orgy while snorting lines off of hooker's tits.",1427680854,"","False",0,1,"videos"
"idontdojack","","","Good video. Can't believe the responses of the other women. ""There is no reason for a man to hit a woman, unless his life depends on it."" Yeah because you should start defending yourself ONLY when you are physically about to die. ""That's blaming the victim though."" Yeah, you really can't be the victim if you decide to assault someone first. And my personal favorite, ""Men can not hit women PERIOD, EVER."" 

The women's equality movement today is great, but how can you claim you want equality when you only want it when it's convenient for you. You don't really get to pick and choose when you want to be treated like a damsel in distress, unless I misinterpreted the definition of equality...",1427397787,"","1427398887",2,1355,"videos"
"HeartlessMario","","","The first 10 seconds look straight out of Far Cry",1420557329,"","False",0,18,"videos"
"poopsmith666","","","Why is tinder capitalized. ",1424210459,"","False",0,1,"videos"
"Sunshinelorrypop","","","West Ham supporters are great when it comes to letting people on the train.

The problem is when they throw people under them.",1424616741,"","False",1,3479,"videos"
"Zakaria_Merys","","","Seeing as the other translations are a bit off:

Cameraman: ""Right, don't put too much weight on it, right?""

Poor Lad: ""Where the fuck am I meant to put my weight? I can't put my weight on the roof, it's dead thin, I can't hold on to the gutter what am I meant to do with it? Oh here Andrew, hold it for five minutes, you fucking wank stain! Don't put- Don't shift your weight- What the fuck are you talking about? I can't put my weight on the -fucking- the roof, I can't put my weight on the gutter, where is it meant to go?"" ",1431703860,"","False",1,3782,"videos"
"silver5517","","","[laughing] Please, dude. You're barely even brown. Compared to me, you look like Matthew Perry. ",1423785856,"","False",1,320,"videos"
"bluntrollin","","","I visited Israel and Palestine in 2013.  Its on both sides.  Multiple villages we went to in Palestine had signs at the entrance saying, if you are a Jew we will kill you on the spot.

",1427994352,"","False",1,477,"videos"
"jhc1415","","","And then they morphed back into hyenas and continued with their plot to stop Simba from being king. ",1420788480,"","False",3,4641,"videos"
"Definition21","","","That's a Bro right there.
",1425247357,"","False",0,2,"videos"
"elvijs782","","","Parkour zombies? Well that's something new.",1420821561,"","False",0,1,"videos"
"alienumnox","","","How funny is it that I, as a female, am too afraid to share this video on my Facebook page for fear of the hateful backlash I would receive from my feminist friends? ",1428616288,"","False",1,745,"videos"
"mintarey","","","The pink one's voice is the single most annoying thing I have ever heard.",1424591306,"","False",0,1,"videos"
"Soul_Rage","","","**BUT HOW FAST ARE THEY GOING?** *...I hear you ask.*

Well, we can measure that, using the Doppler shift of their engine sounds!

First of all we need to get the audio, and present it properly: Time vs frequency, as seen [here](http://i.imgur.com/hftOYJW.png). Those big blobs of noise are cars going by. Kinda messy, but if we look at the right range, we can pick out particular sounds.

[Magnify, enhance and so on](http://i.imgur.com/YQibQK4.png). Those lines shifting down in frequency is the Doppler shift, caused by the source of the sound accelerating relative to the observer. It'll shift *down* as it gets closer, and then *down again* as it begins to move away. As it gets further away, the velocity relative to the observer will tend towards a constant value (discounting the fact that the track isn't straight, including that detail would make this calculation very complicated). Anyway, by looking at the change in frequency, we can estimate the velocity of the source. I picked out two instances where there seems to be a clear line, and with a bit of calculation...

vs - (vs * 0.315/0.574) = 153.41m/s

Where vs is the speed of sound: 340m/s. Now, this value is *the total change in velocity* relative to the observer, and since the car is moving closer, and then moving away, that change is going to be double the average speed of the car.

153.41/2 = 76.71m/s = **171.6mph**

And we can do this for the other instance I picked out, too:

vs - (vs * 0.308/0.515) = 136.66m/s

136.66/2 = 68.33m/s = **152.8mph**

So it's a bit *inconsistent*. Our main limitation here is that the cars don't emit clear, noise-free sound. It also doesn't help when there are multiple cars whizzing by one after another in close proximity. I think we're roughly in the ballpark though; some further enhancing might help matters: [More enhancing](http://i.imgur.com/QPT9Dp3.png).

That one is a bit clearer. The same calculation as before with this one yields the result **172.4mph**.

Science, bitch.

*Edit; there is an unaccounted-for factor here that means these are lower limits, by the way; this method is not perfect.",1431950464,"","1431996668",1,93,"videos"
"Misaria","","","http://i.imgur.com/pQ2VhDn.gifv",1426402528,"","False",3,3983,"videos"
"MrMoar","","","For fuck sake with that camera angle cant see how engine was shredded, what a waste of time...

Wait what??? Got 10 engines as a bonus.",1428438699,"","False",0,2,"videos"
"TrubbleWithTribbles","","","Mr Gosling, that was cool of you. Thanks for taking the time to do that tribute.",1430807291,"","False",0,1,"videos"
"ness111555","","","How did I know this was from Melbourne.",1432901125,"","False",0,2,"videos"
"posamobile","","","Hey its that main character from that show about the kids in college. I think Marshal from HIMYM is in it? It got cancelled I think though. I think it was called Accepted",1426277319,"","False",0,1,"videos"
"zeldn","","","[I made a 3d animation to visualize what could be happening](https://vid.me/zs4p)",1420486018,"","1420491749",1,4164,"videos"
"xhosSTylex","","","Sail..he did not.",1432069851,"","False",0,1,"videos"
"giraffeboner1","","","Damn Jerry, your so fat you ripped a parachute",1422596460,"","False",1,184,"videos"
"[deleted]","","","You know, something that causes someone to freak out like this shouldn't be taken lightly.  There's clearly something very important she needs to get to, and the dumb asshole with the camera ""huhuhuh i got the whole thing huhuhuh!"" that was irritating as shit to listen to.

If some horrible accident had you stuck in traffic and you needed to get to a job interview, or as another poster said ""father's death bed"" and you were told you JUST missed it, you might boil over.

NONE OF US knows how we will act when the stress gets to a point where it takes over the rational part of your mind.  Some might scream, some might cry.  At least TRY and have some empathy, don't just bust out a camera and laugh at the poor girl.

TL;DR:  Fuck the guy filming and fuck all of you.  ",1421791838,"","False",1,4,"videos"
"LeaveTheMatrix","","","&gt; promote body positivity and self-love.

Some peoples opinion on the definition of ""self-love"", might keep them from watching the video. ",1426925960,"","False",0,1,"videos"
"broadcasthenet","","","I *will* be downvoted for this because this is a circlejerk. 

But 9/11 was not a big deal in terms of human lives, at worst it was a big deal in financial terms. Instead of the actual day where only 3000 people died(more than that are murdered each year anyways in the US). We should be talking about the awful shit knee jerk reaction that the entire country took after it. 

2 MILLION lives were lost during two wars due to the US, trillions more in debt, a severe violation of the constitution on a daily basis by the government, and the loss of former freedoms. These are the real issues, the actual day of 9/11 doesn't fucking matter. 

And posts like these only serve to rile up the irrational emotional reaction to the day and only serve to make you forget about the awful things the government has done since then. And in the worst case will actually make you support some of their decisions. 

",1432733833,"","False",1,5,"videos"
"diaspora","","","DOC CHICKEN!",1423941728,"","False",1,15,"videos"
"nachodogmtl","","","nope.",1430274175,"","False",0,1,"videos"
"swayXchamp","","","Do you like the background music? ",1421359156,"","False",0,1,"videos"
"AdonisChrist","","","Doesn't cancel out at all. Fuck people who bike the wrong way on roads.

and this is coming from a cyclist.",1425517525,"","False",0,2,"videos"
"saint_smithy","","","I fucking love Nichijou. My girlfriend laughs herself into tears at this every time. Pretty sure at least once a month for a pick-up.",1431905127,"","False",0,2,"videos"
"irishflu","","","A horde of two.",1420836763,"","False",0,1,"videos"
"erokk88","","","No..one's....ripped like Gaston, lifts as big as Gaston

No one makes a park patron his bitch like Gaston.

Edit: thanks for the gold! I kindof stole it though..kindof.. https://www.youtube.com/watch?v=lUjI-293DNc",1420330256,"","1420340386",2,4752,"videos"
"texas_chokehold","","","For everyone that's annoyed by this man, remember that next time you can vote, because if you don't, guys like this always sure as hell do. 

Edit: Fuck I regret posting this from my alt. My main has been dying and could have used the karma. Oh well, guess I underestimated my point. ",1428159034,"","1428187475",2,4679,"videos"
"Sazereak","","","A feminist who's bad at math, terrible at public speaking, and hates constructive criticism?

I don't believe you...",1423236947,"","False",1,263,"videos"
"Yapshoo","","","I'm not really a wrestling fan (watched it as a kid, watched it ~2011-2012 when The Rock came back), but I am always completely wowed when i see Mean Gene. That man is AMAZING at what he does. Haven't seen him break character even once, even in the face of insane/cocaine [Macho Man](https://www.youtube.com/watch?v=UHAv0Dhka84&amp;list=LLsOVfOhIFKgV2kFIA-ulbYQ&amp;index=373).",1425065653,"","False",1,1044,"videos"
"nerds-fuck-adaquetly","","","god damnit.  I'm so lonely.  I just want to have someone to love that much.  I'll be drinking if anyone needs me.   
Edit-  Next drink is on me stranger. ",1426315149,"","1426315777",1,0,"videos"
"Mini_Evo","","","A tricky wank for sure",1428616718,"","False",1,67,"videos"
"wrapped_in_clingfilm","","","Gastrointestinal surgeon here. Did you know that your anus and your vocal chords use exactly the same kind of twin in-foldings of mucous membrane? It is therefore possible, with some training and dedication, to learn to speak through your arse. I've been doing it for most of my life.",1431868292,"","False",2,4214,"videos"
"MrTripNip","","","""Beauty's important and it's illegal to be naked."" 
-Kanye West

",1423800380,"","False",1,105,"videos"
"thispartyislame","","","Hey everyone, this is my video. I had just finished an after hours service call, I'm a plumber, and was walking to my pickup truck in front of our shop when the goat ambushed me. The commentary is all live, no headphones or anything, and I do apologize for not filming it horizontally. I was kind of spazzing out and didn't realize until it was too late.

As for those saying I have a good voice, thank you! Before being a plumber I was actually a radio news reporter and anchor. My dream is to become a professional voice actor / voice over guy. ",1426948163,"","False",1,1335,"videos"
"Aepyceros02","","","I can't believe this is Reddit and no one has mentioned the guy parked like a douche!!

Anyway, as a former firefighter this annoys me greatly. Most people don't know that fire stations are often manned 24 hours at a time. This means that the firefighters literally are living at their job during that time. He's worried about fuel and maint. while they buy groceries?? How about all the fuel and maint. wasted on false fire alarms? Or on any number of other calls that should never be made? Fire Depts. are there to help the public whenever they WANT it and especially when they need it. Cut them a little slack to get some damn food.",1428165237,"","False",1,1836,"videos"
"MadDogWest","","","The counterargument at 1:54 is ""When it comes to physical strength, they're not equal.""

She's absolutely right. That's why I don't go picking fights with guys at the bar that look like they could crush a brick in the palm of their hands (then again, I don't really care to pick a fight with anyone). If you feel the need to physically strike someone, you better be ready to finish the fight, whether they're equal in strength or not. You started it, you should be ready for the consequences. Lessons from dad--""you may not start it, but you better be ready to finish it.""

Not condoning anyone hitting anyone, but if you're male, female, or otherwise, and you throw the first punch... you should have no reason to expect that the other person will not return the aggression.

EDIT: Thanks for the gold kind stranger! First time gold for me. :-D

EDIT 2: Some commentors seem to be under the impression that I'm advocating for men to face-stomp women if they're assaulted (or any combination of genders in the fight). Not the case. As I've said above, ideally, no one should be causing anyone physical harm in the first place. Even after being hit, in an ideal world, the situation would be defused without escalation. However, that's not how things tend to work, so one should not be expecting special treatment in a fight for any reason, and thus should not be surprised when a punch or slap is met with a similar strike, regardless of gender, size, or most other factors.

If nothing else, look at it from an education standpoint. I would be doing my future daughter a massive disservice (and would be potentially putting her in dangerous situations) if I told her that she could strike a man and expect him to just take it because ""men shouldn't hit women."" As Whoopi has pointed out, if she hits a man (or anyone else, for that matter), she shouldn't be standing there aghast if a fist comes back at her. 

EDIT 3: The double gildening!",1427399433,"","1427418274",2,4517,"videos"
"mariahkl13","","","My dad was in no way a strict parent. I can actually recall the only 2 times that I had gotten in trouble with him. The most angry I had ever seen him is when he returned home to find the inside of the house covered in water because us kids decided to have a water fight inside. He yelled and sent us to our rooms. He came in 30 minutes later and did a very cliche dad thing, took us out for ice cream and apologized for yelling. 

The only other time he was angry at me was when I was 8. My sister is 5 years older than me and she would hang out with the older kids in the neighborhood. I would follow along usually because there weren't many kids my age that lived close. One day it was dark out and my dad told me I could go with them but I am not allowed to pass a certain street light. I ended up passing the street light. When I came back inside I asked my dad something and he wouldn't respond. He wouldn't talk to me at all, just ignored me. Finally he said that there is no point in him talking to me if I am not going to listen and respect what he tells me to do. I was was terrified that he would never speak to me again. I definitely obeyed him way more after that lesson.",1420139739,"","False",0,1,"videos"
"dev67","","","What are they burning that's going so strong for so long?",1425922643,"","False",0,5,"videos"
"wadonka","","","More like, why the fuck is that window there in the first place? Isn't there supposed to be Jesus shit up there on the alter and not some breakfast-nook ass bullshit? Guy is 100% in the right here. ",1431151108,"","False",1,975,"videos"
"[deleted]","","","[deleted]",1426120041,"","False",0,1,"videos"
"Storthos","","","The ""enact the labor"" part always gets me. You are in the upper-middle class *at the very least.* You have never had a real job. You live with your parents. Every day, in the United States, millions of people trade quality years off the end of their lives for a meal and a roof. People *in your social class, Suey,* buy their comfort with those people's blood.

And those people, down here at the bottom? They are a diverse multitude, with equal dust in every mouth. You will find every variation of human biology down here, and yes, that includes white men.

The history of leftist political thought in the last fifty years is the history of a particular social class trying to barter their way out from under the guillotine - ""Hey, if we pretend it's actually about race and gender instead of class, we can call ourselves 'allies' and maybe they won't notice that we're going on about *The Struggle* from our million dollar homes!"" Corruption and evil is not skin-deep, Suey. Every oppressor I have had in my entire life has had one thing in common - a fat bank account. White men, black women, doesn't matter - wealth, and wealth alone, is the means to social power, and unlike someone's *goddamn skin color, you fucking bigot,* the mere possession of wealth in the United States can cause harm to others (for instance, my brother-in-law is a security guard at a phenomenally wealthy residential area. A ""suspicious vehicle"" warrants an immediate response of four police cars. In the very same town, I was walking the dog at 3am when I heard four gunshots, a woman screaming, another gunshot, and silence. I ran home, called the police, and three hours later, a single patrol car shows up, shines their spotlight around, and leaves. The bodies weren't discovered until a day later. This was in the poorest neighborhood in the county.)

Real human beings suffer for your comfort, Suey - people (yes, even white people, or worse, white men) work long hours for low pay to provide you with your luxuries. You are casting aspersion on the people carrying your palanquin. You're talking about unequal power relationships with a whip in your hand. If the social order inevitably revolves, all your ""hard work"" on twitter won't ingratiate you to the proletariat. They'll be looking at your skin, but they won't be checking for color - they'll be checking for scars, for callouses, for the brands placed upon the underclasses by you and people like you.",1432276318,"","1432277133",1,29,"videos"
"parkedcar","","","This same Gaston refused to sign my bicep 2 days ago at Disney because he couldn't find it.
Edit: It was actually yesterday not 2 days ago. ",1420346568,"","1420351940",1,5831,"videos"
"techiegirl74","","","Is all of this with or without catnip? Cuz if its without, I demand another video with!",1422321274,"","False",0,33,"videos"
"InsultRatings","","","*""What the fucking Hell are you, you great, gangly fuck-knuckled twat; greasy-haired cunt bag. Fuck you.""*

**Meanness:** 9.5/10

**Creativity:** 9/10

**Usability:** 6/10

**Response time:** Immediate

**Length:** 18 words

**Statement correct?** Unverified

**Correct Grammar:** Yes

**Profanity included?** Yes

**Responding to an insult?** No

**Current Points:** 183

**Strong Area:** No Hesitation

**Total Score:** 9.3/10 ; Excellent",1432218689,"","1432230412",1,1321,"videos"
"Risky_Fellatio","","","""Jason what do you make of this?""

*Closes Reddit* ""Well I... uh... I...""



Edit: Oh boy my first gold, I'm in the big league now. Thanks stranger!",1432276528,"","1432332131",1,2416,"videos"
"jamishtheinadequate","","","&gt;Cammy was born unable to walk, or even speak  
 
We all were Duncan.",1425614883,"","False",1,446,"videos"
"L1FTED","","","What do they do with these videos? Do they send the plates to ths police or what?",1423866780,"","False",0,0,"videos"
"kebordworyr","","","STOP RESISTING^my^love^for^you
",1426365581,"","1426440592",1,1267,"videos"
"wisdom_possibly","","","That's a small ring for weapons combat.",1430295231,"","False",0,1,"videos"
