"author","author_flair_css_class","author_flair_text","body","created_utc","distinguished","edited","gilded","score","subreddit"
"Mentioned_Videos","","","Other videos mentioned in this thread:  

[&amp;#9654; Play All](http://sbtl.tv/_ym3lF2qEA2cw/mentioned/2)

VIDEO|VOTES - COMMENT
-|-
[Homeless Mustard Sings ""Creep"" GREATEST Cover EVER - @OpieRadio](https://youtube.com/watch?v=hXlzci1rKNM)|[20](http://reddit.com/r/videos/comments/31sfru/_/cq4tz0u) - Great voice but I couldn&amp;#39;t get too into it. I prefer this cover much more 
[Creep (Radiohead) - Carrie Manolakos](https://youtube.com/watch?v=aZ5ZclZTeTU)|[4](http://reddit.com/r/videos/comments/31sfru/_/cq4tgjv) - I like this one a lot: Creep (Radiohead) - Carrie Manolakos:  
[Scala &amp; Kolacny Brother - Creep (HD)](https://youtube.com/watch?v=3Ado5PMjr5k)|[2](http://reddit.com/r/videos/comments/31sfru/_/cq54ad3) - my favorite cover of this song 
[Richard Cheese - Creep](https://youtube.com/watch?v=fn40B9ugcrs)|[2](http://reddit.com/r/videos/comments/31sfru/_/cq5boua) - I prefer the Cheese 
[Northern Kings - Creep](https://youtube.com/watch?v=2I2x7NwEfLE)|[1](http://reddit.com/r/videos/comments/31sfru/_/cq5f915) - Northern Kings - Creep is still my favorite cover version. 
[Creep (acoustic Radiohead cover) - Mike Masse and Jeff Hall](https://youtube.com/watch?v=RwTcy2D961c)|[1](http://reddit.com/r/videos/comments/31sfru/_/cq4uwps) -   This one is my favorite, check out his channel he is really great! 
[Radiohead - Creep (cover) by Daniela Andrade](https://youtube.com/watch?v=DDjlaN-X8-0)|[0](http://reddit.com/r/videos/comments/31sfru/_/cq5005p) - I disagree. This one is even better.   
[Haley Reinhart - The House of the Rising Sun (Second Song) - Top 5 - American Idol 2011 - 05/04/11](https://youtube.com/watch?v=ts9oMPpvJew)|[0](http://reddit.com/r/videos/comments/31sfru/_/cq5quii) - The singer, Haley, actually had a sordid history. She was a contestant on American Idol some time ago. You can hear more about her there. 
(1) [Creep - Vega Choir](https://youtube.com/watch?v=oNqBsQiNoAU) (2) [The Social Network Official Trailer -In theatres Oct 1 2010](https://youtube.com/watch?v=lB95KLmpLR4)|[-1](http://reddit.com/r/videos/comments/31sfru/_/cq52vi9) - I&amp;#39;ll probably get downvoted, but I really like the Vega Choir cover, used in The Social Network trailer. 
[Breathe Electric - Never Gonna Give You Up(Cover) (Lyrics)](https://youtube.com/watch?v=WPoB3xn25OQ)|[-6](http://reddit.com/r/videos/comments/31sfru/_/cq4ygs3) - I much prefer this cover 
***
I'm a bot working hard to help Redditors find related videos to watch.

[Info](http://np.reddit.com/r/SubtleTV/wiki/mentioned_videos) | [Contact](http://np.reddit.com/message/compose/?to=Mentioned_Videos&amp;subject=contact)",1428617962,"","False",0,1,"videos"
"Mangekyo11","","","He is actually an alien that is in fact made of water, who takes over human beings by sneaking inside while they're on the toilet. They have and will do this until the promised day, when they will rise^up like a great tidal wave from the world's oceans, the place where they have been patiently waiting for ages. Watching, always watching(ever wonder why there's more water than land on our planet? Wasn't always that way!). On that day, the great one will rise from his slumber, deep down in the dark, his sunken citadel.. The old one has been gathering his power, biding his time until the day he can slither his way above the surface and take this planet for his own. These water beings have, since before the dawn of written history, taken over portions of the population. Using their meat suits as the perfect disguise to sow discontent and chaos throughout the globe, weakening the already tenuous grasp that human kind have on mother earth... or as they will call it, *Splish Splash*.  Unfortunately not all of them have the ability to pass for true humans and this is a good example. Although we totally just thought he was tripping out so we messed up the one chance we had at figuring out their horrid machinations before it was too late. As you read this, I am traveling to witness the rebirth of our new Master.... I give you just this one small, fleeting hope, a tiny hint to help you try and survive in the terrible eons to come... Remember these words well.... Cthulu Fhtagn.",1425066937,"","False",1,2,"videos"
"mstallion","","","[#LikeAGirl](https://www.youtube.com/watch?v=XjJQBjWYDTs)",1423693594,"","False",1,90,"videos"
"Bpesca","","","In Liam Neeson's latest film, Given, he's sick of his raging alcoholic daughter and sends her overseas to be someone else's problem.",1428411671,"","False",2,2753,"videos"
"JP3Gz","","","&gt;I'm going to make myself a cup of tea.

(   )",1431614271,"","False",1,3383,"videos"
"BigTimeGiantsFan","","","Fake. Can't be Portland. Didn't see one novelty mustache or restaurant with a pun name.  ",1426526556,"","False",0,-2,"videos"
"optical_power","","","Holy shit. I'm lying bed and I genuinely got scared watching this.  ",1429452362,"","False",0,2,"videos"
"poltergoose420","","","What language are you all speaking op?",1430789905,"","False",0,1,"videos"
"filthyneckbeard","","","A lot of comments saying how fucked the people sending the hatemail are, and then a lot of comments calling the pornstars ugly are getting upvoted. Reddit is weird.",1426026970,"","False",1,61,"videos"
"tacomcnacho","","","The answers were 8 and 0 by the way.",1431907350,"","False",1,4031,"videos"
"Klexal","","","Could I get some clarification on the video if possible?

When the Taliban attack the mosque, are there people actually defending it with weapons, or is it a completely defenceless situation?

Like in the video, a guy comes in and shoots a person or two, and then moves back outside without harming the rest - and it happens a few times with numerous armed people.

Also do you know if the casualties are including the terrorists, or purely civilian?",1423937227,"","False",0,1,"videos"
"[deleted]","","","[deleted]",1426562902,"","False",0,1,"videos"
"xjtsx","","","when you treat people like an asshole you get treated like an asshole. fuck the camera guy and his two cunt sisters.",1428873551,"","False",1,792,"videos"
"rsong965","","","I don't know what the fuck he was thinking and i bet he doesn't remember either.",1420152018,"","False",1,493,"videos"
"palehorse864","","","I wasn't expecting a Twin Peaks parody, but that was funny. I noticed the font typeface and colors, but the rest made it even better.

[Twin Peaks intro for those who haven't seen it.](https://www.youtube.com/watch?v=X2lkvrMa27c)

[3 minute long version from the pilot episode.](https://www.youtube.com/watch?v=i7d0Lm_31BE)",1428947646,"","False",1,49,"videos"
"grantmoore3d","","","So she's not intelligent and screwed up a couple words, who cares? Let's not make fun of people like this, they definitely don't deserve it. I'm sure her life is hard enough without being mocked.",1420177786,"","False",1,21,"videos"
"Ajones0473","","","My little brother, David, had EB. He had EB recessive dystrophic, inside and out. He passed away at 16 weighing 36 lbs. I cannot express to you how tragic this disease is. Not only the constant pain but how it keeps you isolated. David was wrapped from his neck down in white gauze. If he had a bad infection, you could smell it. If he had an open site on his neck, you could see it. EVERY time you leave the house, you get stared at. People pull their kids back when you walk by. They ask your parents if it contagious. It is dehumanizing. He was the loneliest person I've ever known. 
 Not only was his life hard but his death was heartbreaking. The amount of suffering he endured during his life and death (especially his death) broke something in me that I don't know will ever be fixed or soothed. 
 I just want to say, if this video has moved you, do something. Spread the word about this disease. Volunteer time. DONATE MONEY. Whatever, just don't move on to another video, to another day without doing something.

Edit: Thank you to everyone for some of kindest words I've ever been on the receiving end of. 
Talking about David has always been so painful that I shy away from it. I cannot tell you how good this has felt to tell you all about him and about my journey as his sister. And to EVERYONE that was donated because of this....I can never thank you enough. It has been a very humbling experience. I think I needed this more than I would have ever known.  
Also, thank you the gold! First time for that. I am relatively new to this whole Reddit thing. I've got nothing but love for you guys! :)",1429052503,"","1429071488",1,1858,"videos"
"Raincoats_George","","","Imagine if you didnt know the context and you were riding your bike by as this man in jean shorts aggressively forced the shit and piss out of a cat. I think I would just ride my bike straight into space after seeing something like that. ",1432484597,"","False",1,1946,"videos"
"[deleted]","","","[deleted]",1430189308,"","False",0,1,"videos"
"R3troPeak","","","Thats shocking",1432888480,"","False",0,3,"videos"
"franick1987","","","I worked in sporting goods at a store and one experience I will never forget was the time I learned about the importance of trigger discipline and always assuming a gun works. It was my first day and I was tasked with handling the equipment, and being an idiot, I never took it quite seriously mainly because it is not the kind of thing that you typically hear about, granted it was not the kind of thing I would have thought to happen. It was then I realized how sensitive triggers can be. Before I knew it, I grabbed the gear with my finger on the trigger, not knowing how sensitive it was, only to have shot a customer in the face. Never have I been so terrified at that moment in time.

**tl;dr: Worked retail first day in sporting goods, was assigned a pricing gun, accidentally squeezed the trigger while handling said equipment, blasted guest in the face, glowed red for a split second from said gun, day ended better than expected.**",1427683141,"","False",0,3,"videos"
"i8thepie","","","No matter how many times I watch this exact video, I still manage to find a smile on my face. Thanks for posting and bringing back the feels!",1424358773,"","False",0,7,"videos"
"rickspawnshop","","","I love super troopers, but I call shenanigans on this one. 

I am sure the money will be raised, Zach Braff will cameo and broken lizard will ride off into the sunset. Meanwhile, blue collar society goes back to work to slave at their menial jobs to pay the debt for their $35 movie ticket. 

Buck up buttercups.  Obviously you have connections to get 2m bux, the reality is, according to the people that hold the money, your script is not good enough to warrant the investment. Plan B, panhandling for funding from civilians when you have already proven through a string of mediocrity that a lot of the work you produce is not profitable. Indigogo and Kickstarter ... really? These are for the little guy. Why not apply for welfare? This is bullshit, yes, it's gonna work, these guys will profit off the backs of the lower class and it's all kosher...  but for the record, you broken lizard has officially reached whore status. ",1427226016,"","False",1,1142,"videos"
"rtmacfeester","","","While this looks delicious, Texas would wholeheartedly disagree.",1427817555,"","1427817870",0,-2,"videos"
"Tex-Rob","","","This is one of the most painful things I've watched.

EDIT:  Seriously? gold? and all the upvotes?  Man, this is not the comment I thought I'd get gold and the most upvotes ever on.  I feel like all my witty charm is for nothing.",1423682332,"","1423753369",1,1298,"videos"
"TheFatMistake","","","Everyone can be racist, systemic racism is a bit different. That's a societal thing. On a systemic level, white people don't feel racism.

When a society degrades a certain race, the members of that race perceive *themselves* as lesser as well. As in blacks will have the same or similar prejudices against their own race that is prevalent in the rest of the society. That's why racism is such a hard thing to tackle and why we have things like Black History Month",1425541238,"","False",1,-29,"videos"
"chaznik","","","Same reaction I have when I can't get it up and my girlfriend says it's fine. ( https://youtu.be/zs0mfeCYQB4?t=1m )

Edit: First gold and I had a grammar error? Amazing, thanks so much!",1426987883,"","1427022940",1,331,"videos"
"XXXXXXXXXXXX","","","krautchanner is vote-brigading from 4chan's /pol/. His /pol/ user ID is x5MTW3nr.",1423168486,"","False",0,0,"videos"
"she-who-eats-oreos","","","ITT: ""How can anyone be so mean as to write those letters? Also, damn those are ugly women.""",1426028063,"","False",1,34,"videos"
"AutoModerator","","","Hello /u/sweie,

Thank you for your submission. Unfortunately your account does not have enough karma to post things to /r/videos at this time. 

/r/videos requires users have, at a minimum, 10 link **and** 10 comment karma.  We suggest that you comment in some popular threads and submit links to other subreddits to build up your karma and then come back.

We do this to prevent spammers from abusing /r/videos. We are sorry for any inconvenience caused. We look forward to your submissions in the future. 


*[I am a bot](/r/AutoModerator/comments/q11pu/what_is_automoderator/), and this action was performed automatically. Please [contact the moderators of this subreddit](/message/compose?to=%2Fr%2Fvideos) if you have any questions or concerns.*",1424973463,"moderator","False",0,1,"videos"
"do_usernames_matter","","","OK. First, that green screen was fucking tempting. Second, I've been up since 3 am because of work and I'm only awake and doing this because of two cans of rockstar. Third, I'm not a big time video editor, so excuse the watermark and the poor opacity of the video.

Lastly, watch it while it lasts. I really dunno how long it would last on YouTube before it's taken down for some copyright garbage and it would be gone before anyone sees it but here, I present to you: [Because.](https://www.youtube.com/watch?v=Ttlse8YIGxU)",1432960759,"","False",2,3671,"videos"
"premium_parking","","","http://youtubedoubler.com/elMG

it's kind of hit and miss",1421503983,"","False",1,2,"videos"
"WirtyDords","","","[This] (https://www.youtube.com/watch?v=h0i62GnQoo0) is all could think of after listening to him.",1429536487,"","False",0,1,"videos"
"_Prisoner_24601_","","","She lost the phone. There is no way that she is this stupid. I think that they confiscated it and then lost it or it got stolen from them while they had it. Now they are scrambling and trying to buy some time until they can replace it. I was a teacher for 5 years and every time we confiscated a phone (which wasn't very often because if we actually did this it would consume our entire fucking day) we were told that the phone became OUR SOLE RESPONSIBILITY. If anything happened to it, we were responsible. 


This bitch lost the phone and now she's trying to buy some time. Either that or those 5 degrees she has are just deodorant and she's a fucking moron. 


Edit. Thank you /u/bruhman5thfloor for the gilding ;)",1429155092,"","1429205720",1,2168,"videos"
"Anonymous-Ninja","","","AMA request ",1424444910,"","False",1,14,"videos"
"ClarityEye","","","Interesting that it bloomed at night!",1432138792,"","False",0,1,"videos"
"AutoModerator","","","Hello /u/solnze,

Thank you for your submission. Unfortunately your account does not have enough karma to post things to /r/videos at this time. 

/r/videos requires users have, at a minimum, 10 link **and** 10 comment karma.  We suggest that you comment in some popular threads and submit links to other subreddits to build up your karma and then come back.

We do this to prevent spammers from abusing /r/videos. We are sorry for any inconvenience caused. We look forward to your submissions in the future. 


*[I am a bot](/r/AutoModerator/comments/q11pu/what_is_automoderator/), and this action was performed automatically. Please [contact the moderators of this subreddit](/message/compose?to=%2Fr%2Fvideos) if you have any questions or concerns.*",1421845520,"moderator","False",0,1,"videos"
"GambitsAce","","","I really want to see her reaction to someone grabbing all her fingers and snapping them",1430927031,"","False",1,-2,"videos"
"UpperCaseRock","","","He said it.",1430359969,"","False",0,1,"videos"
"Evo7","","","I like pie",1430306052,"","False",0,1,"videos"
"Fresh_Coffee_","","","Wow, something similar happened in my hometown a few months ago... https://www.youtube.com/watch?v=ylReRL3Q9pY ",1425402809,"","False",1,157,"videos"
"TouchMaNips","","","Jesus Christ.... What happened to her",1431812707,"","False",1,3323,"videos"
"lapetithatzil","","","You cant go to Mea Shearim, a place considered extremist and overly religious by even some orthodox jews and take the reactions of people there as the reaction of all jewish people. This awful title and an out of context snippet from a documentary is the kind of shit that breeds racism and blind hate. 

PS- Also for transparency's sake i'm Israeli.

Edit: spelling",1428582024,"","1428592126",1,233,"videos"
"HashtagRebbit","","","the ban is over pedophilia concerns. They are instructed to have zero physical contact with kids. 


this also happened in australia

http://www.heraldsun.com.au/leader/inner-south/hampton-lollipop-man-reprimanded-for-high-fiving-students/story-fngnvli9-1226605498732

and england 


http://www.dailymail.co.uk/news/article-2488233/Banned-giving-high-fives-Lollipop-man-popular-children-nickname-jollyman-stopped-ONE-parent-complained.html

and canada

http://www.ctvnews.ca/canada/why-kids-can-t-high-five-in-peterborough-ont-1.2123536#


I lost interest in googling them but im sure there's more",1425103938,"","1425105104",0,67,"videos"
"AutoModerator","","","Hello /u/teddybeats,

Thank you for your submission. Unfortunately your account does not have enough karma to post things to /r/videos at this time. 

/r/videos requires users have, at a minimum, 10 link **and** 10 comment karma.  We suggest that you comment in some popular threads and submit links to other subreddits to build up your karma and then come back.

We do this to prevent spammers from abusing /r/videos. We are sorry for any inconvenience caused. We look forward to your submissions in the future. 


*[I am a bot](/r/AutoModerator/comments/q11pu/what_is_automoderator/), and this action was performed automatically. Please [contact the moderators of this subreddit](/message/compose?to=%2Fr%2Fvideos) if you have any questions or concerns.*",1423526914,"moderator","False",0,1,"videos"
"shadowwhy","","","[YouTube Mirror](https://www.youtube.com/watch?v=Mv-O9ZhKX1M)

It was not a parking lot attendant.  It was a [tow company worker](http://thebiglead.com/2015/04/16/britt-mchenry-espn-berates-tow-lot-employee-video/)",1429210950,"","1429211450",1,711,"videos"
"matt_______________","","","Daryl would adapt",1420834120,"","False",0,1,"videos"
"Xskelsior","","","Thank you for posting this video. You and Steve Irwin Just gave me the last bit of confidence i needed, to take the step to travel across the country to get the nature focused education i have been to scared to take for far to long.

No one will probably see this comment, but i am very grateful.

Edit: I am dum Its Irwin, not Erwin. sorry.

Also thank you all so very much, I was really strugling with the decision. Moving away from every thing and everyone is hard. And for some reason the comments of strangers on the internet just gave me so much self confidence to work for my dream. Thank you all. From some weird danish guy.",1429793997,"","1429807947",1,699,"videos"
"Dukekiller","","","So those jews don't see the point they're making against themselves. 

""I was told to do so"" is a thing many Nazi soldiers said after the war. It didn't make them less guilty of the crimes they committed.

edit: added video, giving more context (on Zionists claiming Israel being ""their"" land)

http://www.liveleak.com/view?i=10d_1427997824",1427987100,"","1428009409",1,1763,"videos"
"marshalvichy","","","http://makeameme.org/media/created/Where-were-going-ousiyw.jpg",1421599994,"","False",0,-1,"videos"
"adunski","","","My soul belongs to Italy. My jealousy knows no end.",1424915835,"","False",0,2,"videos"
"thebendavis","","","If this bullshit makes it to the front page, I will eat a dick.  Not a human dick, but some sort of non-raw dick.

edit:  Gold?  Really?  I swear some of you people are total retards.  And where do I get an edible dick?  It's not like you can just swing by a Target and buy some dick.  

OP can and will actually deliver, I just don't know where or how to acquire an actual animal penis that is fit for human consumption.  If Zimmern can do it, so can I.",1422799532,"","1422867296",1,2629,"videos"
"TrevorMooreWKUK","","","HI! I'm Trevor! THanks for posting the song! Hope ya liked it",1425436776,"","False",1,1113,"videos"
"PlaylisterBot","","","^^^^^^^^^^^^^^^^.  
Here's the media found in this post.  Autoplaylist: **[web](//radd.it/r/videos/comments/2ywlbk)/ 
  [mobile](//m.radd.it/r/videos/comments/2ywlbk)**

^^^^^^^^^^^^^^^^.  
^^^^^^^^^^^^^^^^.  


|Link|User|
|:-|:-|
|**[video](https://www.youtube.com/watch?v=QEzhxP-pdos)**|*[AzurewynD](/r/videos/comments/2ywlbk/_/cpdrhb5)*|
|**[Here](https://www.youtube.com/watch?v=D10mb49U-TU&amp;feature=youtu.be&amp;t=12m&amp;ab_channel=ManSeekingWoman)**|*[CaptnandMaryann](/r/videos/comments/2ywlbk/_/cpdvkx3)*|
|**[Unlisted Mirror for mobile users.](https://youtu.be/-wOZjB6ZvZ8)**|*[conenubi701](/r/videos/comments/2ywlbk/_/cpe4psv)*|
|**[Mr. Leahey from Trailer Park Boys.](https://www.youtube.com/watch?v=oo9Ip9FHODo)**|*[electricsheep12345](/r/videos/comments/2ywlbk/_/cpdsioz)*|
|**[Googled it for ya](https://www.youtube.com/watch?v=WFR4PPxp2z8)**|*[Mr\_Strangelove\_MSc](/r/videos/comments/2ywlbk/_/cpdthjp)*|
|**[Try this if you're in the US.](https://www.youtube.com/watch?v=6A4Spxwvajo)**|*[NetTrap](/r/videos/comments/2ywlbk/_/cpdviwu)*|
|**[Feminist bookstore](https://www.youtube.com/watch?v=8IfOKeZ-MWI)**|*[pfunkmort](/r/videos/comments/2ywlbk/_/cpdw4yf)*|
|**[Mirror](http://youtu.be/6A4Spxwvajo)**|*[Quachyyy](/r/videos/comments/2ywlbk/_/cpdujx9)*|
|**[Jim Lahey.](https://www.youtube.com/watch?v=oUFKs9TA4BQ)**|*[randy\_fackler](/r/videos/comments/2ywlbk/_/cpdsvup)*|
|**[Woody Allen does it better.](https://www.youtube.com/watch?v=djQ7WZlb140)**|*[sauttemc](/r/videos/comments/2ywlbk/_/cpe2oqs)*|
|**[Here's another one](https://www.youtube.com/watch?v=D2VsUCYw_JU)**|*[State\_](/r/videos/comments/2ywlbk/_/cpdxdy8)*|
|**[Applying for a girlfriend.](https://www.youtube.com/watch?v=RyU54qk5tgc)**|*[unverified\_user](/r/videos/comments/2ywlbk/_/cpds547)*|
|**[Photay - Reconstruct](https://www.youtube.com/watch?v=gNXzZYitkWM)**|*[unverified\_user](/r/videos/comments/2ywlbk/_/cpdrfof)*|
|**[Youtube](https://www.youtube.com/watch?v=i7fyY0GF2eg)**|*[VapidOrgasm](/r/videos/comments/2ywlbk/_/cpdwhc6)*|
|^^_______________________________________________________________________________________________|^^______________________________|
*^Downvote ^if ^unwanted, ^self-deletes ^if ^score ^is ^0.  ^Comment ^will ^update ^if ^new ^media ^is ^found.*  
[^about ^this ^bot](/1vjdw9) ^| [^recent ^playlists](/r/radditplaylists) ^| [^plugins ^that ^interfere](/1m21ku) ^| [^request ^blacklist](/message/compose/?to=radd_it&amp;subject=Please blacklist&amp;message=Please add me to the /u/PlaylisterBot blacklist.) ^| ^R.I.P. ^/u/VideoLinkBot",1426266336,"","1426285565",0,15,"videos"
"nucklsandwich","","","You and this [guy](https://www.youtube.com/watch?v=Qiwvx7vW3_E) should go on a date.

edit- Thanks for the gold! :3",1430442152,"","1430467118",1,2810,"videos"
"BevoGenocide","","","Didn't see any minorities. I guess this was pre diversity quotas. ",1420503040,"","False",0,5,"videos"
"jones_soda2003","","","That's a pretty great work around.  I can imagine a kid going home and putting their socks on like that and when a parent asks them why they're pinching the tip, the parent loses their shit about it not being abstinent only.  I remember going through abstinence only in the 8th grade and it was just a mind fuck of bad and flat out wrong information.  

Source:  Past and current Mississippian. ",1422053029,"","False",0,2,"videos"
"Doofangoodle","","","Another video on the same theme

https://www.youtube.com/watch?v=n-7y3B8DjGw",1430866431,"","False",1,25,"videos"
"throwaway4727","","","Jehova's Witness. ",1431155847,"","False",0,1,"videos"
"HumanJinn","","","inspiration behind LSP",1427978469,"","False",0,1,"videos"
"da1hobo","","","[Happy](http://sirartwork.tumblr.com/post/40159246633/my-new-years-present-for-fit)

[New](http://sirartwork.tumblr.com/post/71280699540/my-latest-comic-for-fit-panel-by-panel-to)

[Year.](http://sirartwork.tumblr.com/post/106382392098/my-latest-comic-for-fit-happy-new-year)",1422569802,"","False",1,241,"videos"
"chickenbuttenders","","","probably could have been one of the greats. had some sick genetics",1432776328,"","False",0,1,"videos"
"Rybaka1994","","","I was going to write out a bunch of BS, but you know what? I am not black, I will never understand the feelings that these people have. I've never had to go through stuff like they do. I don't get wierd stares from people like my friends do, I don't know what it's like. I'm leaving my opinions out ",1430193239,"","False",0,2,"videos"
