"author","author_flair_css_class","author_flair_text","body","created_utc","distinguished","edited","gilded","score","subreddit"
"hawks03","","","""Please note the suspect uses strong language in this video that may not be appropriate for children""

So I guess that I should mute the video of the man pointing a shotgun at people when I show it to children.",1429597318,"","False",1,2771,"videos"
"TheMizJizz","","","This is weird. I mean I'm black, I watched this entire video and I thought to myself ""that's the stupidest shit I've ever heard. White people aren't the problem."" But then I read the comments you guys wrote on here and I'm thinking ""this is fucking stupid, black people aren't a problem. 

I'm not sure what the problem is but I don't know why everyone hates everyone so much. I've got white friends, black friends, Asian friends and I love Hispanic people the most. (I have my reasons)... why can't we just chill? I mean white men are regurgitating those disproven statistics on every post I read, black people are ignoring BASIC common sense. It's crazy. 

What's even more crazy is that both groups are letting the minority speak for the majority. Like the majority of black people aren't thinking it's okay to throw trash at white people, the majority of white people aren't racist. But for some reason whenever things get out of hand it's like common sense and being rational disappear. I really don't want to bring children into a world where someone will hate him or her for being black, and I don't need my children seeing images of people who look like them rioting in television. Enough is enough. ",1430160631,"","False",1,863,"videos"
"olafthebent","","","Watching little boys grow up is one of the coolest things I have ever been witness to. They do fall down a lot though.

When they're young you get to play with trains and slotcar racetracks... and Lego, lots of Lego. As they grow they get in to model rockets, volcano science projects, and kites. Some begin their love of sports, or camping. Then you get to see their faces as they experience Star Wars or Back to the Future for the very first time and you remember how you felt when it was your turn. 

I love being a Dad",1422648546,"","False",1,187,"videos"
"ShawnWasabi","","","thank youuu!",1429648799,"","False",1,1153,"videos"
"AutoModerator","","","Hello /u/wapzam,

Thank you for your submission. Unfortunately your account is not yet old enough to post things to /r/videos at this time.

We suggest that you wait a while (about a week), while also commenting in some popular threads and submitting links to other subreddits for the time being.

We do this to prevent spammers from abusing /r/videos. We are sorry for any inconvenience caused. We look forward to your submissions in the future.


*[I am a bot](/r/AutoModerator/comments/q11pu/what_is_automoderator/), and this action was performed automatically. Please [contact the moderators of this subreddit](/message/compose?to=%2Fr%2Fvideos) if you have any questions or concerns.*",1426710808,"moderator","False",0,1,"videos"
"gnit2","","","Marine being dumb at 1:00",1425179573,"","False",0,31,"videos"
"Rugged_as_fuck","","","I give zero shits about most things. I'm not an activist for anything. Listening to this woman talk for 27 seconds makes me want to do everything I can to ensure that patriarchal society carries on stronger than ever.",1426390883,"","False",1,3548,"videos"
"sabrefudge","","","Look at those nice big seats, double arm rests, wide aisles, etc.  

It's incredible how much more room there was in airplanes back then.

Especially when you compare the seating layout in that video to [a seating chart from a modern airliner.](http://i.imgur.com/PuSZtt8.jpg?1)",1427523978,"","1427544154",1,81,"videos"
"Belletrix","","","This was an excellent video to me. I saw this back when this debacle was playing out in ""real-time."" What jumps out at me, is the fact that Park had her belief structure toppled with a simple challenge to the parameters of her game. SJW's main method of controlling discourse and raising the hackles of a legion of online keyboard warriors is to define the game in their terms, to draw the lines where they want, and to move goalposts when they need to.

Park's downfall was believing that  her online reality, where she has surrounded herself in that echo chamber of insanity, was that the Host would just crumple, and give in to her SJW dogma. While there are certainly structures in society and other issues still dogging this country, she shot herself in the foot with that half-wit comment. 

First of all, don't come onto an interview expecting to be able to quash someone from talking or offering opinions about something. It's this guys job to travel those avenues of thought, to ask those questions, and to probe your arguments for weak spots. And furthermore, you don't ever just tell someone they are disqualified from speaking about something in ANY capacity. There's a difference between saying: ""You don't understand what it's like to be a person of color and a woman."" and ""You aren't allowed to talk about this because you aren't a person of color, or a woman.""

Social Justice is all well and good, and I'm a strong advocate for introducing more equality and understanding into this country, and world at large. However, there is certainly a right and a wrong way to do these sorts of things. And if you can't tell, telling people to be silent, and disregarding them on the basis of their race, their sex, their orientation, their blahblahblah... is the ANTI-THESIS of your movement. Funny how sometimes, you fall so far, you start to look like the thing you are fighting.",1432260443,"","False",1,2446,"videos"
"AutoModerator","","","Hello /u/hannibaldarcy1,

Thank you for your submission. Unfortunately your account does not have enough karma to post things to /r/videos at this time. 

/r/videos requires users have, at a minimum, 10 link **and** 10 comment karma.  We suggest that you comment in some popular threads and submit links to other subreddits to build up your karma and then come back.

We do this to prevent spammers from abusing /r/videos. We are sorry for any inconvenience caused, and look forward to your submissions in the future. 


*I am a bot, and this action was performed automatically. Please [contact the moderators of this subreddit](/message/compose/?to=/r/videos) if you have any questions or concerns.*",1432930446,"moderator","False",0,1,"videos"
"[deleted]","","","[deleted]",1429014540,"","False",0,1,"videos"
"kirualex","","","Why not just left-click with a left-eye wink and right-click with a right-eye wink?
That would be a clever option I think.",1433096720,"","False",0,2,"videos"
"fuck_steve_harvey","","","This is my moment

edit: Thank You Based God",1420308533,"","1420442131",2,3074,"videos"
"ULICKMAGEE","","","Now this is my type of Glee:)",1429879742,"","False",0,125,"videos"
"BRAlN","","","men that own or would buy a Leatherman are not the kind of men that would wear bangle jewellery. ",1422269674,"","False",0,1,"videos"
"dashdriver","","","This will probably get buried, however something needs to be set straight here.

The ""dip"" (or roll) of the wings at the end was not an aerodynamic stall. The crew reported they had an engine failure after takeoff, so what you are seeing here is a Vmc roll. Vmc is defined as the minimum controllable airspeed with one engine inoperative. When you go below this speed, you can have the controls at the stops to make the airplane go in one direction  and the airplane will start going the exact opposite way. I should add that with an engine out, you can not let go of the controls and assume it will fly straight. In this case, with the left engine out the crew likely had right aileron in as well as a lot of right rudder. The slower you go, the more control deflection you need to keep the airplane going straight with one engine inoperative, and vice versa. Vmc is point (speed) at which the controls are fully deflected (in this case to the right) and you're going in the opposite direction (left)

The reason it's not a stall is:
A.) with a relatively straight wing like this, the wing is designed to stall at the root of the wing and not the tip (thus not a ""tip stall""). This is for the crew to maintain control throughout the stall, because the ailerons (providing roll control) are located at the tip of the wing. 
B.) even if the left wing tip had stalled, there is still another aileron on the right wing PLUS a roll spoiler. That should have been enough to counteract any rolling tendency associated with a ""tip stall"". 
C.) Some multi-engine airplanes are designed to stall before they enter Vmc (the stall speed is above the Vmc speed). That is only usually the case with small, twin engine trainers in which pilots first get experience flying multi-engine aircraft. Large turboprops don't have this protection (Vmc is higher than the stall speed) because it wouldn't allow the engineers to fulfill the design goals and typically these airplanes are flown by professional crews who should never allow the airplane to get that slow in a one engine inoperative situation.

At my airline, the Vmc speed for my airplane is mentioned maybe once or twice throughout our groundschool before we actually fly the airplane. There's no mention of the speed in our manuals anywhere and I couldn't tell you what that speed is off the top of my head. The reason for this is that we have a speed on takeoff called V2 which is defined as the ""takeoff safety speed"". This is the speed that we fly with an engine failure on takeoff. We are taught to NEVER go below this speed. This is because once you start going below V2, and getting closer to Vmc, it gets exponentially harder to get back to V2. In the bottom half of the range between V2 and Vmc you most likely have to start descending towards the ground to regain airspeed to get back to V2, which goes against all of our natural piloting instincts, as if you're too low, you'll hit the ground before you achieve V2 again.

There's a video on youtube of an airplane vmc rolling and it is very similar in the way the airplane behaves to this accident.

Source: Turboprop pilot flying an airplane very similar to the accident airplane in terms of weight, size, powerplants, etc.

edit: wow thanks for the gold!",1423068477,"","1423106510",1,166,"videos"
"elyrly","","","JT on SNL

http://vimeo.com/62543617

edit: Thanks for the gold!!!",1422945243,"","1422946476",1,117,"videos"
"njoy23","","","I use a product called fresh balls to keep me fresh, not to far off...",1429298509,"","False",0,1,"videos"
"Cianf","","","Shut up ya grape looking slut",1429833215,"","False",1,1707,"videos"
"grinkyle","","","I also died 3 clicks in. I tried using rational thinking and explaination, what the fuck was I thinking?",1420149297,"","False",1,135,"videos"
"identifier1","","","If only my hyper-active, dipshit dog would do this. Bitch is craaaaazy for walks.",1423209373,"","False",0,1,"videos"
"im_eh_Canadian","","","can this thread not turn into a men vs women circle jerk.

this video is nothing more than an abusive parent. 

",1422243439,"","False",0,0,"videos"
"CHERNO-B1LL","","","Sorry but Jeremy Kyle would face fuck his own Gran for a round of applause. He will take any stance on any situation after weighing the audience reaction against the wider public's reaction. Here's to the one eyed king. ",1431562279,"","False",0,1,"videos"
"agentx85b","","","Hey, that's my video!

FWIW, The wide-angle 170-degree lens at the top of my helmet doesn't do the speed or proximity of the vehicle justice.  We were going much faster and my front tire actually hit the car because I couldn't stop in time.",1425066389,"","False",1,-1,"videos"
"doopercooper","","","HailCorporate",1423452108,"","False",0,-2,"videos"
"[deleted]","","","[deleted]",1430415052,"","False",0,0,"videos"
"MontyMidas","","","So which one killed a certain king?",1428805242,"","False",0,2,"videos"
"deadpa","","","Finnish blockbuster checklist  

* teenager protagonist with bow and arrow  
* black president  
* terrorist plot
* campfire  
* jumping off a mountain  

This one is gonna roll in the euros boys!",1420562025,"","False",0,923,"videos"
"ryan_turner","","","My guess is that line was put on both switches and the outlet in parallel, which then was put in series with the overhead light. The overhead light then returned to neutral. The vanity mirror light had no line connection.

Luckily a hair dryer is really just a resistive load so this person didn't end up damaging anything. Other appliances like those with large motors or halogen lights could've been damaged.",1424975832,"","1424982911",1,2596,"videos"
"WiglyWorm","","","Seriously, those of you who were not old enough to appreciate the 80s/not even alive for the 80s (jesus I'm old), this film is hitting *every single* 80s cliche and trope at *exactly* the right time. Yes, everything in the 80s was this cool at all times.

* Video games/arcades are evil
* Absurd origin story which is never touched on again
* The whole scene at the police station
* The primitive computer interfaces ""You are about to hack time. Are you sure?"" Is honestly a prompt I feel like you would see in an 80s movie.
* Crazy stuff happening through the phone (magic and psionic abilities or even hacking people's brains via phone was a VERY common trope. Bill Cosby once strangled someone through a phone in Ghost Dad)
* The lazy exposition
* Everyone's story is accepted with no question.
* Things getting boring? Introduce a dinosaur.
* Product placement  
* Nazis/kill hitler
* Animated sequence was every 80s cartoon at once
* Hacking can do everything
* No one ever has to reload.
* Every 80s ending
* Tracking problems at both ends of the tape
* David Hasselhoff/needless celebrity cameo

Everything.

Edit:

##[COCAINE](http://i.imgur.com/yNLw74c.jpg)

Thanks /u/Exist50",1432845373,"","1432860809",1,2903,"videos"
"breakingbaddy","","","Are these movies worth watching if I'm not into anime? I've heard a lot of praise but am not sure if it's for everyone or just people into anime?",1429659723,"","False",1,82,"videos"
"forgottentaters","","","Maybe its just me, but that dude sounds just like Obama or at least has very similar mannerisms.

A badass, magazine wielding, ninja Obama.",1424199158,"","False",0,2,"videos"
"poondox","","","Looks like he had vomit on his sweater.",1431623202,"","False",0,1,"videos"
"dyte","","","I JUST SMOKED THE WRONG SIDE OF A CIGARETTE!! Who wants to go swimming?!? This song is about MEEE! *BANG CRASH FAIL*",1432621486,"","False",1,244,"videos"
"FuckVettel","","","##**""*But your honor, all the other judges let us lie.*""**",1427512666,"","False",1,147,"videos"
"Mimos","","","That was mighty white of the guy who had his shirt stolen. Helped him up, dusted the bark off him and left.

Edit: for fucks sake guys it was a joke. I'm black as burnt charcoal. 

Edit 2 - no I'm not black. I was curious if the votes would climb the other way if I said I was. And guess what? They did!  Racial bias for everyone!",1424594539,"","1424624042",1,253,"videos"
"djmastermind","","","I work at an airport. Unfortunately, this type of thing isn't too uncommon. I witnessed a lady who missed her flight because she was outside smoking. No one was at the gate because they were sending the flight off. She began banging on the jetbridge door, screaming, and crying. I honestly thought she was going to break the glass door. 

After that was unsuccessful, she walked behind the counter and started talking on the radios (to our airline operations who have no idea who the hell was calling them) and making PAs over the entire terminal of a huge, major metropolitan airport. She was clearly having a serious breakdown.

It was funny like this video is, but upon further reflection, I have no idea what's going on in these peoples' lives. They may be going to a funeral or they just ended a lifelong marriage after they were cheated on. We just can't know. It's no excuse for behavior like this, however.

**TL;DR: Work at airport and saw a lady act very similarly to missing a flight by screaming, crying, making calls over public address system.**

edit: formatting
Edit 2: thanks for the gold!",1421780974,"","1421801121",1,1150,"videos"
"lozzobear","","","Right, I'm going to bed. The last few hours have been truly exhilarating. Thousands upon thousands of people have listened to my greatest fart, and my arse now has an agent. I'm just not sure how tomorrow is going to get any better. But you never know.",1431877072,"","False",0,2,"videos"
"[deleted]","","","[deleted]",1432091924,"","False",0,1,"videos"
"SLCPHARAOH","","","Or, you know. Maybe just use a toilet. ",1429767111,"","False",0,0,"videos"
"[deleted]","","","[deleted]",1429676237,"","False",0,1,"videos"
"truelai","","","How can one not upvote this video?",1422832252,"","False",0,13,"videos"
"sqew","","","[Part 1](https://www.youtube.com/watch?v=YxgsxaFWWHQ)",1423497618,"","False",1,1317,"videos"
"Prettyfat","","","And by slowed down you mean boring as fuck and overrated, right?",1427287560,"","False",0,-1,"videos"
"darthbone","","","People hate certain genres because they feel like the majority of that genre's fans do not recognize the popular music in that genre for what it is, which is usually a vapid cash grab with no substance. Country, to me, is one of the worse offenders for this because Country has a very very strong identity that it purports, and it's a very shallow one. It's just the white version of hip hop, except every now and then a hip hop artist with something to say actually gets popular.

In reality, what people HATE is Bro Country. Bro Country is indefensibly shit. It has little to say, and what it is saying is shitty. It erodes the listener's taste in music. It's the height of vapidity in popular music right now. POP has far more depth than Bro Country right now.

Country on the whole still has plenty of gems, like [this](https://www.youtube.com/watch?v=7NJqUN9TClM). Fantastic lyric writing and perfect musical accompaniment. That's what Country is capable of - Something that feels distinctively American, relatable, and heartfelt.

",1420743923,"","False",1,123,"videos"
"twolaces","","","WHAT THE HELL HAPPENS AFTER THE VIDEO
",1427849912,"","False",0,1872,"videos"
"p7e9W8itt1tYayZn","","","The american cop wouldn't have missed the head though... xD",1424987445,"","False",0,0,"videos"
"Adamcolter80","","","For those of you that don't like country music, the change in perspective from a fan's viewpoint to a performance artist's is still worth the watch.  ",1432618135,"","False",1,4,"videos"
"Agricocacola","","","This was a good video of a butt.",1430977196,"","False",0,5,"videos"
"CivilityBeDamned","","","Huh. I'm not sure if I'm more disappointed that the joke made it to live television, or that it made the front page of Reddit. You are all stupid assholes, just like the viewer audience that was directed towards. Congratulations on seizing upon worthless bullshit.",1426726621,"","False",1,-17,"videos"
"condherry","","","Appears on live TV wearing a fedora. Must be a redditor.

Edit: My first gold!? I'm selling out and going Hollywood. All further comments will be posted by my agent. ",1424994412,"","1425006944",1,1127,"videos"
"Dwight--Schrute","","","Fuck these SJW mods.

Got banned for a month, lol. 

",1429582219,"","1429772868",0,103,"videos"
"AutoModerator","","","Hello /u/herpderp420rektskrub,

Thank you for your submission. Unfortunately your account is not yet old enough to post to /r/videos at this time.

We suggest that you wait a while (about a week), while also commenting in some popular threads and submitting links to other subreddits for the time being.

We do this to prevent spammers from abusing /r/videos. We are sorry for any inconvenience caused, and look forward to your submissions in the future.


*I am a bot, and this action was performed automatically. Please [contact the moderators of this subreddit](/message/compose/?to=/r/videos) if you have any questions or concerns.*",1430734942,"moderator","False",0,1,"videos"
"some_heavyshit","","","So if you fall that's pretty much a wrap on your meatsicles.",1427873465,"","False",0,1,"videos"
"maximuszen","","","What did you expect. They're fat.

edit: Thank you anonymous. My first. I thought I was going to catch flak for it. Wow! Thanks again.",1427460934,"","1427481387",1,98,"videos"
"Phil_Phil_Connors","","","Can someone explain to me why this has over 3,000 upvotes and only 1,000 video hits?",1425428270,"","False",0,1,"videos"
"zaahc","","","This is an absurdly blanket statment. I'm Christian. Catholic, in fact. And not 3 hours ago I was at the Western Wall. During Passover. With a Palestinian guy that was showing me around. We had Islam, Christianity, and Judaism all mingling...and nobody was anything but polite and respectful. 

EDIT: To put an end to the private messages questioning the honesty of my post: http://i.imgur.com/89QlIOx.jpg",1428585585,"","1428588878",1,203,"videos"
"reliable_information","","","My shields can't repel hype of this magnitude",1429211464,"","False",1,585,"videos"
"Natchil","","","I did almost the same thing when i was in thailand. 

Yes kids, you can touch, you can touch (   [\)](http://i.imgur.com/eKK5ZxT.png)
",1422653037,"","1422667164",1,589,"videos"
"r0bbiedigital","","","if i fell like that, it would fucking hurt... good job",1421506767,"","False",0,2,"videos"
"AutoModerator","","","Hello /u/Deletrious26,

Thank you for your submission. Unfortunately your account does not have enough karma to post things to /r/videos at this time. 

/r/videos requires users have, at a minimum, 10 link **and** 10 comment karma.  We suggest that you comment in some popular threads and submit links to other subreddits to build up your karma and then come back.

We do this to prevent spammers from abusing /r/videos. We are sorry for any inconvenience caused. We look forward to your submissions in the future. 


*[I am a bot](/r/AutoModerator/comments/q11pu/what_is_automoderator/), and this action was performed automatically. Please [contact the moderators of this subreddit](/message/compose?to=%2Fr%2Fvideos) if you have any questions or concerns.*",1423813633,"moderator","False",0,1,"videos"
"Mugros","","","weow",1431249654,"","False",0,1,"videos"
"happyperson","","","I realise that the west is a long way from perfect, but the middle east has some seriously peculiar social and moral conventions .",1427806639,"","False",0,-4,"videos"
"ResLifeSpouse","","","I still believe that J.J. Abrams missed the opportunity to pull off the greatest April Fools Day prank in history. Even topping such pranks as ""War of the Worlds"". All he had to do was release the trailer for the first time and as the camera pans over the desert with the somber music playing, you would see Jar Jar's face pop up and him say ""MEESA BACK!"" then cut to the title. 

It would have been legendary!",1431107685,"","False",1,1410,"videos"
"cky_stew","","","I'd want a cigarette too if I was locked away for my entire life.",1430014745,"","False",0,1,"videos"
"yungdylan","","","As an aspiring producer I've been stuck with a writers block for the past weeks, your dog helped me find inspiration. THank YOu DOg
https://soundcloud.com/whitemozart-1/thankyoudog/s-XQdB4

",1426397991,"","1426404294",2,1518,"videos"
"drumersrule","","","I'm all about highlighting this positive encounters. But I feel like videos like this than reach a large audience muddle the discussion on systemic problems. I assume the majority of American are not anti-black or white supremacists. There is still a system that favors whites over non-whites. Cops thst shoot and kill black men are likely genuinely concerned for their life, but this genuine fear response to a dark skinned suspect is likely ingrained at a young age and through adult life through years of black stereotyping in the media and other avenues.
Not at all cops are racist, but this doesn't negate the issue at hand.

I'm a white male from an affluent family. My parents never taught me how to act around police. I have the privilege to never have the fear that police would single me out.",1428855471,"","False",1,278,"videos"
"Dog_Laming","","","That's Japanese",1421126819,"","False",0,5,"videos"
"Siiitttdown","","","wow this is amazing!",1428983982,"","False",0,1,"videos"
"tritter211","","","
lol for a bunch of people who proudly proclaims about the virtues of critical thinking, you sure lack the ability to use it, redditors.

http://en.wikipedia.org/wiki/Protocol_Concerning_the_Redeployment_in_Hebron

Read that link and tell me how this is discrimination. Both Palestine and Israel agreed to have a 80:20 control over Hebron. So why do you find it surprising when people are enforcing this agreement. 

Its kind of like signing a agreement with US military in a foreign country for building base and call the US personnel as 'racists' for not allowing the natives to enter the US designated land. ",1427997906,"","False",1,242,"videos"
"1live4downvotes","","","ethernet cable...my guess this video is from 4-6 years ago.",1428643861,"","False",0,-2,"videos"
"[deleted]","","","[deleted]",1432562808,"","False",0,1,"videos"
"DlinKing","","","Somehow read that as ""Blonde girl tries to use door""",1420490386,"","False",0,1,"videos"
