"author","author_flair_css_class","author_flair_text","body","created_utc","distinguished","edited","gilded","score","subreddit"
"DetGordon","","","So I'm the center of the universe? As if I didn't know that already...",1431635324,"","False",1,572,"videos"
"Number6isNo1","","","Apparently, she was towed by a towing company that is notorious for being scumbags. So she is pissed off at the person working at the towing company. I'm not saying she was in the right, but there may be more to the story here than the ""entitled bitch"" narrative.

Source: http://www.arlnow.com/2015/04/06/morning-poll-doing-their-job-or-preying-on-you/  ",1429211837,"","False",1,355,"videos"
"aaronisu","","","Growing up, I thought this sing was an original work written and performed by the one and only California Raisins.  Turns out the California Raisins were just a bunch of talentless hacks.

Growing up was hard.",1423921840,"","False",1,102,"videos"
"non-troll_account","","","This made me smile so hard. Such feel goods. ",1430724472,"","False",0,1,"videos"
"CaptionSkyhawk","","","I sped up the nut shot to the original speed (Assuming it was orginally slowed down 8x) http://i.imgur.com/uIhvNqG.gif

EDIT: Bonus Gifs

Normal Loop: http://i.imgur.com/kGBWGHA.gif

Seamless Loop: http://i.imgur.com/hlvUihK.gif

Downvote: http://i.imgur.com/s8VbJsh.gif",1427862194,"","1427896708",1,351,"videos"
"juanjing","","","Assholes gonna asshole. This person would be this intolerable if she were advocating for tastier school lunches.",1426397539,"","False",1,3462,"videos"
"fameistheproduct","","","To paraphrase Mitchell and Webb, ""and how do these trolling viewers count in terms of ratings?""

https://www.youtube.com/watch?v=3ss-59fi4nM",1424434271,"","False",1,106,"videos"
"DeniseDeNephew","","","That was pretty awesome, but I wouldn't call it ""vs"" because they seemed to be playing in complete harmony.  I wonder if any really young fans ever go to a Foo Fighters show and are shocked to see Dave play the drums so well?  Someone could probably toss a tuba on stage and Dave could play it.  He's a great musician.",1427534344,"","False",1,3,"videos"
"[deleted]","","","[deleted]",1423975860,"","False",0,1,"videos"
"NicknameInCollege","","","That banjo player be like

""Think of Disneyland Jimmy, this gig is paying for the summer Disneyland trip..  just keep playing the banjo Jimmy.  The kids will be like ""What an awesome dad we have for taking us to Disney"" and maybe they won't grow up to be fame-floundering butterfly wenches..  Keep playin that chord Jimmy!""",1431814502,"","False",1,2968,"videos"
"grelch","","","Whenever I see clips of Mr Rogers, I remember for a brief moment that somewhere inside me there are still the remnants of a person who isn't always a cynical, tired dickhead. And I am grateful for that, as I am grateful to have grown up watching him. The world misses you Mr. Rogers, or at least I sincerely hope it does.",1426895511,"","False",0,20,"videos"
"tauntaun-soup","","","Stopping distances...
[Imgur](http://i.imgur.com/j493KzD.png)",1429737528,"","False",0,1,"videos"
"deadlywoodlouse","","","Jesus, that dog's not eating the food, it's inhaling it.",1425342327,"","False",1,2978,"videos"
"ManBearScientist","","","To be fair, the point of amateurism in the beginning wasn't to exploit athletes.  It was invented in England in the late 1800s after poor workers tried to join professional sporting clubs on their downtime to make extra money.  Thus, amateurism was invented to segregate people based on class and race.

Oh wait, that doesn't make it any better at all.  The whole idea of college sports in America started when Princeton and Harvard copied the concept from Europe, and it was very much an exclusionary policy.  I'm not sure what is worse, glorifying a concept that is rooted in segregation or converting it into for an way to exploit the very people the policy was designed to segregate.  ",1426526102,"","False",0,0,"videos"
"AutoModerator","","","Hello /u/putwittycomment-here,

Thank you for your submission. Unfortunately it was removed because it is currently an attribution link and not a direct link to the video. To have your post reapproved, resubmit it using the direct link of the video.

Your current URL looks something like this: `http://www.youtube.com/`**attribution_link?a=TMeg_i9TKqs&amp;u=**`watch?v=dQw4w9WgXcQ`

You will need to replace URL so it looks something like this: `https://www.youtube.com/watch?v=dQw4w9WgXcQ`.

[If you need any assistance, feel free to contact us](https://www.reddit.com/message/compose?to=/r/videos&amp;subject=[AutoMod]%20R5%20-%20attribution%20link%20removal%20assistance&amp;message=%28Optional%29%20Please%20enter%20more%20info%20here.%0A%0A---%0APlease%20don%27t%20edit%20anything%20below.%0A%0ASubmittor:%20putwittycomment-here%0A%0ATitle:%20""Who Brings a Weed Wacker on a Boat""---My S.O just bought a Weed Wacker, this is all I could think about.%0A%0AURL:%20http://www.youtube.com/attribution_link?a=aYMnQVYlkYg&amp;amp;u=%2Fwatch%3Fv%3D85-2A0PHLIc%26feature%3Dshare%0A%0APermalink:%20http://www.reddit.com/r/videos/comments/2uny94/who_brings_a_weed_wacker_on_a_boatmy_so_just/).


*[I am a bot](/r/AutoModerator/comments/q11pu/what_is_automoderator/), and this action was performed automatically. Please [contact the moderators of this subreddit](/message/compose?to=%2Fr%2Fvideos) if you have any questions or concerns.*",1422990003,"moderator","False",0,1,"videos"
"Tresky","","","Hey guys! I'm Tyler from Limbitless Solutions. I am one of the head directors of the company. I heard you guys liked our video! :D

If anyone is interested in supporting our nonprofit or even joining and contributing, please visit [3Dhope](http://www.3dhope.com).

Let's get this post to the top. We rely on generous donations of people believe in our mission. 100% of donations go into arms and parents are never charged.

Edit: Thanks for the gold, stranger! You are awesome! :D",1426195856,"","1426219716",1,75,"videos"
"hornyholio","","","come with me if you want to live",1421756455,"","False",0,1,"videos"
"DeviArcom","","","Guys, This guy only has one third of the best conditions to produce these effects through video feedback. 

1. The key condition is to get a camera that is able to make its output to the TV in negative colors. That way when the camera sees the negitive on the screen, it negates that back to regular. 

2. The other condition is to have a camera that can mirror it's output. So when the camera sees it's own mirrored output, it magnifies the effect making much more vivid and long lasting fractal patterns. 

[THIS VIDEO](https://www.youtube.com/watch?v=ulPmf6ZPPwI&amp;list=FL_Dq1v9jmEdHUtTbRXoJ2tg&amp;index=6) shows the best example of all 3 of the conditions.

*Note* At **1:36** you can see him turn on the ""negative output"" mode
         
At : **3:42** you can see him turn on the mirror mode.

Finally--- At **5:15** you can see he somehow injects color into the mix and amazing things happen. I hope someone follows this guide for the best example of this phenomenon I've found.

Edit: Plus, much better music.(and thanks kind stranger!)",1421723040,"","1421767491",1,774,"videos"
"mikitronz","","","Nope, turns out it really was all going to be in another language. ",1422932201,"","False",0,1,"videos"
"shipshipship","","","&gt; Greetings organic humans. Kevin.

Edit: Thanks for the gold!",1431320696,"","1431357821",1,377,"videos"
"AutoModerator","","","Hello /u/ezzzidan,

Thank you for your submission. Unfortunately your account does not have enough karma to post things to /r/videos at this time. 

/r/videos requires users have, at a minimum, 10 link **and** 10 comment karma.  We suggest that you comment in some popular threads and submit links to other subreddits to build up your karma and then come back.

We do this to prevent spammers from abusing /r/videos. We are sorry for any inconvenience caused. We look forward to your submissions in the future. 


*[I am a bot](/r/AutoModerator/comments/q11pu/what_is_automoderator/), and this action was performed automatically. Please [contact the moderators of this subreddit](/message/compose?to=%2Fr%2Fvideos) if you have any questions or concerns.*",1421276247,"moderator","False",0,1,"videos"
"Evillish","","","That video literally had something for everyone. Exotic cars, pretty women, a pregnancy, then the baby. Travel, food and drinking. Men demolishing a house then reconstructing it. Your life seems pretty awesome OP and it instantly makes me like you a little less for it.

Edit: My first gold? Thank you kind stranger! 2015 is looking is up. OP your last year was so good it's getting people gold. ",1420131976,"","1420133782",1,30,"videos"
"GettingHazy","","","I like the video, but the music was so loud it covered up the dialogue way too much. Far too many videos/documentaries mess up with their audio balance. The music should be in the background not over a soft voiced speaker.",1425355303,"","False",0,9,"videos"
"slowe417","","","""It's suppose to be an inconvenience. We want them to recognize the inconvenience young black people go through on a day to day basis..."" *cuts to black person trying to get through line.

E: GOLD! Thanks!",1429594354,"","1429649474",1,5068,"videos"
"Deploytosave","","","Was waiting for the ""allahu akbar"" to start ",1423455127,"","False",0,1,"videos"
"mullonym","","","The only thing better than the story itself is imagining that this girl was not a scammer, but in fact totally genuine and honest. 

Sincerely,

T.V. Shows

edit: I win at poker three times in a row and now gold! thanks kind stranger.",1421196385,"","1421784237",1,1206,"videos"
"thisMFER","","","Nice! I can't wait to try Armenian BBQ",1427839472,"","False",0,3,"videos"
"Paseo91","","","This is a mockingbird! Beautiful creatures, but very loud. What you're hearing is his mating call. He will basically do this for weeks on end until he finds a mate. Anyway, long story short... you're gonna have to fuck it. Hope this helped. ",1429384465,"","False",1,2868,"videos"
"Glass_Jaw","","","When he says ""You look *fantastic*"" when they're supposed to be 70,  the amount of earnestness in that compliment is what I think everyone is searching for in a relationship.",1431648159,"","False",0,11,"videos"
"greek06","","","If you think this comment is great.. give me gold... if you hate this comment give me an upvote.. it really helps me out

Edit: thanks for the gold.. my biggest comment so far",1430391338,"","1430413018",1,3590,"videos"
"[deleted]","","","The only reason you guys are supporting this shit is because they are black.

It is a black kid getting slapped around by his own father, so you guys really don't give a shit. You are not seeing the broken heart of a son, you are seeing a potential future gang member being set straight. Just because something makes sense doesn't mean its the truth.

If his father showed his son love and had frequent positive communication in the first place he would not have to slap him to keep him out of a gang in the first place.

This kid is not a psychopath or he would have hit back, its as clear as daylight he is joining a gang for acceptance, something he wouldn't have to do if his father had more compassionate channels of  communication.

 He might not join a gang, but he will not grow up to be a very loving person after this

Take a good look at your comments. *""Father of the Year""?* Really? Do you really have such a low perception of black people that this is considered the prime example of a father? Reddit seems to have forgotten its sense of logic today and jumping right into the emotional circlejerk of *""Hurr durr minorities only understand with a good 
slap to the face"".*

Edit:Thanks to the kind stranger that gave me gold :)

To all the people that seem to be disillusioned by the hate and anger in this post: Don't worry, it will be alright. You are not the only loving and reasonable person even when the world makes you think so. Hate is contagious because its a disease, while love and happiness is inside ALL of us, its just hidden sometimes by personal fears and traumas.

**Pro-tip**
 When reading this comments ask yourself: ""Is this poster truly concerned with an effective discipline method which leads to a happy and enlightened society? Or are they trying to vent their own personal frustration and anger at world they perceive as threatening""

Do this and the truth will be clear: Happiness and love is inside all of us, hate is just an illusion.",1420139452,"","1420157982",1,28,"videos"
"chris1989ryan","","","Wow, that giraffe came out of nowhere.",1432989256,"","False",0,2,"videos"
"spiffyclip","","","He sounds exactly like the guy from [Straya day](https://www.youtube.com/watch?v=F4AchHTN-XQ).  Same upward inflection and everything",1429525514,"","1429529953",0,168,"videos"
"rblue","","","My dad had accidentally launched his car off a curb when I was a kid. I remember all the cars behind us just went ahead and followed.",1421156249,"","False",0,1,"videos"
"shawnxstl","","","100% would not feel bad for you at all for getting fucked up for antagonizing a wild ass animal such as a lynx. 


That being said, a lynx would be a cool pet to have. I wouldn't be trying to piss it off though. ",1427530583,"","False",0,7,"videos"
"DrWangPenisInspector","","","I went to high school w/ this guy. He never showed racial tendencies. This is somewhat surprising considered he had black friends in HS. College changes people. He fucked up big time",1425915254,"","False",0,1,"videos"
"seaglow999","","","I want one of their jackets. Where can I get one?
",1423180076,"","False",0,1,"videos"
"laserskydesigns","","","I just realized this is how Mac must see himself

",1432851641,"","1432872185",1,1834,"videos"
"Cloudy_mood","","","I'm a server in a fine dining restaurant in the US. I also like to eat at restaurants as well. At the place I work at, we receive a little info sheet about your past, or favorite drinks or dishes or if it's your birthday. I read every single guest to see if they like a server to be present or if you want to eat and get the hell out of there. 

I'll recommend the best cocktails, wine, or sodas- whatever you like to drink. If you're not sure, I'll give you a few choices. You like red wine, but want fish? I'm not going to judge you, you're paying the money- so I'll start talking about reds. 

I'll tell you where the specials are, I'll point out the popular dishes based on what kind of food you like(maybe determine it by what you chose to drink), I'll explain them in detail and make them sound appetizing. There are one or two dishes that are underwhelming-so I'll steer you away from those without making them sound bad. 

I'll have a nervous breakdown if your apps, salads and entrees don't come out on time. Not in front of you, but if your items aren't getting to you when they should- I'll most likely take that item off your bill. Your water will never be lower than half. My server assistant and I will make sure of that. I'll always politely ask if you want another cocktail, and get it to you in record time. I make sure each course is perfect- if not, we fix it for you immediately. Birthdays and anniversaries are handled above and beyond(no, we don't sing or clap- we do something else but I don't want to say because I signed a contract I won't talk about my particular store on social media), and if you're cool- I'll have my manager take care of your dessert. I invite you to come back to the restaurant, because you're keeping the place open. I work at 100 percent energy to make sure you will never forget your experience at my place and because of the incentive of a 20% tip. 

I've never experienced what I do anywhere else. I've had great servers- but no one who goes out of their way like myself and the other servers that I work with. We are a well oiled machine. 

Because I work in a big city, I've waited on every nationality.  I wait on a lot of people who bring their culture with them and screw my night with some made up tiny tip because they don't tip in their country. (By the way- if I'm ever lucky enough to visit your fine country, you can bet your ascot I'll do my research and learn what the proper etiquette is at a nice restaurant.)

 I wait on a lot of rich people, and I've waited on people that can't afford to eat where I work. I've waited on celebs. Everybody. And regardless of class- and even what they tip- 98% people I wait on know how good they were just taken cared of. My staff and I deserve 20% because the attention you get is ridiculous. We don't always get it, and it's always a shock because our restaurant is designed to go above and beyond. That doesn't change my attitude, because everyone is spending money, and everyone deserves the best experience. Not every tip is 20%, and I don't lose my mind over it, tips just vary- as long as I'm paying bills- I'm happy. 

I work my ass off to make good money so I can support myself and my son. I'm a single dad(no Chris Rock, I don't need a medal).  I'm yelled at by ignorant people, I wait on con artists, people who call and lie so they can get things for free- people who don't tip anything, but the truth is every job is hard and there's always down sides. But I work at my restaurant because it's the best. 

If you take tipping away, we'll all have to find something else to do, but you will most likely not get your drink on time, you'll get your food however it comes out and it certainly won't be comped if it's wrong. You will get special spiels like--(We have salmon and Mahi Mahi tonight served with...rice...and it's 25.95...ready to order?) instead of the protein, starch, veg, and sauce description. Why is this dish good? What makes it unique?  Servers who don't know or care anything about the food or drinks(one server at a really nice place I went to didn't know what a vodka Gimlet was; I certainly didn't judge him but was surprised), and you'll basically be waited on by someone who doesn't give a shit. 

The funny thing is, most people *want* great service, and that attention to detail. I've waited on SO many families that you can tell they're dying for a good drink and a dinner they didn't/or don't know how to cook at home. But if the initiative is taken away, you're going to get half assed service and be more stressed than when your boss is yelling at you while you're at work. So take tipping away, and be prepared for an eye opener. 

**TL;DR** Take tipping away, fine- we'll have to find different jobs. But you'll have the service equivalent of Walmart at your favorite restaurant. 

**EDIT** WOW! Thank you for the gold!! ",1421127854,"","1421142994",1,6,"videos"
"furrowsmiter","","","Perhaps if her opinions weren't stupid, people wouldn't call her opinions stupid.

Edit:  Damn! Thanks for the gold, single person...and the karma, everyone.",1432257059,"","1432297384",1,4433,"videos"
"featherrocketship","","","There is a lot of worthwhile info in this video, and I appreciate that it exists and has been posted here. My only concern is that it's easy to misconstrue this video as an argument that sexist practices don't exist when it comes to the job market. Yes, wage gap statistics are misleading, and we ought to know what we're actually referring to when we talk about this thing, rather than assuming that women in the same jobs as men, at the same level, with the same amount of experience, etc. etc. get paid ~70% what their male counterparts do (sometimes this happens, but if Maddox has reviewed the information accurately, the frequency of this kind of pay discrepancy is not as common as the statistics have been used to suggest).

At the same time, this video admits that part of the discrepancy comes from differences in gender distribution within factors like occupation, economic sector, and willingness/ability to negotiate salary. It is worth taking a critical eye to the fact that these factors effect so significantly the average salaries of men vs. women. Why are men more likely to have jobs in professions with high average salaries? Why do women feel unwilling or unable to negotiate their salaries more often than men do, on average? Are there cultural factors at work here that operate on a sexist level? Are women are encouraged/incentivized culturally to value and to choose certain professions over others (and men encouraged and incentivized to choose other ones) on average? Are men told that they have to be assertive, upwardly mobile, ambitious, and financially self-sufficient, while women are often taught to emphasize and value being respectful, gracious, grateful, and able to ""balance"" domestic life with their professional life?

I think you can tell that I believe the answers to these questions are ""yes,"" but I don't think there's a ""big sexist conspiracy,"" to use Maddox's phrase, because that would imply these issues exist primarily on the basis of intentionally malicious policies that were *designed* to promote sexism and preserve a gender gap. No doubt *someone* believes there is a big sexist conspiracy of this sort, but I have never met such a person, so using the phrase as a kind of stance against which Maddox set himself up seemed a little bit straw-man-y. It's worth looking critically at these questions not because we need to figure out who is perpetrating such a sexist conspiracy and how to stop them, but because it's important to recognize when our cultural and economic systems are having sexist effects, so that we can work together to improve things for everyone.",1429749458,"","False",1,51,"videos"
"AutoModerator","","","Hello /u/THELIONATOR,

Thank you for your submission. Unfortunately your account does not have enough karma to post things to /r/videos at this time. 

/r/videos requires users have, at a minimum, 10 link **and** 10 comment karma.  We suggest that you comment in some popular threads and submit links to other subreddits to build up your karma and then come back.

We do this to prevent spammers from abusing /r/videos. We are sorry for any inconvenience caused. We look forward to your submissions in the future. 


*[I am a bot](/r/AutoModerator/comments/q11pu/what_is_automoderator/), and this action was performed automatically. Please [contact the moderators of this subreddit](/message/compose?to=%2Fr%2Fvideos) if you have any questions or concerns.*",1428679552,"moderator","False",0,1,"videos"
"edgwick","","","I feel like he was dragged to this and would rather be at home watching the game or in a bar with buddies, saw an exit strategy and went with it. Genius.",1430161818,"","False",1,3218,"videos"
"mydearwatson616","","","I just hope the co-pilot didn't eat the fish.",1422889633,"","False",1,48,"videos"
"taco_whisperer","","","This is why the US is falling behind, I didn't learn that until I was twice their age and already having sex with all of your mothers on Xbox live",1431730818,"","False",2,4835,"videos"
"logical_outcome","","","That was like watching an entire season in 6min.",1420190177,"","False",0,5,"videos"
"henry82","","","10/10 on the design, if i ever needed a semi auto compact folding machine gun, this would be it. However, i don't think ill ever need one",1427083520,"","False",0,1,"videos"
"Oilfield__Trash","","","For everyone who doesn't watch the video:

The frack water wasn't pulled from the ground. He doesn't say where he got it, he probably got it from a storage tank. He brings it and asks the people in charge if they would drink it. Nobody in their right mind would drink that shit. Then he goes on a speech on how a disaster could contaminate Nebraska's water source.

TL;DR Nothing is contaminated, he just wants to point out the dangers and risks.

I didn't get this many angry people when I did a fucking AMA. Especially this guy:

http://imgur.com/a1kFeEu

http://imgur.com/J5V6XXl",1427557654,"","1427594418",1,1860,"videos"
"myxzyp","","","of course the mods took this down, cop-bowing bastards.",1425874217,"","False",0,1,"videos"
"Hepster22","","","Damn, I actually liked a few of those songs...just realized I'm retarded
",1420739253,"","False",1,2065,"videos"
"Colby_the_Canine","","","How to make pizza:

1. Pour flour, yeast, and water into a bowl

2. Place Indian child's hands in bowl

3. Recite math problems",1426305156,"","False",1,7,"videos"
"marqueA2","","","Gorgeous. ",1424408120,"","False",0,2,"videos"
"Insinqerator","","","I solved one with no letters showing once, but it doesn't pay unless you're on the show...  

The puzzle answer was :
George and Martha Washington

I should have gotten a video of my grandparents verifying it for posterity since no one will believe me because this is the internet.  

ITS COOL TO ME DAMNIT!

Edit:  Obligatory thanks for the gold!  Much appreciated stranger!

",1424281684,"","1424312072",1,114,"videos"
"saloabad","","","I used to dislike crows but now I actually find them as really clever creatures and enjoy watching them do shit...

Edit: Holy shit I would like to thank the crow community for my first gold, and of course the awesome person who gave it to me. Thank you :-)",1431095090,"","1431103142",1,656,"videos"
"cinephile67","","","he's probably right. She slaps him and people laugh. If it were the opposite they would all rush him. 

EDIT: thanks for the gold! ",1426872952,"","1426885352",1,1337,"videos"
