"author","author_flair_css_class","author_flair_text","body","created_utc","distinguished","edited","gilded","score","subreddit"
"jackson86winner","","","Exchange Program Paris Fashion Week.",1426003721,"","False",0,1,"videos"
"Sirrwinn","","","John Oliver and the voice of Archer.. I like it",1429482073,"","False",0,2,"videos"
"chasingsnow","","","oddly the movie ""a most violent year""....yeah...not so violent. great movie though. ",1426092430,"","False",0,4,"videos"
"fudgeyouman","","","LPT: Don't accept a dinner invite from this guy. ",1422312979,"","False",0,1,"videos"
"ThePlumber69","","","Balls of steel perhaps, but trouble getting an erection.",1426305997,"","False",1,33,"videos"
"Cindernubblebutt","","","30 year beard wearer here.

Chumps.",1428682418,"","False",0,2,"videos"
"j0sefstylin","","","I love how people always threaten ""you can't video me without my permission, I'll take you to court"" whenever someone is recording them being a complete asshole. If you're so scared of the world finding out what a horrible person you are, maybe it's time to reflect on a few things and change.

Edit: Thank you kind anon for the gold!!!",1425230662,"","1425251324",1,2745,"videos"
"Nymphonerd","","","Figures this is the only time I've seen baltimore on the front page of reddit. I've known for years this city is going to hell on a rollercoaster. Someone stop this ride so I can get off and move asap.",1430415234,"","False",0,1,"videos"
"JoshuaBGoode","","","Adorable store owner tries to work up the courage to ask customer out on a date.

Edit: Thanks for the gold mysterious redditor!",1422719985,"","1422728961",1,4812,"videos"
"nicholmikey","","","They did this for the beach boys as well, their voices are fantastic: https://www.youtube.com/watch?v=xYc4DT18EJg ",1423879299,"","False",1,1348,"videos"
"92u238","","","Amazing skills. But does Monaco have that track ready at all time or do they set it up every time  there's a race. ",1423967604,"","False",0,2,"videos"
"makeswordcloudsagain","","","Here is a word cloud of all of the comments in this thread: http://i.imgur.com/Lthm62X.png  
[^source ^code](http://github.com/Winneon/makeswordclouds) ^| [^contact ^developer](http://reddit.com/user/WinneonSword) ^| [^faq](https://github.com/Winneon/makeswordclouds#faq)",1424540321,"","False",1,30,"videos"
"Dalmah","","","ITT: Music ""experts"" talking about how easy what this guy did is.

Oh, he changed it up a bit and slowed the tempo down, let's attack him and tear him down even despite the fact that it sounds good.

----

Seriously, fuck off guys. It sounds good. Why do you feel the need to say 'This is so simple, anybody can slow down a song.' Yeah, and anyone can play the saxophone, but anyone =/= everyone, and its music. Does it sound good? If so, maybe you should just enjoy it instead of acting snobby and lifting yourself up.",1423014582,"","False",1,61,"videos"
"antihexe","","","Intellectually I understand what I'm watching and can see, oh, that was 75 years ago. But the juxtaposition of her 102 year old self and her youthful and vital self is so *strange*. I'm not afraid of death and growing old, but there's something unsettling to me about the way we waste away and become dry and brittle -- on the verge of snapping. But deep inside her memory she can probably remember some of those moments of vivid vitality. Maybe we're all just as easily broken when we're younger but we don't notice it. 

Either way, thanks for sharing this. It's a damn good little wormhole between the past and the present. ",1429647086,"","1429659468",1,3106,"videos"
"Malystryxx","","","Fire is truly a beautiful thing ",1432695059,"","False",0,13,"videos"
"Mentioned_Videos","","","Videos mentioned in this thread:

[&amp;#9654; Play All](http://sbtl.tv/_r36cm5u)

VIDEO|VOTES - COMMENT
-|-
[CTSCC @ Austin - T. Bell - Brake failure &amp; crash](https://youtube.com/watch?v=mJqNqxAG9qg)|[17](http://reddit.com/r/videos/comments/36cm5u/_/crczb2j) - Here&amp;#39;s several external angles of the crash and the aftermath.  The vehicle looks pretty good from the outside considering.  Excellent crash barrier/protection at this track. 
[Tim Bell huge crash in-car](https://youtube.com/watch?v=D3ZafJW8Ao0&amp;t=160s)|[1](http://reddit.com/r/videos/comments/36cm5u/_/crcvdj1) - Im confused as to why he asked (said aloud), &amp;quot;where am I.&amp;quot; right after the 2:40 mark but then knew the answer to the rescue squad. Link. 
(1) [Ayrton Senna death onboard camera 1994](https://youtube.com/watch?v=Tpp7OCngXQM) (2) [Travis Pastrana jumps 269 feet in rally car!  (HD!)](https://youtube.com/watch?v=L5N7R9Wbe_E)|[1](http://reddit.com/r/videos/comments/36cm5u/_/crd7wt8) - Jesus, the shot at 50 seconds gave me flashbacks of Ayrton Senna&amp;#39;s fatal crash.  The driver did incredibly well to squeeze down the right hand side of all that traffic, if he&amp;#39;d overreacted he could have put himself into an early spin or hit t...
***
I'm a bot working hard to help Redditors find related videos to watch.

[Info](http://np.reddit.com/r/SubtleTV/wiki/mentioned_videos) | [Contact](http://np.reddit.com/message/compose/?to=Mentioned_Videos&amp;subject=contact)",1431976554,"","False",0,1,"videos"
"AutoModerator","","","Hello /u/vikramshastri,

Thank you for your submission. Unfortunately your account is not yet old enough to post things to /r/videos at this time.

We suggest that you wait a while (about a week), while also commenting in some popular threads and submitting links to other subreddits for the time being.

We do this to prevent spammers from abusing /r/videos. We are sorry for any inconvenience caused. We look forward to your submissions in the future.


*[I am a bot](/r/AutoModerator/comments/q11pu/what_is_automoderator/), and this action was performed automatically. Please [contact the moderators of this subreddit](/message/compose?to=%2Fr%2Fvideos) if you have any questions or concerns.*",1424060189,"moderator","False",0,1,"videos"
"Olyz","","","mirror:http://www.dailymotion.com/video/x2mzp45_trailer-batman-vs-superman-2015-latest-trailer_shortfilms",1429295200,"","False",0,2,"videos"
"Aepyceros02","","","I can't believe this is Reddit and no one has mentioned the guy parked like a douche!!

Anyway, as a former firefighter this annoys me greatly. Most people don't know that fire stations are often manned 24 hours at a time. This means that the firefighters literally are living at their job during that time. He's worried about fuel and maint. while they buy groceries?? How about all the fuel and maint. wasted on false fire alarms? Or on any number of other calls that should never be made? Fire Depts. are there to help the public whenever they WANT it and especially when they need it. Cut them a little slack to get some damn food.",1428165237,"","False",1,1836,"videos"
"unusualtomato","","","This is just fucking phenomenal, props to this man ",1424058866,"","False",0,1,"videos"
"Sipdippity","","","Oh, religion. ",1427478680,"","False",0,0,"videos"
"Cianf","","","Shut up ya grape looking slut",1429833215,"","False",1,1707,"videos"
"es080994","","","I think it should be illegal for restaurant owners, or any owner of any business to pay their employees less than minimum wage. Tips should still be an option, but not forced. I personally don't care if you need it or not. If your service isn't bad or is exceptionally good, I'll throw you a couple bucks. Do not think I owe you anything though for you doing your job. As an American, I think it's a shitty system and should be done away with. This also coming from a part time busboy. ",1421125755,"","False",0,2,"videos"
"randomcoincidences","","","Our servicemen get a lot of shit from the public.

So lets all just take a step back and appreciate how fast they managed to respond. and major props to OP's dad for being ah ero.",1431920803,"","False",0,2,"videos"
"Mayzenblue","","","Our staunch ally",1424238613,"","False",0,1,"videos"
"CaptionSkyhawk","","","I sped up the nut shot to the original speed (Assuming it was orginally slowed down 8x) http://i.imgur.com/uIhvNqG.gif

EDIT: Bonus Gifs

Normal Loop: http://i.imgur.com/kGBWGHA.gif

Seamless Loop: http://i.imgur.com/hlvUihK.gif

Downvote: http://i.imgur.com/s8VbJsh.gif",1427862194,"","1427896708",1,351,"videos"
"calcteacher","","","dont beg.  it's costly",1428543168,"","False",0,1,"videos"
"TheJucheisLoose","","","Years ago, this song had just charted and was getting popular, and this video was all over MTV. I had just broken up with my girlfriend at the time, and my buddy came to pick me up to go get some soju or something. And as we're driving, this song came on, and he goes: ""So, how're you holding up?"" and I replied: ""I miss the rising action."" 

I consider that my finest moment.",1420320482,"","False",0,36,"videos"
"Rihannas_forehead","","","I'm a Latino, first generation American. Having lived in this country I've come to the realization that for the most part, blacks hate whites more than they care about themselves. Seem like being poor, uneducated, anti-social etc. is a form of resistance against the white man. Nothing will change unless this basic problem is solved. No amount of money, racial quotas, white guilt, political correctness can help when being a victim gives such a strong sense of identity. ",1430420373,"","False",1,1017,"videos"
"Chunderbutt","","","Wow, they sunk a car for comedy.  ",1421775125,"","False",1,197,"videos"
"hobnobbinbobthegob","","","I don't think I've ever seen anything as distinctly patriotic and American as multicultural children screaming the national anthem into fans at a Walmart.
 
God bless America.
 
^(*Thanks!!!)",1427255988,"","1427289901",2,4959,"videos"
"AutoModerator","","","Hello /u/kakaran,

Thank you for your submission. Unfortunately your account is not yet old enough to post to /r/videos at this time.

We suggest that you wait a while (about a week), while also commenting in some popular threads and submitting links to other subreddits for the time being.

We do this to prevent spammers from abusing /r/videos. We are sorry for any inconvenience caused, and look forward to your submissions in the future.


*I am a bot, and this action was performed automatically. Please [contact the moderators of this subreddit](/message/compose/?to=/r/videos) if you have any questions or concerns.*",1432820747,"moderator","False",0,1,"videos"
"Remarqueable","","","The amount of courage he is radiating staggers and humbles me. He's more man than I'll ever be. Keeping an attitude as positive as his while suffering from perpetual pain...wow. That's what I call soldiering on.

I also bet a lot of his strength comes from his mother who gives the impression of an incredibly strong person as well. They seem to be so grateful for each other.",1429056160,"","False",1,0,"videos"
"SrJulioSchlongenburg","","","Are you gonna do something or just stand there and bleed?",1432076543,"","False",0,1,"videos"
"WarCow","","","damn, sick manual",1425910501,"","False",0,1,"videos"
"MiastahRager","","","This entire video was golden.
",1425914873,"","False",0,0,"videos"
"jiminatrix","","","A hermit crab's life is one long loot grind with just one item slot.",1421167682,"","False",1,1562,"videos"
"theloch","","","So for the American here.. why did he use MPH versus kilometers?",1420361331,"","False",0,2,"videos"
"Ajones0473","","","My little brother, David, had EB. He had EB recessive dystrophic, inside and out. He passed away at 16 weighing 36 lbs. I cannot express to you how tragic this disease is. Not only the constant pain but how it keeps you isolated. David was wrapped from his neck down in white gauze. If he had a bad infection, you could smell it. If he had an open site on his neck, you could see it. EVERY time you leave the house, you get stared at. People pull their kids back when you walk by. They ask your parents if it contagious. It is dehumanizing. He was the loneliest person I've ever known. 
 Not only was his life hard but his death was heartbreaking. The amount of suffering he endured during his life and death (especially his death) broke something in me that I don't know will ever be fixed or soothed. 
 I just want to say, if this video has moved you, do something. Spread the word about this disease. Volunteer time. DONATE MONEY. Whatever, just don't move on to another video, to another day without doing something.

Edit: Thank you to everyone for some of kindest words I've ever been on the receiving end of. 
Talking about David has always been so painful that I shy away from it. I cannot tell you how good this has felt to tell you all about him and about my journey as his sister. And to EVERYONE that was donated because of this....I can never thank you enough. It has been a very humbling experience. I think I needed this more than I would have ever known.  
Also, thank you the gold! First time for that. I am relatively new to this whole Reddit thing. I've got nothing but love for you guys! :)",1429052503,"","1429071488",1,1858,"videos"
"Leben_","","","This didn't hold did it? Where I live people would have cracked their heads.",1429609969,"","False",0,1,"videos"
"2bsahm1","","","I want this teacher teaching my kids. ",1429059286,"","False",0,2,"videos"
"zewn","","","This game looks terrible :(",1432033099,"","False",0,115,"videos"
"madbunnyrabbit","","","She looks pretty handicapped to me.",1424914597,"","False",1,2012,"videos"
"thefutureeye","","","Classical Gas",1431868378,"","False",1,196,"videos"
"cmjohnson7799","","","I was walking back to my dorm room after eating dinner one night and this very attractive girl that was studying with her equally attractive friends at a table I walked by.  She asked me, ""What's your sweatshirt say?""  I didn't hear her very clearly so I looked over and intended to casually say ""huh?""  Instead, I made a noise I'll never be able to replicate as long as I live.  It started out in a normal pitch and instantly became the highest pitched noise I've ever made.  Kinda like a yawn mixed with a shoe squeaking on a gym floor.",1424648272,"","False",1,4141,"videos"
"DYWMB","","","Chicken parm you taste so good.",1422846686,"","False",1,387,"videos"
"AutoModerator","","","Hello /u/red4othmane,

Thank you for your submission. Unfortunately your account does not have enough karma to post things to /r/videos at this time. 

/r/videos requires users have, at a minimum, 10 link **and** 10 comment karma.  We suggest that you comment in some popular threads and submit links to other subreddits to build up your karma and then come back.

We do this to prevent spammers from abusing /r/videos. We are sorry for any inconvenience caused, and look forward to your submissions in the future. 


*I am a bot, and this action was performed automatically. Please [contact the moderators of this subreddit](/message/compose/?to=/r/videos) if you have any questions or concerns.*",1432516989,"moderator","False",0,1,"videos"
"hold_my_halo","","","what a fascinating modern world we live in.",1420864279,"","False",0,2,"videos"
"Warlizard","","","I did some research, just to clarify.

1. It's legal to enter an intersection when the light is yellow in Georgia (where OP lives). [Here's the proof](http://www.drivinglaws.org/resources/traffic-tickets/moving-violations/running-red-lights-and-stop--8).

2. Federal legislation doesn't mandate a specific time for how long lights should stay yellow, but everywhere I looked, the absolute minimum was 3 seconds. Nothing less was acceptable and Chicago was sued for being under that. See [Question 19](http://mutcd.fhwa.dot.gov/knowledge/faqs/faq_part4.htm) for more details.

3. At a little past 10 seconds into the video, the light changes to yellow. OP enters the intersection and t-bones the woman at exactly :14, roughly 3.5 seconds after the light changed to yellow.

4. There is a 1.3-second (minimum) pause between the time one direction goes red and the other side changes to green at 30mph ([Look at chart 5-11 of the Federal guidelines](http://ops.fhwa.dot.gov/publications/fhwahop08024/chapter5.htm#5.3)).

5. Based on when OP's light turned yellow, the other driver would not have been able to legally be where she was (3-seconds yellow + 1.3 seconds transition = 4.3 seconds) and she was traveling at full speed). Her light *couldn't* have turned green until OP was already through the intersection.

6. OP was 100% legal and the woman he hit was 100% in the wrong unless the times of the lights were outside of federal and state guidelines.

EDIT: Changed citation to case law in Georgia, not Minnesota. Still legal.",1423356924,"","1423407981",2,5295,"videos"
"dimechimes","","","Except when it's been on the front page of some of the defaults.",1426571103,"","False",1,259,"videos"
"TrapdoorExplorer","","","""Now now now now""
",1429161919,"","False",1,39,"videos"
"GlassesMcMegane","","","I gotta admit this is really cute.
I demand a crossover episode with actual Adventure Time and this.",1421303715,"","False",0,3,"videos"
"AutoModerator","","","Hello /u/Punkvertising,

Thank you for your submission. Unfortunately your account is not yet old enough to post things to /r/videos at this time.

We suggest that you wait a while (about a week), while also commenting in some popular threads and submitting links to other subreddits for the time being.

We do this to prevent spammers from abusing /r/videos. We are sorry for any inconvenience caused. We look forward to your submissions in the future.


*[I am a bot](/r/AutoModerator/comments/q11pu/what_is_automoderator/), and this action was performed automatically. Please [contact the moderators of this subreddit](/message/compose?to=%2Fr%2Fvideos) if you have any questions or concerns.*",1427298426,"moderator","False",0,1,"videos"
"BlLE","","","I'm sorry guys, I should have clarified what the species was when I posted this. This is a Killdeer. It is a Plover, or short-billed wading bird. Similar to the Sandpiper for which it is often confused it can be found close to shores. This specific family lives next to a manmade lake in an office complex in Southern California.The lake is also home to other species of birds like Mallard Ducks, Muscovy Ducks and American Coots. It is my favorite place to go on my breaks because of how comfortable all of the birds seem to be here. The Muscovy ducks actually have names that I've given them. They usually sit with me on my lunch.  Edit: Here are two of the Muscovy's: http://imgur.com/a/sqlJ3 The white one is named Jules. The other is named Felix. I couldn't find Jackson today so no picture of him.   Edit 2: I did not expect for this to be so popular. Neat! Please be mindful of your feet when you're walking off the beat path! I found another one of these tucked into some grass and if I wasn't looking where I was stepping I would have squished him!Also, some people have asked if the PVC pipe was the nest. No, the nest was a little hole dug into the dirt underneath one of the palm trees in the distance. ",1427133531,"","1427166724",1,876,"videos"
"Honda_TypeR","","","http://i.imgur.com/08PnBNb.jpg

edit: for those that want the video

https://www.youtube.com/watch?v=iyw6_lu3Y7Q

-------------

edit 2: Thanks for the gold kind stranger :)

here is a bonus video of an owl getting his head pet and loving it

https://www.youtube.com/watch?v=3G1PFLuTrgM",1432643203,"","1432720506",1,230,"videos"
"MyFreakingAltAcct","","","""The Jews"". REALLY?


This is becoming an almost daily occurrence of some anti Israel story hitting /r/bestof or another default sub. 


YES. **Israel is held to a higher standard** than are surrounding countries, and we expect everyone there to behave like a good liberal does in the US of A. The countries on or near their borders are beheading people for adultery in the streets, and giving women lashes for being raped, and every example of closed mindedness is posted here like it applies to the entire nation. 


Do most redditors realize that **20% of their citizens are Arabs, and that they serve both in the military, and as the third largest block in parliament?**


Do most redditors realize WHY Netenyahu was able to pull off his right-wing victory, albeit will fewer than 30% of the vote? It's because they're always feeling attacked. 


A nation that's under 100 years old that's been in more major wars than the US has since 1948. The largest UN block of nations, non-democratic and majority Muslim, is constantly bombarding them with reports (Like this one from last week calling them the largest and only violator of Women's Rights http://www.nytimes.com/2015/04/01/opinion/united-in-ignominy.html ). 


There are closed minded people in ultra orthodox neighborhoods, and  10 years ago, the US Re-Elected a Pro-Torture President on the promise of adding an Anti Gay Marriage AMENDMENT to the constitution. 


Judge Israel on what it is: The **ONLY** true, open, and functioning democracy in the region, still trying to figure out it's identity. They've got a majority of Jews who found a home after a thousand years with a right wing that doesn't want to give half of it away, even though it looks terrible, and a left wing what came up ONE seat short and does want to negotiate. They've got Jordan and Egypt who refuse Palestinians entrance, while Israel brings in jews persecuted from Iran, Ethiopia etc, and they've got a massive growing Arab population that is going to outnumber them in 50 years. Israeli Arabs aren't going anywhere when Palestine is created. Why be exposed to Nth theocracy in the region when they can lay on the beach, be secular, and eat Micky D's? Israeli Jews have a LOT of be scared of, and their parents were killed in death chambers. **They're ten years removed from weekly explosions killing classrooms full of kids on busses, which was why walls were built int he first place, and the only reason that it's just Muslims in Gaza is because Israel dragged their own people out of their houses and said ""we're getting the hell out of here""**. Regionally it's 8 Mil vs a BILLION. 


There are bad eggs in every nation, but there is a solid democratic political process there, and a VERY watchful world eye on them. This post though is just bigotry against a very small, different looking, and seeming scary private religious sect.

**Edit:** Downvoted, and three replies: F off, Bullshit, and didn't read. Whoever found and gilded this, thank you for taking the time. This makes me worry about the future. ",1428587746,"","1428593433",1,0,"videos"
"Doughty312","","","Middle seat best out of ten!",1420768842,"","False",0,3,"videos"
"Mrdrunkenbatman","","","I love your sister.",1424993774,"","False",0,0,"videos"
"Duckpaw","","","These black fools are the only ones who need to realize that Black Lives Matter",1428166033,"","False",0,6,"videos"
"Justicles13","","","He's got the window seat.  He's probably the MC of a slice-of-life anime where he encounters some demon/angel/wizard of the opposite gender who enrolls in the same school as him.

Thanks for the gold, /u/trekie9001!",1425658068,"","1425674901",1,3141,"videos"
"whodoyoucall","","","to be faiiiiiirrrr it was more like 2 and a half... ",1430303666,"","False",0,0,"videos"
"Draconi","","","He's probably enjoying getting away from that annoying ticking sound (clock?).",1431381296,"","False",0,1,"videos"
"xlyem","","","Taylor Swift just starts beating the shit out of Ellen... ""it's a prank! it's a prank!""",1420996607,"","False",0,30,"videos"
"Hardrainfalling","","","Putting the dog in a serious shame spiral with human laughter.",1429074172,"","False",0,2,"videos"
"royvann","","","TIL when you're black writing poetry, you're a rapper. When you're white in a rap battle you're a poet. ",1431609993,"","False",1,1954,"videos"
"LiterallyFuckPandas","","","Anyways...I'm going to go to Publix and get a sub. ",1427041644,"","False",1,177,"videos"
"Sonicstrapawn","","","&gt;How it feels to chew 5 gum",1430819319,"","False",0,2,"videos"
"31415927","","","Humans are fucking weird. I don't mean like, they are reproducing in unconventional ways or positions although it is true, but that's not what I mean. We idolize absolutely everything, even appendages, we commercialize it and make people spend work time to earn pieces of paper that society gives a certain value so this ""hand model"" can show us a product and we can give away our pieces of paper with numbers on them, we acquire the product, use it for a while, lose interest, throw it away, rinse, repeat.

You don't see any other living species doing this.

tl;dr: Humans are fucking weird.",1430924593,"","False",1,40,"videos"
"The_Punniest","","","&gt;Autobiographical ""Clueless"" 

I fucking lost it.",1423269041,"","False",0,6,"videos"
"cool_slowbro","","","Do they even make fast cars anymore?",1424456569,"","False",0,5,"videos"
"alienumnox","","","How funny is it that I, as a female, am too afraid to share this video on my Facebook page for fear of the hateful backlash I would receive from my feminist friends? ",1428616288,"","False",1,745,"videos"
"Paseo91","","","This is a mockingbird! Beautiful creatures, but very loud. What you're hearing is his mating call. He will basically do this for weeks on end until he finds a mate. Anyway, long story short... you're gonna have to fuck it. Hope this helped. ",1429384465,"","False",1,2868,"videos"
"redditforcash","","","This is awesome!",1425514634,"","False",0,3,"videos"
