"author","author_flair_css_class","author_flair_text","body","created_utc","distinguished","edited","gilded","score","subreddit"
"Dedzig","","","That's me guys. Glad you enjoyed! What should I cook next year is what I want to know?  I used to have to record videos in a little storage room, but now I have a big test kitchen at my disposal. Doing stuff like this gets me away from my desk and is fun as hell, so you know, if you have any good ideas, shoot.
Edit to respond to a few things: 

* Thank you for the gold! 
* I'll definitely read all the cooking suggestions and try to push to make some. The drone assisted Twinkie frying is really firing up my imagination. 
* I know the correct way to pan fry gnocchi, and I know I was deep frying there. 
* I'll pronounce those potato dumplings any way I want and there is nothing you can do to stop me.
* Yes, the one audio channel doesn't work. I'm well aware. We discovered a problem after we rushed to record this many years ago. It happens. Back then we used to video in a closet with garbage equipment. The company that I work for, WebstaurantStore, has been very successful, so my video guys have top of the line stuff and we aren't typically flying by the seat of our pants anymore.
* I've always been okay with embarrassing myself to make others laugh, but I have to say it still really touches me that people tell me this made them laugh when they were having a bad day. I love that and makes all the goofiness worth it. 
* I geek out over all my kitchen equipment now, so keep those cooking suggestions coming! Making videos is a lot of work, but it is great fun...better than being at my desk. And I am an expert at food service equipment, so if you ever have any questions that way, feel free to pm me. 
 

",1423430918,"","1423489628",3,4301,"videos"
"sokkas-boomerang","","","He should make a video series where he reads bed time stories.
Edit: My first gold!",1430789088,"","1430844978",1,169,"videos"
"AutoModerator","","","Hello /u/Northparkwizard,

Thank you for your submission. Unfortunately it was removed because it is currently an attribution link and not a direct link to the video. To have your post reapproved, resubmit it using the direct link of the video.

Your current URL looks something like this: `http://www.youtube.com/`**attribution_link?a=TMeg_i9TKqs&amp;u=**`watch?v=dQw4w9WgXcQ`

You will need to replace URL so it looks something like this: `https://www.youtube.com/watch?v=dQw4w9WgXcQ`.

[If you need any assistance, feel free to contact us](https://www.reddit.com/message/compose?to=/r/videos&amp;subject=[AutoMod]%20R5%20-%20attribution%20link%20removal%20assistance&amp;message=%28Optional%29%20Please%20enter%20more%20info%20here.%0A%0A---%0APlease%20don%27t%20edit%20anything%20below.%0A%0ASubmittor:%20Northparkwizard%0A%0ATitle:%20E-Male%0A%0AURL:%20http://www.youtube.com/attribution_link?a=VwYUIRD8574&amp;amp;u=%2Fwatch%3Fv%3DCWRMvC8mXAA%26feature%3Dshare%0A%0APermalink:%20http://www.reddit.com/r/videos/comments/2xv033/emale/).


*[I am a bot](/r/AutoModerator/comments/q11pu/what_is_automoderator/), and this action was performed automatically. Please [contact the moderators of this subreddit](/message/compose?to=%2Fr%2Fvideos) if you have any questions or concerns.*",1425435407,"moderator","False",0,1,"videos"
"Solypsys","","","Several major issues with this video:

1. [He is not affiliated with Monsanto in any way](http://www.newsweek.com/patrick-moore-scientist-who-offered-and-then-refused-drink-glyphosate-weed-317289), in fact he's somewhat of a crackpot who works for Greenpeace and denies anthropogenic climate change
2. A substance can be non-potable even if it's non-carcinogenic, dish soap isn't dangerous but I'm not about to chug a bottle of it
3. The entire premise from the 'reporter' is based on the WHO stating that glyphosate is a ""probable"" carcinogen, a claim which is not actually based on any empirical data. Such as [this](http://www.sciencedirect.com/science/article/pii/S0273230011001516) or [this](http://www.sciencedirect.com/science/article/pii/S0273230012000943).
4. The entire premise of that interview was to discuss the viability of GM crops but instead they decided to blitz Moore with completely irrelevant questions so they could get a cheap, mostly false, headline to spread around social media",1427486901,"","1427487162",3,1378,"videos"
"KiwiZama","","","[Solution](/s ""Ask her what she is reading, then choose to remain silent, wait until the video glitches a little and then choose remain silent again. At this point you will be transported to a different reality where she asks you to guess what she is making. Say Salad, and you win! Note choosing to remain silent again too early results on her walking out and you being single"")",1420150286,"","1420150597",1,82,"videos"
"mossyskeleton","","","Eric Andre? More like Eric Angry.",1423985302,"","False",1,1,"videos"
"Awwfull","","","Barry! My man. Love the trick. I'm so happy to see you on the front page! -Former Coworker",1425010482,"","False",0,1,"videos"
"HiyaGeorgie","","","Poor girl, probably thought she missed the youtube era by being limited to VHS recordings.",1423868618,"","False",0,1,"videos"
"Life_Tripper","","","Not one person motioned that driver to move on.  Eventually the guy in the red car figured out he should move because the firetruck driver can't GTA the thing over the sidewalk.",1432272994,"","False",0,1,"videos"
"TheWanderingN00b","","","funny how they fail to mention the fact that the cops were given this extra power due to the G20 summit. they were completely in the right. this guy is just being a jackass",1424635374,"","False",0,-7,"videos"
"ragem411","","","I've definitely seen this product shown on r/videos before a while ago. Was that you?


Edit: I found it!!! I don't think this is the post I remembered, but its definitely the same product. The link to the video has been removed by the user and he deleted his account. However you can tell by the comments and the posters description that the product is the same as the one shown in OP's vid.


 http://www.reddit.com/r/startups/comments/1lj6ew/i_was_dipping_chips_into_cheese_dip_i_came_up/


Edit 2: Found the post I remembered. OP did you rip off someone else's invention or did you create another account? 


http://www.reddit.com/r/videos/comments/20wd5m/i_dreaded_reaching_to_get_the_last_bit_of_cheese/

",1420428696,"","1420430247",1,427,"videos"
"Jyiiga","","","Well lets vote this stupid trash into a black hole. ",1431832028,"","False",0,-2,"videos"
"Misaria","","","http://i.imgur.com/pQ2VhDn.gifv",1426402528,"","False",3,3983,"videos"
"Affe83","","","[Relevant](http://www.youtube.com/watch?v=r5Hsf-0B-Eo)",1422725950,"","False",0,1,"videos"
"E-fly","","","Just because she doesn't recognize you or respond to your music doesn't mean she doesn't ""hear"" the music or ""see"" who's singing. Sing and play for her as long as you can. ",1420158875,"","False",1,1977,"videos"
"Dr_Zeuss","","","This guy has cojones",1421717560,"","False",0,1,"videos"
"BrianDawkins","","","Stupidest chant ever ",1420965090,"","False",1,8,"videos"
"MrBillyLotion","","","I like to think he's in heaven looking down, with one eye on North America and the other on India.  RIP",1420386129,"","False",1,1635,"videos"
"BobT21","","","Nuthin about dawgs?
",1420750124,"","False",0,1,"videos"
"Hoedoor","","","[Instantly thought of this](https://www.youtube.com/watch?v=90LwW4HuAiI)",1429155396,"","False",1,10,"videos"
"AutoModerator","","","Hello /u/mariaoutseller,

Thank you for your submission. Unfortunately your account does not have enough karma to post things to /r/videos at this time. 

/r/videos requires users have, at a minimum, 10 link **and** 10 comment karma.  We suggest that you comment in some popular threads and submit links to other subreddits to build up your karma and then come back.

We do this to prevent spammers from abusing /r/videos. We are sorry for any inconvenience caused. We look forward to your submissions in the future. 


*[I am a bot](/r/AutoModerator/comments/q11pu/what_is_automoderator/), and this action was performed automatically. Please [contact the moderators of this subreddit](/message/compose?to=%2Fr%2Fvideos) if you have any questions or concerns.*",1423426031,"moderator","False",0,1,"videos"
"Vynile","","","There's also the problem that the Fortress lead would be the obvious thing to search. If the body was his, first of the account would be completely unused, and second of all, the police would've searched for clues in his account of his home address, name, identity, and would find relatives to identify the body. Was very entertaining though, I really liked the story.",1425320521,"","False",0,7,"videos"
"Morr","","","So what was the correct fucking answer?",1429669217,"","False",0,1,"videos"
"nfreni","","","Can we not turn reddit into a marketing website please?",1425264704,"","False",0,1,"videos"
"snyte","","","0:59 ",1429261327,"","False",0,1,"videos"
"staydedicated40101","","","Good, now i can make my girlfriend jerk me off when she's sleeping",1430248633,"","False",1,3472,"videos"
"samtart","","","Am I the only one who sees that he is giving what would have been his acceptance speech.  This is clearly what he would have liked to say on stage and he doesn't want to throw it away after practicing it probably countless times. ",1424715520,"","False",1,322,"videos"
"TravieMcFly","","","Dailymotion link because YouTube removed it


http://www.dailymotion.com/video/x2l7b1p_going-clear-scientology-and-the-prison-of-belief-2015_tv

Wow reddit gold! Thanks ",1427817852,"","1427889973",1,61,"videos"
"maximuszen","","","What did you expect. They're fat.

edit: Thank you anonymous. My first. I thought I was going to catch flak for it. Wow! Thanks again.",1427460934,"","1427481387",1,98,"videos"
"Grimlock_1","","","Don't people get fined for this kinda shit??!! In Aus we do. ",1432268738,"","False",0,2,"videos"
"whatworld","","","I hate to say it but I've been a paramedic for 10 years and the majority of accidents I've seen are due to asian drivers. Especially the minor fender benders/rear-ends autovspeds... all asian.
I know I'm jaded... some day I'll move out of Shanghai and retire.",1423710643,"","False",1,2672,"videos"
"ReservoirBaws","","","What do you need ID for? That's clearly Colin Kaepernick",1420512254,"","False",1,670,"videos"
"WEDDLE32","","","No? Alright.  It's up to me.


LIEUTENANT DAN! You got new legs!",1421525252,"","False",1,748,"videos"
"8oobhandler","","","Sorry for thinking it was you. I was just talking about the video or ""triggers"" as a whole and just assumed you made the video. All I'm getting at is its not as simple as diet and working out. If it was that easy.  The weight loss industry wouldn't be a billion dollar industry and obesity wouldn't be an issue. If over weight people would just do some real soul searching and quit wasting their time crash dieting and worrying about the number on the scale they would be much better off. You won't magically loss weight overnight just give yourself some time and keep believing in yourself and you will be able do it and keep it off. ",1432521699,"","False",1,3,"videos"
"MaybeillDoGood","","","It looks like Jarrel took a bath in vaseline,  jesus",1428990444,"","False",0,1,"videos"
"Delahorney","","","Seeing this happen in London is amazing. British people do not put up with people not knowing how to queue, it's one of our favourite pastimes. 

Edit: Obligatory cheers for the gold, I'd like to thank my mother, cat and M&amp;S etc. ",1426510382,"","1426523906",1,4613,"videos"
"Denmen707","","","That seems a lot of a hassle to maybe get one euro off. I mean, most baristas would still ring up a frappacino, because that is what it is and that is less of a hassle to ring up than all the ingredients separate.",1429958752,"","False",0,2,"videos"
"PittyAFool","","","She makes my Fucking skin crawl. That is all.",1421204578,"","False",1,4492,"videos"
"MattsRod","","","Can someone explain how it is possible to travel for two years?  I cant even afford to sit at home for two years.",1423009724,"","False",0,1,"videos"
"M0T0RB04T","","","\&gt; I was only nine years old

\&gt;I loved Shrek so much, I owned all the Shrek smoking accessories

\&gt;I toke to Shrek every night, thanking him for the weed I have been given

\&gt;""Shrek is rank"", I say, ""Shrek is dank""

\&gt;My dad hears me and calls me a pothead

\&gt; He is obviously jealous of my swamp weed

\&gt;I called him a little ass bitch

\&gt; He slaps me and sends me to my room

\&gt; I am crying now, because my face hurts

\&gt; I go into my stash, realize I'm bone dry. My lungs are cold

\&gt;I feel a warmth moving towards me

\&gt; I smell something dank.

\&gt; It's Shrek

\&gt; I am so happy

\&gt; he whispers into my ear, ""You wanna hit nigga?""

\&gt; He grabs a powerful ogre nug and puts it in my grinder

\&gt; I'm ready

\&gt; I stretch my lungs for Shrek

\&gt; He rolls the dankest blunt and lights it up

\&gt; It hurts so much, but I do it for Shrek

\&gt; I can feel my lungs burn as my eyes water and my mouth drools

\&gt; I push against the cough

\&gt; I want to please Shrek

\&gt; He finishes the blunt in one hit and with a mighty roar he shotguns my lungs with his love

\&gt; My dad walks in

\&gt; Shrek looks him deep in the eyes and says, ""ayy lmao""

\&gt; Shrek leaves through my window

Shrek is rank, Shrek is dank

",1424029514,"","False",1,580,"videos"
"BubbaBeWorkin","","","New idea for a game show. Same format but you have to call your oldest computer illiterate relative to look up the answers. The quicker you do it the more money you win.",1432925109,"","False",0,150,"videos"
"quarantesept","","","In light of this morning's attacks in Paris, I thought I'd post some Hitchens. Such a shame he isn't around anymore. 

*edit: Thank you for the gold, anonymous comrade.*",1420644320,"","1420666376",2,1710,"videos"
"MONDARIZ","","","Was he *charged* with anything?

I'll see myself out...


",1425206813,"","False",0,12,"videos"
"bluntrollin","","","I visited Israel and Palestine in 2013.  Its on both sides.  Multiple villages we went to in Palestine had signs at the entrance saying, if you are a Jew we will kill you on the spot.

",1427994352,"","False",1,477,"videos"
"ThisDudeRiteHere","","","From the description:

&gt;Asian ain't having shit in h town from black guy

That describes this video 100% spot on.",1421481081,"","False",0,30,"videos"
"wolfsgrin","","","This isn't Feminism.
This is hatred labeled as feminism, just like Isis is terror labeled as Islam.
",1426399633,"","False",1,790,"videos"
"NoCigsSinceJan16","","","I bet they got that selfy-stick from an old gypsy.",1432152834,"","False",1,720,"videos"
"AutoModerator","","","Hello /u/dcmetrotastic,

Thank you for your submission. Unfortunately your account does not have enough karma to post things to /r/videos at this time. 

/r/videos requires users have, at a minimum, 10 link **and** 10 comment karma.  We suggest that you comment in some popular threads and submit links to other subreddits to build up your karma and then come back.

We do this to prevent spammers from abusing /r/videos. We are sorry for any inconvenience caused, and look forward to your submissions in the future. 


*I am a bot, and this action was performed automatically. Please [contact the moderators of this subreddit](/message/compose/?to=/r/videos) if you have any questions or concerns.*",1432925668,"moderator","False",0,1,"videos"
"AutoModerator","","","Hello /u/__Internet__,

Thank you for your submission. Unfortunately your account does not have enough karma to post things to /r/videos at this time. 

/r/videos requires users have, at a minimum, 10 link **and** 10 comment karma.  We suggest that you comment in some popular threads and submit links to other subreddits to build up your karma and then come back.

We do this to prevent spammers from abusing /r/videos. We are sorry for any inconvenience caused. We look forward to your submissions in the future. 


*[I am a bot](/r/AutoModerator/comments/q11pu/what_is_automoderator/), and this action was performed automatically. Please [contact the moderators of this subreddit](/message/compose?to=%2Fr%2Fvideos) if you have any questions or concerns.*",1427323456,"moderator","False",0,1,"videos"
"Kowai03","","","I think tidied up that short hair would really suit her! She's gorgeous!",1430445534,"","False",0,4,"videos"
"munificent","","","The reason he's so mortally offended is because:

1. Italians take their carbonara very seriously.
2. The dish he prepared is **penne, nutmeg, a few cheeses, and peas, baked in an oven.**
3. Carbonara is **spaghetti, eggs, black pepper, guanciale or pancetta, and Pecorino-Romano or Parmigiano-Reggiano.** It's cooked by using the heat of the pasta to gently cook the eggs.

So, somehow, she is suggesting that adding ham (a different kind of pork from guanciale and pancetta), somehow the penne would turn into spaghetti, the cheeses would age themselves, the cream would magically become eggs and the nutmeg would transmogrify into black pepper. Who knows what the fuck the peas would do.

**The recipe he cooked has literally *zero* ingredients in common with carbonara and an entirely different preparation.**",1420512743,"","1420519746",1,4306,"videos"
"NicknameInCollege","","","That banjo player be like

""Think of Disneyland Jimmy, this gig is paying for the summer Disneyland trip..  just keep playing the banjo Jimmy.  The kids will be like ""What an awesome dad we have for taking us to Disney"" and maybe they won't grow up to be fame-floundering butterfly wenches..  Keep playin that chord Jimmy!""",1431814502,"","False",1,2968,"videos"
"_DEAL_WITH_IT_","","","John Mayer is doing the guitar face for him.",1426140534,"","False",1,1084,"videos"
"Gillbreather","","","I was really hoping that he would make blasphemous jokes in protest.  Who cares if he is just saying that the situation is sad?  No shit it's sad!",1420730228,"","False",0,0,"videos"
"worldfive","","","ending was really good.",1424545026,"","False",0,2,"videos"
"inajeep","","","There are some logistics questions I have.  

Like underwear yes or no? Or did it play pinball on the way down?  Getting back to the first question, I hope the answer to that question is yes.  Then my next question is how?",1427757382,"","False",0,2,"videos"
"JebadiahX","","","I can't wait for a people who wear Ed Hardy Clothing.",1426005942,"","False",0,229,"videos"
"TRexSparringPartner","","","/r/videos never disappoints. So many flavors, yet you all choose to be salty because boo-hoo, he isn't doing all le edgy jokes *you* want him to do. You're all such pussies who get butthurt over anything about white men yet demand minorities and women never question any jokes or satire.

See, I can laugh at myself, but apparently you all are incapable of it",1421535035,"","False",1,144,"videos"
"youravgguy","","","I went and saw the movie again last night for a second time and it was in the middle of the movie when i realized that it was the music that made the movie for me.  Similar to tron legacy, you get the scenes where it's not action packed explosions, it's just beautiful music with quiet scenes which really make it for me.  

Being a scifi lover, this movie really did it for me.  The exploration of the unknown was perfectly shown in this movie and it will remain one of my favorite movies of all time.",1420995017,"","False",0,2,"videos"
"silver5517","","","[laughing] Please, dude. You're barely even brown. Compared to me, you look like Matthew Perry. ",1423785856,"","False",1,320,"videos"
"Chucknastical","","","For someone who's not into goat cheese, what could you substitute it with?",1421384454,"","False",0,1,"videos"
"Azberg","ModHat-Purple-noexpand","","This is hilarious but it can't possibly be the original upload with that horrendous quality. 

Edit: Found the original clip: https://www.youtube.com/watch?v=HRYwiY2q1PE

And here's the same clip from the creators channel: https://www.youtube.com/watch?v=cxrcgEXWgJg",1429396522,"","1429396892",1,2065,"videos"
"Jack_State","","","""I'll be the prize! I volunteer as tribute! Teehee""

Fucking american girls man.",1420404347,"","False",0,0,"videos"
"I_AM_NOT_A_KLEENEX","","","[My favourite Peppa Pig short/montage](https://www.youtube.com/watch?v=42JQYPioVo4) from [this](http://reddit.com/r/unexpectedjihad) awesome sub",1423323125,"","False",1,1233,"videos"
"vinnyg96","","","Someone had to do it.... [(Fuck the)Mail time](https://www.youtube.com/watch?v=RcsaoyxcTNU&amp;feature=youtu.be)

Edit: Added (Fuck the) so peeps know its not just a Blues Clues song",1427567426,"","1427568148",1,161,"videos"
"dducrest","","","Never? How about ""always""?",1426689220,"","False",0,2,"videos"
"His_Fordship","","","Sheeran really is talented, flawless vocals while playing an instrument, hope he continues to be successful in his career  ",1427408141,"","False",0,75,"videos"
"AutoModerator","","","Hello /u/TraciShay,

Thank you for your submission. Unfortunately your account is not yet old enough to post things to /r/videos at this time.

We suggest that you wait a while (about a week), while also commenting in some popular threads and submitting links to other subreddits for the time being.

We do this to prevent spammers from abusing /r/videos. We are sorry for any inconvenience caused. We look forward to your submissions in the future.


*[I am a bot](/r/AutoModerator/comments/q11pu/what_is_automoderator/), and this action was performed automatically. Please [contact the moderators of this subreddit](/message/compose?to=%2Fr%2Fvideos) if you have any questions or concerns.*",1425055524,"moderator","False",0,1,"videos"
"evgeniyaevans","","","What are they doing?﻿",1425284241,"","False",0,1,"videos"
"Ion16","","","[How I pictured it](https://www.youtube.com/watch?v=Fxm0TN5WDQI)",1431812517,"","False",1,2,"videos"
"nullname","","","I imagine this is what my Mom saw when I was setting up her iPhone.",1429697446,"","False",2,615,"videos"
"tmotytmoty","","","What a great lesson for all redditors: Don't surprise anyone with unexpected pregnancy news on camera: ",1427389037,"","False",0,5,"videos"
"ImproperJon","","","proposition of proportions.",1423804522,"","False",1,12,"videos"
"ivan82","","","Who knew john goodman dan conner roseanne would turn into such an oscar. ",1422763327,"","False",0,1,"videos"
"--o__O--","","","Warning: Do NOT try this with a grizzly bear. It will kill you. Black bears are much nicer animals.",1428591956,"","False",0,1,"videos"
"fireituppity","","","I imagine this is what it feels like to be gilded

Edit: Holy nsfw nuts batman! Thanks for the gold kind stranger! ",1420263639,"","1420301687",1,71,"videos"
"GeorgeLolLolMartin","","","What a load of condescending, oversimplifying bullshit.",1431639129,"","False",0,4,"videos"
"Illtots","","","This is a weird Panda Express commercial. ",1430936824,"","False",1,2464,"videos"
"PmButtPics4ADrawing","","","[Is it too early to start making gifs?](https://gfycat.com/DefensiveBonyAustraliancattledog)",1421471125,"","False",1,3102,"videos"
"Dominant7","","","I'd be willing to bet it's the sub bass that she likes that's prevalent in rap songs, as opposed to the actually song as whole. You notice when there's a bass hit in the Intro she calms down, but when it isn't there for another 8 bars or so she starts to get antsy. 

Maybe this has something to do with its similarity to a heartbeat? 

Edit: ok, I think we all know now that sub bass doesn't exist on a cell phone. Thank you to all of you aspiring audio engineers for your help, you can go home now. ",1424233192,"","1424317235",0,69,"videos"
"absurd_dick","","","Is there a version where you can actually hear something?",1430421040,"","False",0,0,"videos"
"careyhimself","","","He's probably applying too many coats of Minwax on his wood. ",1422543515,"","False",0,1,"videos"
