"author","author_flair_css_class","author_flair_text","body","created_utc","distinguished","edited","gilded","score","subreddit"
"AutoModerator","","","Hello /u/lootiskee,

Thank you for your submission. Unfortunately it was removed because it is currently an attribution link and not a direct link to the video. To have your post reapproved, resubmit it using the direct link of the video.

Your current URL looks something like this: `http://www.youtube.com/`**attribution_link?a=TMeg_i9TKqs&amp;u=**`watch?v=dQw4w9WgXcQ`

You will need to replace URL so it looks something like this: `https://www.youtube.com/watch?v=dQw4w9WgXcQ`.

[If you need any assistance, feel free to contact us](https://www.reddit.com/message/compose?to=/r/videos&amp;subject=[AutoMod]%20R5%20-%20attribution%20link%20removal%20assistance&amp;message=%28Optional%29%20Please%20enter%20more%20info%20here.%0A%0A---%0APlease%20don%27t%20edit%20anything%20below.%0A%0ASubmittor:%20lootiskee%0A%0ATitle:%20Is it summer yet?!%0A%0AURL:%20https://www.youtube.com/attribution_link?a=hKwOvTOCer8&amp;amp;u=%2Fwatch%3Fv%3Dtu6EkaMa9c8%26feature%3Dshare%0A%0APermalink:%20http://www.reddit.com/r/videos/comments/329nx0/is_it_summer_yet/).


*[I am a bot](/r/AutoModerator/comments/q11pu/what_is_automoderator/), and this action was performed automatically. Please [contact the moderators of this subreddit](/message/compose?to=%2Fr%2Fvideos) if you have any questions or concerns.*",1428786668,"moderator","False",0,1,"videos"
"squanto1","","","Some say hes still cheering to this day.",1422772235,"","False",1,113,"videos"
"notsomucheffort","","","It would take so long to get out of there!",1428524821,"","False",0,1,"videos"
"djdemers","","","Hey everyone, D.J. Demers here, aka the hearing aid guy. Thanks for all the kind words. Happy to see so many people enjoying my set. Somebody said my mouth is too wide for my face, which made me laugh a lot. Thanks guys!",1422131669,"","False",3,4756,"videos"
"RjoTTU-bio","","","Isn't this how Poland fought during WWII?",1430757347,"","False",0,-7,"videos"
"BadAthMOFO","","","If I saw that live, I'd be clapping dildos, too.",1422243789,"","False",1,3429,"videos"
"nicodiumus","","","There are times like this where I wish Robert Freeman (Boondocks) would show up, break out his belt and show these young thugs a thing or two about not acting stupid in public. ",1431318744,"","False",0,2,"videos"
"dingoperson2","","","Welp, here comes the resupply drop for cyborg-Obama",1420487666,"","False",0,1,"videos"
"Frank4010","","","Original Source:
http://www.youtube.com/watch?v=avcYKFOmcZA",1427497227,"","False",1,13,"videos"
"kiwisurf","","","Impressive! 
I only have a gas burner so will probably set my kitchen alight. ",1431854718,"","False",0,1,"videos"
"AutoModerator","","","Hello /u/teagansaunders,

Thank you for your submission. Unfortunately your account does not have enough karma to post things to /r/videos at this time. 

/r/videos requires users have, at a minimum, 10 link **and** 10 comment karma.  We suggest that you comment in some popular threads and submit links to other subreddits to build up your karma and then come back.

We do this to prevent spammers from abusing /r/videos. We are sorry for any inconvenience caused. We look forward to your submissions in the future. 


*[I am a bot](/r/AutoModerator/comments/q11pu/what_is_automoderator/), and this action was performed automatically. Please [contact the moderators of this subreddit](/message/compose?to=%2Fr%2Fvideos) if you have any questions or concerns.*",1427345936,"moderator","False",0,1,"videos"
"mstallion","","","[#LikeAGirl](https://www.youtube.com/watch?v=XjJQBjWYDTs)",1423693594,"","False",1,90,"videos"
"askthepoolboy","","","I first heard about this crew on Reddit, and have been blown away ever since. They are incredible.      
Edit: More Cookies!     
[First video I saw on Reddit](https://www.youtube.com/watch?v=h_bX0T76X8U)      
Which led me to [find this video](https://www.youtube.com/watch?v=c-aXl4Z5rAc)      
Then I was completely blown away by [this video of them](https://www.youtube.com/watch?v=NSoel2xP7ec)      
And finally, this [video made me realize they are much more than just a dance crew](https://www.youtube.com/watch?v=sJMY44T42qE)",1422327010,"","1422327712",1,6,"videos"
"Concerned_Apathy","","","Jesus christ, what's with the fucking siren wailing? ",1430001081,"","False",1,709,"videos"
"geatone","","","[TL DR] (https://www.youtube.com/watch?v=5SWbtqfTJgk#t=144)",1421102988,"","False",1,126,"videos"
"TypoHero","","","There's never a GOOD reason to have a two way mirror in a bathroom. Ladies room or not. This woman is visibly upset and is trying to bring levity to control her reaction. 

She's also setting it up like a story like Comedians do, explaining where she is, why she is there and the situation. 

The people in here annoyed or mad at her, are fucking idiots.",1430140062,"","False",1,112,"videos"
"respectmyfarts","","","[QUICK! EVERYBODY WATCH THIS!](https://www.youtube.com/watch?v=28xjtYY3V3Q)",1423542758,"","False",2,1652,"videos"
"Drunkenm4ster","","","Pants are comin off, Ricky.",1426218596,"","False",1,518,"videos"
"RichDaawg","","","Sorry to rain on your groupthink circlejerk, but this little speech doesn't teach any great truths about violence &amp; terrorism.  It's a superficial, historically inaccurate rant by some white guys who didn't get their way because the big bad executives wouldn't let them draw their little cartoons the way they wanted to.  Their solution?  End the episode with some pseudo-moralizing, self-serving drivel glorifying their position and accusing those who disagree with them of siding with the terrorists.  Then all of us idiots with half a brain cell eat it up and praise them for being ""brave"" and ""insightful.""  It's a cartoon, and like most cartoons, it merely legitimizes a prefabricated worldview that we all think is original and discerning.  It's not!  It's an insular worldview designed to appeal to all of us with comfortable lives who have been trained to seek out others to think for us.  It's preachy.  It's indoctrination.  It serves ""first world"" (whatever that means) interests.  Yet no one is pointing this out.  And yet most of us are convinced it describes the one true way to look at the world. Notice that they've never had an episode satirizing their own views of the world?  How is this different from what you get from religious nuts?  Go on then, drink the kool-aid.  
",1421673076,"","False",1,-12,"videos"
"notbobby125","","","""I swear to fulfill, to the best of my ability and judgment, this covenant:

**I will respect the hard-won scientific gains of those physicians in whose steps I walk, and gladly share such knowledge as is mine with those who are to follow.**

I will apply, for the benefit of the sick, all measures which are required, avoiding those twin traps of overtreatment and therapeutic nihilism.

**I will remember that there is art to medicine as well as science, and that warmth, sympathy, and understanding may outweigh the surgeon's knife or the chemist's drug.**

I will not be ashamed to say ""I know not,"" nor will I fail to call in my colleagues when the skills of another are needed for a patient's recovery.

I will respect the privacy of my patients, for their problems are not disclosed to me that the world may know. Most especially must I tread with care in matters of life and death. If it is given me to save a life, all thanks. But it may also be within my power to take a life; this awesome responsibility must be faced with great humbleness and awareness of my own frailty. Above all, I must not play at God.

**I will remember that I do not treat a fever chart, a cancerous growth, but a sick human being, whose illness may affect the person's family and economic stability. My responsibility includes these related problems, if I am to care adequately for the sick.**

**I will prevent disease whenever I can, for prevention is preferable to cure.**

**I will remember that I remain a member of society, with special obligations to all my fellow human beings, those sound of mind and body as well as the infirm.**

If I do not violate this oath, may I enjoy life and art, respected while I live and remembered with affection thereafter. May I always act so as to preserve the finest traditions of my calling and may I long experience the joy of healing those who seek my help.""

-The Modern Hippocratic Oath, http://guides.library.jhu.edu/c.php?g=202502&amp;p=1335759

Edit: HOORAY! MY FIRST GOLD! :D

Thank you!

Edit 2: Second Reddit gold on the same post as the first? Awesome! :3",1422912567,"","1422948605",2,2038,"videos"
"drumersrule","","","I'm all about highlighting this positive encounters. But I feel like videos like this than reach a large audience muddle the discussion on systemic problems. I assume the majority of American are not anti-black or white supremacists. There is still a system that favors whites over non-whites. Cops thst shoot and kill black men are likely genuinely concerned for their life, but this genuine fear response to a dark skinned suspect is likely ingrained at a young age and through adult life through years of black stereotyping in the media and other avenues.
Not at all cops are racist, but this doesn't negate the issue at hand.

I'm a white male from an affluent family. My parents never taught me how to act around police. I have the privilege to never have the fear that police would single me out.",1428855471,"","False",1,278,"videos"
"texas_chokehold","","","For everyone that's annoyed by this man, remember that next time you can vote, because if you don't, guys like this always sure as hell do. 

Edit: Fuck I regret posting this from my alt. My main has been dying and could have used the karma. Oh well, guess I underestimated my point. ",1428159034,"","1428187475",2,4679,"videos"
"Mutt1223","","","This further advances my theory that everything in Russia is explosive.",1422387596,"","False",0,28,"videos"
"Red_Valor","","","Just do yourself a favor and don't watch this",1423545572,"","False",1,845,"videos"
"Ultramarathoner","","","My brother's chocolate lab does this... sort of. One day we were goofing around on the dock and while she was looking I dove deep underwater and snuck underneath the dock. There's barely enough space for breathing room so I slowly stuck my mouth out of the water so I didn't bonk my head or make noise so she would hear me.

Well, after about 10 seconds I hear her claws and whimpers on the dock above and she dives in. After a few ungraceful doggy paddles she spots me under the dock and comes toward me with wide, panicked eyes. Apparently she didn't have a rescue plan so instead of gently biting my hand to drag me out she just scratches the fucking shit out of me. I bang my head on the dock and swallow water so now we're both panicking.

I shove her away to escape her toe-knives and climb back onto the dock. I lift her out of the water and set her down next to me. Her tail is going crazy and she licks my face thinking she just saved my life. I look down to examine the bloody scratch marks all over my neck and chest, sigh, and call her a good girl.

TLDR; A sweet, yet dumb, chocolate lab almost drowns me trying to save me from drowning.

Obligatory gold edit: =]",1422246183,"","1422268149",1,654,"videos"
"klownxxx","","","You can skip to 1:10 if you want to get right to the swimming

http://youtu.be/sx4j5sGpBOI?t=1m10s",1425522401,"","False",0,1,"videos"
"SophisticatedBaboon","","","Nice try Mr. Pink",1421115717,"","False",1,1721,"videos"
"yeeppergg","","","[I thought this worked better](http://youtubedoubler.com/?video1=http%3A%2F%2Fwww.youtube.com%2Fwatch%3Fv%3Do09L-hkrzhw&amp;start1=61&amp;video2=http%3A%2F%2Fwww.youtube.com%2Fwatch%3Fv%3DVsHMjWORFvI&amp;start2=39&amp;authorName=)",1420910211,"","False",1,148,"videos"
"broccolize","","","That's gonna scar some kids when their parents catch them swearing...

Edit: Holy Shit GOLD! My cherry has been popped, thank you stranger!",1427758895,"","1427764534",2,4073,"videos"
"industrialwaste","","","People have too many emotions attached to their dick. ",1426006498,"","False",1,311,"videos"
"ComradeNikolay","","","God damn. So happy John Oliver didn't wait it out for Jon Stewart to step down, he would never get to spread his wings and fly like the peacock he is. ",1430596835,"","False",0,1,"videos"
"GentlemenBehold","","","""I cannot be a racist because I have changed the meaning of the word to fit my needs.""",1431470473,"","False",1,3125,"videos"
"BiBoJuFru","","","Is anyone actually convinced by the ""If you really wanted equality, you'd also act to support men"" argument?

By the same logic, you can't be an environmentalist if you only actively try to battle deforestation. You also need to battle against desertification and nuclear waste and monoculture and animal abuse etc etc. 

By the same logic, you can't be a health worker if you only actively treat people with cancer. You also need to treat people with heart disease and dental issues and ingrown toenails.

Feminists tend to concentrate on women's issues because there are issues that are exclusively or mostly female-centered. There are only so many hours in the day!

Also, just for kicks, the only organization in the world dedicated to addressing the male suicide rate (CALM) was created and run by a feminist.  It was the feminist movement in Germany who lobbied for it to be recognized that men could also be raped by women, resulting in an archaic law being changed accordingly alongside marital rape also being recognized for both sexes as a criminal act in 1997. 

If your line of thinking is that the feminists aren't doing anything useful except complain about video games and movie trailers, maybe you are looking in the wrong places? Maybe Tumblr, a site where most users are teens or young college kids is not exactly the best representation of a century-old, global academic movement?
",1428614589,"","1428615036",4,891,"videos"
"Esleeezy","","","I was 2 minutes in until I realized I had no idea what was going on in this video. He just kept talking about shit that doesn't matter to anyone. He showed the spot where he hit the wall like 5 times. I feel like this is what my dog would make a video about if he could make videos. 

""That's where I catch the ball, people throw it cause they like me and call me a good dog or good boy. I pee'd there two days ago. I was walking around and decided to pee, so I peed, there, see. It's my pee corner. I per there early cause I don't want other dogs peeing there.""

Edit: Thank you for the gold. I'm happy my comment brought a few of you guys a chuckle. I also laughed out loud when I wrote it. Lets appreciate the comment for what it is. Take care of yourselves, and each other. 
",1422822015,"","1422873021",1,2694,"videos"
"Cloudy_mood","","","I'm a server in a fine dining restaurant in the US. I also like to eat at restaurants as well. At the place I work at, we receive a little info sheet about your past, or favorite drinks or dishes or if it's your birthday. I read every single guest to see if they like a server to be present or if you want to eat and get the hell out of there. 

I'll recommend the best cocktails, wine, or sodas- whatever you like to drink. If you're not sure, I'll give you a few choices. You like red wine, but want fish? I'm not going to judge you, you're paying the money- so I'll start talking about reds. 

I'll tell you where the specials are, I'll point out the popular dishes based on what kind of food you like(maybe determine it by what you chose to drink), I'll explain them in detail and make them sound appetizing. There are one or two dishes that are underwhelming-so I'll steer you away from those without making them sound bad. 

I'll have a nervous breakdown if your apps, salads and entrees don't come out on time. Not in front of you, but if your items aren't getting to you when they should- I'll most likely take that item off your bill. Your water will never be lower than half. My server assistant and I will make sure of that. I'll always politely ask if you want another cocktail, and get it to you in record time. I make sure each course is perfect- if not, we fix it for you immediately. Birthdays and anniversaries are handled above and beyond(no, we don't sing or clap- we do something else but I don't want to say because I signed a contract I won't talk about my particular store on social media), and if you're cool- I'll have my manager take care of your dessert. I invite you to come back to the restaurant, because you're keeping the place open. I work at 100 percent energy to make sure you will never forget your experience at my place and because of the incentive of a 20% tip. 

I've never experienced what I do anywhere else. I've had great servers- but no one who goes out of their way like myself and the other servers that I work with. We are a well oiled machine. 

Because I work in a big city, I've waited on every nationality.  I wait on a lot of people who bring their culture with them and screw my night with some made up tiny tip because they don't tip in their country. (By the way- if I'm ever lucky enough to visit your fine country, you can bet your ascot I'll do my research and learn what the proper etiquette is at a nice restaurant.)

 I wait on a lot of rich people, and I've waited on people that can't afford to eat where I work. I've waited on celebs. Everybody. And regardless of class- and even what they tip- 98% people I wait on know how good they were just taken cared of. My staff and I deserve 20% because the attention you get is ridiculous. We don't always get it, and it's always a shock because our restaurant is designed to go above and beyond. That doesn't change my attitude, because everyone is spending money, and everyone deserves the best experience. Not every tip is 20%, and I don't lose my mind over it, tips just vary- as long as I'm paying bills- I'm happy. 

I work my ass off to make good money so I can support myself and my son. I'm a single dad(no Chris Rock, I don't need a medal).  I'm yelled at by ignorant people, I wait on con artists, people who call and lie so they can get things for free- people who don't tip anything, but the truth is every job is hard and there's always down sides. But I work at my restaurant because it's the best. 

If you take tipping away, we'll all have to find something else to do, but you will most likely not get your drink on time, you'll get your food however it comes out and it certainly won't be comped if it's wrong. You will get special spiels like--(We have salmon and Mahi Mahi tonight served with...rice...and it's 25.95...ready to order?) instead of the protein, starch, veg, and sauce description. Why is this dish good? What makes it unique?  Servers who don't know or care anything about the food or drinks(one server at a really nice place I went to didn't know what a vodka Gimlet was; I certainly didn't judge him but was surprised), and you'll basically be waited on by someone who doesn't give a shit. 

The funny thing is, most people *want* great service, and that attention to detail. I've waited on SO many families that you can tell they're dying for a good drink and a dinner they didn't/or don't know how to cook at home. But if the initiative is taken away, you're going to get half assed service and be more stressed than when your boss is yelling at you while you're at work. So take tipping away, and be prepared for an eye opener. 

**TL;DR** Take tipping away, fine- we'll have to find different jobs. But you'll have the service equivalent of Walmart at your favorite restaurant. 

**EDIT** WOW! Thank you for the gold!! ",1421127854,"","1421142994",1,6,"videos"
"Why-so-delirious","","","That was some SUPER HERO SHIT!

That was more intense than fucking action movies!

The way he fucking grabbed old-mate, pulled his cord, and then just so fucking casually rolled over and pulled his own parachute was *AMAZING*.

If he gets paid for this shit, he deserves a raise.",1425210183,"","False",1,5219,"videos"
"StitchyD","","","I think this is staged.",1429906940,"","False",0,2,"videos"
"i_getitin","","","I remember when men weren't so openly emotional beings. ",1423183825,"","False",0,1,"videos"
"lccharger90","","","I think the guy holding the camera is a pokemon since he just keeps saying the same thing
edit: thanks for the gold stranger",1428298391,"","1428334342",1,3984,"videos"
"mgeever11","","","Hillbilly ingenuity. Genius.",1423230593,"","False",0,0,"videos"
"fluty","","","    why did you link to the last 10 seconds?",1429407917,"","False",0,1,"videos"
"OzTheMalefic","","","And here's the same guy on The Colbert Report:

https://www.youtube.com/watch?v=FZfaxo8ygZ4

He is..... different.",1431330698,"","False",1,2920,"videos"
"Atlante45","","","This has nothing to do with photographic memory, he is using the [~~3OP technique~~](http://homepage.ntlworld.com/angela.hayden/cube/blindfold_frontpage.html) [3-style technique](https://www.speedsolving.com/forum/showthread.php?39409-Noah-s-3-Style-Tutorial).
This is still very impressive though to be able to do it this fast.

If anyone is interested in blindsolving, here is an easier method called [classic Pochman](http://www.stefan-pochmann.info/spocc/blindsolving/3x3/old.php). Anyone that knows how to solve a cube in 2 min and less can do it, it just takes a little bit of commitment.
It took me about 2 weeks and 5 attempts at a full blindsolve to get it right, but don't despair, that feeling of taking the blindfold off and seeing a solved cube is amazing.

EDIT: Some more explanations on what's happening:

Each corner sticker has a letter associated between A and X (same for edge stickers)
At the beginning he is identifying and memorising what is called cycles.

This is the order in which he will solve the pieces. And this order tells him exactly where every piece is and where every piece goes.

Since there are only 20 movable pieces on the cube, this comes down to memorising 20 letters in a certain order.
An easy way to do that is to group them by pair and associate a word to each letter pair.

VT would be Vault, QS would be Quest, OK would be Oak, etc.


So now we have ten words to memorise in order. An easy way to do that is to make up a story.

""To find a mythic Vault, you go on a Quest that will lead you to a big golden Oak"" the craziest the story, the easier it is to remember.

Then once the blindfold is on, we tell the story back for each key word extract the letters and each letters correspond to a specific algorithm to execute.

Once at the end of the story, the cube should be solved if everything goes according to plan.

This is greatly simplified but it is basically how this goes.

EDIT2: Woah gold, thanks guys!",1425350039,"","1425385093",1,2133,"videos"
"mullonym","","","The only thing better than the story itself is imagining that this girl was not a scammer, but in fact totally genuine and honest. 

Sincerely,

T.V. Shows

edit: I win at poker three times in a row and now gold! thanks kind stranger.",1421196385,"","1421784237",1,1206,"videos"
"acidify","","","I love you Doug!",1421168239,"","False",0,0,"videos"
"slavalove","","","I've always wondered how bar douchebags would behave in this situation. ",1425030497,"","False",0,-11,"videos"
"chaznik","","","Same reaction I have when I can't get it up and my girlfriend says it's fine. ( https://youtu.be/zs0mfeCYQB4?t=1m )

Edit: First gold and I had a grammar error? Amazing, thanks so much!",1426987883,"","1427022940",1,331,"videos"
"clyoung2516","","","So, black people like to touch white people hair too. Phew. That's refreshing.",1422648602,"","False",0,1428,"videos"
"sirspidermonkey","","","Most people IIT are making fun of her. While I agree this behavior is unacceptable I'd like to remind people that you have no idea what's going on her life before this. On one hand, she might be a spoiled bitch. On the other hand, she might have just found out her father was on his deathbed and this was the last time to reconcile a huge family rift.  Maybe on the way to this boat her car broke down and she left it knowing it'd be towed. Then She had to hitch a ride getting there just 5 minutes to late. 

Yes, those are contrived examples, but any of a thousand bad things could have happened to her and this was the last straw. This was the thing that pushed her over the edge. You don't know. While the behavior might be unacceptable, it might at least be understandable. 
",1421780886,"","False",1,2423,"videos"
"davevm","","","We're a strange fucking species, aren't we?",1431635432,"","False",1,405,"videos"
"WWGWDNR","","","But.... No hand jobs??",1430931139,"","False",0,1,"videos"
"0-John","","","Dude you just gave an idea for an invention. I'm going to start submitting my idea to copyright.gov no I'm not stealing your idea its not a jar and it is a device that I can sell for $2.50 because of how easily this can be manufactured. Thanks for giving me an idea I'm send my copyright idea online right before I started posting this.",1420439730,"","False",0,0,"videos"
"NewarkChevelle","","","I'm still hearing Gustavu Amadovar",1431432777,"","False",1,432,"videos"
