"author","author_flair_css_class","author_flair_text","body","created_utc","distinguished","edited","gilded","score","subreddit"
"seanzytheman","","","Watched this while listening to ""A Celebration Upon Completion"" by Bright Eyes, and the lyrics ""And there was happiness in life beyond the sorrow and the pain"" came just when he jumped... scary coincidence",1430882382,"","False",0,0,"WTF"
"cobra00x","","","Hahaha .. I love the title of the Article, ""The Girls Bathroom What Hitler Taught Me,""  Just would have made the article a million times worse by calling it Shower-thoughts instead of Girls Bathroom.",1427834822,"","False",0,3,"WTF"
"test_beta","","","This reminds me of the webs weaved by drugged spiders. It's really amazing, like you can get a normally functioning person who would be able to have a job, partner, ambitions, children, go on holidays, have a favorite football team, go fishing their their pops... Then introduce them to a few chemicals for a short amount of time and you end up with this shell of a person. The engine is humming along nicely, but you've got a demented chimpanzee with no concept of the road rules behind the wheel.

Tweakers are fucking stressful as fuck to be around, or just look at. Constantly trying to do something, can never sit still, and they'll always be planning something crazy for about 60 seconds before that train of thought ends and an even crazier one starts up. This all seems to make sense to them, but it's just crazy jibberish to any sane observer. The only time they can sit still and shut up for a minute is when they're firing up the old ice burner.
",1421717716,"","1421718972",1,72,"WTF"
"anuncommontruth","","","Must have been listening to my mixtape. 

Edit:  /u/ar312 is serious fam for the gold",1431548210,"","1431579003",1,3872,"WTF"
"ssalamanders","","","I'm not unidan, but I am a herpetologist with a significant anatomy/physiology background.  

Turtles are resilient suckers, so he may still have hope.  I defer to the plant people to identify the pond plants, but I would doubt rooting in tissue is something plants typically do.

Turtle shell repairs are relatively common in the rescue world.  Unfortunately, what works as a great protection against many predators does not protect against cars, falling structures, and really determined beasties.  Turtles have very slow metabolisms, so healing time is extended.  ""While a fractured bone in a mammal can heal in six to eight weeks, a fractured shell in a turtle can take years to completely heal"" (http://vet.tufts.edu/wildlife/Interesting_cases.html) depending on the size.  In some cases, the shell may never regain structural integrity, and captive life is likely the only response.  That said, turtles survive pretty gruesome injury (see the above source), including breaks that open the body cavity (http://www.kawarthanow.com/kawarthanowguide/2014/06/02/kawartha-turtle-trauma-centre/).  Sometimes they even have to be opened to unbind eggs that get stuck and can kill them.

One reason for this horror is their slow metabolism - turtles don't require a ton of oxygen.  They overwinter underwater!  Also, the lung space get's eaten up by limbs and neck when they cram into their shell - cannot actually breath like this(http://jeb.biologists.org/content/206/19/3391/F1.large.jpg) - partly because of space and partly because they have no diaphram - they need to move their arms to breathe.  They can also absorb oxygen through their skin (mostly their butt and mouth) allowing them to sustain serious injury to the lungs.  Much of this cavity seen was occupied by lung (http://fc04.deviantart.net/fs70/i/2010/288/4/0/turtle_anatomy_by_elizabethnixon-d30swu6.jpg and http://static.trunity.net/files/124101_124200/124155/200px-Turtleresp.gif).  Likely collapsed.  They cannot be very active without breathing through their lungs (which requires arm movement), and usually do best in water to tranfer oxygen through their skin.  I think this explains the plants in the body.

Ok, so what does all this mean for this unfortunate turtle?  It means he definitely needs to see a vet, and one that wants to learn.  This is a special case and will take some creativity.  I imagine step one would be pain med (injected), and cleaning.  Then assessment of lung damage - is the other one ok?  Is this one collapsed or punctured?  Reptile lungs are sac-like (not spongey like ours) - so its hard to tell.  After clean up and assessment/treatment for whatever found, the shell has to be patched, which is routine (http://www.tortoise.org/general/shelinj.html).  Then antibiotics and some serious convolescence.  Only a vet can determine if putting him out of his misery is the right course of action.  I personally think its worth trying to save him - but I'm not a vet.

I'd recommend putting him a tupperware bin with a low level of some cool water (hot holds less oxygen and would increase his metabolism and movement).  This will rehydrate him and allow him to absorb some oxygen.  Make it dark if possible, so he has some privacy and lowers his stress.  Take him to a vet - call the state vet college and get a recommendation of where.  Not any vet will be able to handle this case.  He needs to be out of the wild - something will eat him and not so pleasantly.  Hope this helps.

Also, cooter is the actual name of the turtle - its also a common term in the south for turtles, as dirty as it sounds ^_^. 

Good luck to him, keep us posted.  ",1426549476,"","False",1,702,"WTF"
"mtru01","","","How to collect coffee creamer.",1430105774,"","False",0,1,"WTF"
"freedomfromyou","","","This is when bronies and furries realized they have a common interest.",1422611340,"","False",0,1,"WTF"
"exxocet","","","These are two weird fuckers. You have got a crazy insect that would fit in well in a sci-fi like the [Giant Devil's Flower mantis](http://imgur.com/a/up6hh) found in equatorial Africa, or they pass their time catching and eating [hummingbirds](http://voices.nationalgeographic.com/files/2009/09/praying-mantis-catches-hummingbird-picture-2.jpg). Weird bastards.
But then it is chomping down on a gecko, which has fused its eyelids closed (luckily they are transparent!) so they have to lick their eyeballs to keep them [clean and moist](https://c1.staticflickr.com/9/8042/8007387968_fdf05143fa_z.jpg). Some collect dew off their eyes for a drink, their eyes could also help advance contact lense and camera technology with their weird [multifocal system](http://farm4.static.flickr.com/3729/11114463863_54966d7612_m.jpg) and [colour night vision](http://www.journalofvision.org/content/9/3/27.full). Not to mention clinging to vertical glass surfaces or running upside down using [nano structures and van der waals forces](http://productinspiration.com/wp-content/uploads/2008/02/gecko4-h.jpg).

 I mean really - what planet are we on with these two freaks running around?",1420907666,"","False",1,2111,"WTF"
"No-Im-Not-Serious","","","webcam that goes to roofpisser.com with a live*stream*. After a week put a sign up that says ""Smile, you're on roofpisser.com!""",1425586398,"","False",1,990,"WTF"
"griffith12","","","Waiting patiently for the fellow Redditors that threw it out to upload their video of you poking at their ""dead foot"".

""Look at him, he thinks its real!"" ""LOLOLLLOLOLL""",1421888098,"","False",0,1,"WTF"
"pitchko","","","I was born in souther russia and my grandpa lived through the worst parts of the famine there. This is a story that we know about him:

When he was really young (6-8 or something) his mother no longer had enough to feed him and all his siblings, so she gave him up for adoption in hopes that they would get fed better. 

After a few weeks though a neighbour of theirs secretly gave them a cow, and they were able to keep it in the house and bring it grass from the outside. This way no one knew they had a cow and would not kill them for it. 

Once the cow started to produce milk she decided she could go and grab my grandpa back from the orphanage, but when she went there they just told her he was dead. She demanded to see the body and they took her to the gymnasium that just had a pile of naked corpses in it, one of them was my grandpa. 

when she found him he was still breathing however so she took him home and he got better. 

He also told me stories about how he was chased at night by people wanting to eat him when he visited a neighbouring village. 

Later when my grandpa went to war he came back to every one in his family dead, and his house that he had lived in just a bunch of tank tracks in the ground. 

SURPRISINGLY!!! 

my grandpa was a very kind and good individual and became fairly successful, he had a bunch of kids and they had a bunch of kids and he only passed away a few years ago. 

Edit:

This is a picture of him before he died: http://imgur.com/zwF8Mhd

When my grandfather came back from the war he met my grandma at a train station, he kind of lied to her a bit about where he was headed (because he had recently found out he had no where to go) and told her he had a house in Rostov (the closest big city) she ended up coming out there to visit him and he at the time lived in a horrible apartment. He was emberaced by it and his lie so when they met at the train station he just carried her bags around as he showed her the whole city. Never inviting her home to his house until finally it was really late. She was horrified at first by his living conditions and that he lied to her but then he told her the full story and she decided to stay, and then they got married. They stayed married for almost 50 years until he passed away. 

To tell you the truth I teared up reading your guys comments, goes without saying the gold is for him and not me. 
I think its amazing that this story that I have heard so many times told privately in my family for so long just got this many peoples ears. Thanks a lot. His name was Andrei Pitchko. ",1423533944,"","1423554828",3,4336,"WTF"
"FireandLife","","","Try /r/spacedicks",1423628589,"moderator","False",0,1,"WTF"
"Tainted_OneX","","","Feminists: ""Stop sexualizing women. Also, here's a video of me which will only get views because I sexualize myself and you can even basically see my butthole in one of the clips. GIRL POWER!""",1431837908,"","False",0,-2,"WTF"
"ihatepikeyz","","","Are you sure that's a centipede? To me it looks like a perfectly inked can of pussy repellant. ",1424321311,"","False",1,5,"WTF"
"Ilikeyouyourecool","","","Meh,  should buff right out.  ",1425464626,"","False",0,1,"WTF"
"GuelaGhoul","","","Staring at it just might make the meeting more tolerable. What kind of company do you work for?",1431567540,"","False",0,79,"WTF"
"GeneralBS","","","Happy cake day!

Hope your recovery went well, can we get an updated photo of your face? How long ago did this happen?

edit - [Comment](http://www.reddit.com/r/WTF/comments/31yt7s/what_i_looked_like_after_the_bear_finished_eating/cq69ghi) showing the story here for anyone not seeing it as well.

edit edit - Her ama link
www.reddit.com/r/IAmA/comments/1byn1l/i_was_mauled_by_a_bear_fought_it_off_and_drove_4

editx3 - Thank you for busting my gold cherry kind redditor!

[After surgery pic](http://i.imgur.com/xr9INiM.jpg)

[Recent photo of OP](http://i.imgur.com/VOuhjrm.jpg)

Added these due to people not being able to see OP's story comment

&gt; Two years ago I was introduced to the reddit community in an epic iAMA, and enjoyed it so much I've stuck around for two years of amazing WTFery.
To celebrate my cake day, I'm again giving away the Kindle edition of the award-winning ""inspirational"" book I wrote about my misadventures -- which you can download here for FREE until 4/12.
Thanks everyone, for another great year!

Will not add the link to the kindle version of her book due to it being taken down by the spam filter.

~~Last edit~~ since OP's original comment is now visable.

Apparently OP was the one to guild me and thank you. Hope you live a long and happy life with nothing to lose.",1428557383,"","1428572804",1,76,"WTF"
"SuperSwish","","","Time to rub some vick's on that shit.",1425466072,"","False",0,3,"WTF"
"EJSESH","","","Alright here it goes.

I was doing some garden work at my nans house, it was a hot day and nan was being nan providing me with cold fresh beverages. She came out with a weird drink that tasted like medicine it was fizzy and kinda gross but I downed that shit cause I was thirsty. Finish up things in the garden and head off home. I get in the car and feel a little stomach rumble, meh it's only 20 min car ride I can hold it. 

Yeh..no. 10 mins in I hit traffic and the cramps intensify. They come in waves each cramp is worse than the next. I'd been in situations where I needed to shit in the car before but always managed to hold it until I got home, this was different. I finally got out of traffic and found the nearest street and pulled over. I admit I was freaking out, I desperately searched the car and pulled out a cooking pot from under the seat (theres this gate that has a magnetic strip that you can swipe the pot over to open it up). 

I position myself in the back seat and relieve myself. I see a childrens park across the road from where I parked, there was surely a toilet there but it was too late. I looked down at the steaming pot of shit and gagged. I found a pair of socks and wiped my ass, not very well though they were only ankle socks. 

I was very ashamed in myself, I did a quick drive by shitting by opening the door and throwing the pot of shit out onto the road. It was a hot day. 

Obviously I took a photo and sent it to my friend and told him the story before I got rid of it. This was a mistake. 

A few days later I was in the car with my gf, she looked around the car and asked where her favourite pink socks were. I told her I didn't know what she was talking about. Later that night she was on my phone and found the message I had sent to my friend along with photo evidence. 

""Oh you don't know where my socks went?!"" 

Well she shouldn't have gone through my messages anyway so we were even. 

Found out nan gave me a laxative drink.

TL;DR: I pooped in car, gf found out I used socks to wipe butt.

http://imgur.com/XxH7ovE",1423204053,"","1423205431",1,247,"WTF"
"bhuddamonk","","","Her arm looks like a sweet potato. I would give her a dollar just for that alone.",1421368937,"","False",0,3,"WTF"
"RamsesThePigeon","","","Boneologist here!

What you're looking at is a typical arrangement for sorting and categorizing the dismembered skeletons of wildlife! This is a ritual that dates back to 1981 - when deer and elk evolved - and has since become the foremost method for guaranteeing that their respective populations don't explode!

Deer, elk, and other such reptiles all procreate by way of ""asexual bonemosis,"" which means that they fall apart at the time of their death. At that point, the larger bones sink into the ground and gestate into baby versions of the amphibians that birthed them, while the smaller bones transform into leafy plants and cacti (to serve as nourishment).

Anyway, after this discovery was made by the first boneologists, they took to arranging bones into shapes like the one that you found! It guarantees that only the healthiest of the species survive, since they wipe out their less-capable comrades beneath the dirt before they are ""born.""

I hope that helps!",1422999032,"","False",1,313,"WTF"
"WestcoastWonder","","","I find that blended chicken guts are far easier to hunt.",1421195088,"","False",0,8,"WTF"
"EchoOfOblivion","","","You're supposed to shake it not ring
 It out like a wash rag. ",1429032089,"","False",1,56,"WTF"
"dutchoven2014","","","Oh my god I'm wearing those exact same pants right now.

Edit: proof bitches. http://imgur.com/W9Q2790",1421901780,"","1421902123",1,823,"WTF"
"BobsDingleberry","","","It could have been worse
https://www.youtube.com/watch?v=y6lTSxJvR4w",1420515098,"","False",0,28,"WTF"
"MagicalKartWizard","","","I think they're going to make a right turn.

Edit: Gilded? Thank you!",1425949413,"","1425993392",1,517,"WTF"
"mobfather","","","Back in 1988 when I was 14, I was in Kenya and visited the Rothschild giraffe sanctuary where a lady giraffe called Daisy bent over and tongued me in my eyeball.

Cut to 30 years later and I was in a bar in London and for some reason I started to recount the story when I was interrupted by a bloke who asked me if the giraffe's name was 'Daisy Rothschild'. Turned out that he had been tongued in the eyeball by the very same giraffe, in exactly the same year.

TL:DR

Back in 1988 when I was 14, I was in Kenya and visited the Rothschild giraffe sanctuary where a lady giraffe called Daisy bent over and tongued me in my eyeball.

Cut to 30 years later and I was in a bar in London and for some reason I started to recount the story when I was interrupted by a bloke who asked me if the giraffe's name was 'Daisy Rothschild'. Turned out that he had been tongued in the eyeball by the very same giraffe, in exactly the same year.",1426610856,"","False",1,650,"WTF"
"baobrain","","","Did some reverse searching.

This happened on November 5 2014 in the afternoon in downtown Haining, Zhejiang in China.

The car was a Honda (no model specified) and the truck was carrying loose mud.

~~http://kankanews.com/n/3_5745977.html~~ 

~~**http://domestic.kankanews.com/c/2014-11-10/0045745977.shtml**~~

\^\^inaccurate

---------------------------------------------------------------------------------

~~That's my source, but it's also on qq.com somewhere as well but I'm too lazy to use the shitty site.~~

**Found the video: http://v.qq.com/page/f/1/j/f0015le561j.html**

There isn't much there but it says the source is AnHui Television so it was probably a local news segment.

Edit: bad link

Edit 1: added video

**Edit 2: found an article, but the closest tencent server is probably in beijing so the article loads slow as fuck**

**http://zj.qq.com/a/20141105/073941.htm**

**EDIT 3: Archive.today link!**  Translating right now.

https://archive.today/JKRrN


**Edit 4: translation**


&gt;This afternoon around 3:30, there was a severe accident north of Jiaxing Haining city Biyun bridge.  A construction truck crashed into a small white sedan during a left turn, and flipped on its side crushing the car leading to the deaths of the two men inside the car.

&gt; **Crushing the sedan**

&gt;Witness Mr. Cai told ZheJiang Online reporter that when he got to the scene, the accident had already occurred.  The sedan was completely crushed under the truck, and the dirt from the truck completely buried the sedan.

&gt; Mr. Cai gave us some footage from the accident.  In the footage, right before the accident, the truck was traveling from south to north through the intersection, and the sedan was turning left from south to the east.  The two vehicles collided in the middle of the intersection and the sedan was crushed in the process.

&gt; **The two men on the car both died**

&gt; ""At the time, the truck was going pretty fast, so after jerking the steering wheel it fell onto its side.  I heard the sedan was just purchased from the 4s dealer (car dealership), but none of us would have thought this would happen right after they drove it out from the dealership.  Recently, the old city is being renovated, so there are a lot of construction vehicles around, and when they enter the city they're going pretty fast from the bridge.  It's quite dangerous"", says Mr. Cai (the witness).

&gt; After the accident, HaiNing Fire Dept. hurried to the scene.  According to the Dept. , after cleaning off the dirt, they found two male corpses.  Both were from JianXi.

&gt; **Footage shows neither vehicle was disobeying the traffic light**

&gt; From the footage Mr. Cai provided us, the light at the intersection was flashing green (means it will turn yellow very soon).  According to traffic laws, neither car was running a redlight.  But under normal conditions, the sedan should have yielded to the truck, but as for the actual reason of the accident, more investigation is needed.

And presumably Mr. Cai is the security guard that was watching the cctv

So fuck that kankannews shit.

**Edit 5: Thanks for the gold!  Never thought I would be guilded for translating an article about two guys getting crushed to death**",1428176652,"","1428191144",1,999,"WTF"
"PurpleZeppelin","","","Because.",1426918365,"","False",0,1,"WTF"
"kenocar","","","If he were just sitting, it wouldn't be worth watching.  But sitting and smiling, well that's completely different.  I wonder if he's going to release a dvd?  Or at least a ""best of"".",1421818246,"","False",0,1,"WTF"
"Alabaster_Sugarfoot","","","This color-changing octopus is demonstrating a form of cultural appropriation, and I would like to use this opportunity to shamelessly plug /r/racistcephalopods to shame this naughty invertebrate. ",1422977129,"","1422977349",1,67,"WTF"
"filmfiend999","","","What a creepy fuck.",1424795222,"","False",0,1,"WTF"
"bubley87","","","That's how goth kids play hopscotch. ",1426893420,"","False",1,117,"WTF"
"Dr_Jerkface","","","They stopped being hot when they turned 9.",1428660801,"","False",0,3,"WTF"
"totallysomedude","","","/r/oddlysatisfying

...no? Just me? Okay. ",1430798872,"","False",0,427,"WTF"
"LazarWulf","","","That water...is an ice cold bitch. ",1420512053,"","False",0,1,"WTF"
"smell_e","","","Eh, my grandpa did the same thing after he died. ",1429738553,"","False",0,1,"WTF"
"diadac","","","The singers voice is annoying but besides that it's not a bad song",1425329941,"","False",0,1,"WTF"
"shiny_dittos","","","Evolution: hmmm, big heads and small bodies? Maybe we can eventually work a bigger brain in there. Think of all the possib... Nope no noooooo back to the drawing board ",1421095336,"","False",0,56,"WTF"
"CUNTRY","","","That guy wasn't messing around with that neck cut.... surprised he didn't decapitate him.",1428761020,"","False",0,2,"WTF"
"TrynaStayHumble","","","I suddenly want to watch Tremors",1424924283,"","False",0,3,"WTF"
"donac","","","Have you called the police?  Sure, it's just ""property damage"" but it's clearly an aggressive move by an unstable person who knows where you live and what you drive.  I'd be worried, honestly.",1423489607,"","False",0,41,"WTF"
"tyguy09","","","thats fuckin stupid ",1428671729,"","False",0,1,"WTF"
"Lilimosa","","","/r/Im14andthisisWTF",1427171746,"","False",0,5,"WTF"
"cu3ed","","","I have to stop treating the ""nsfw"" tag like some kind of curiosity button.",1429023011,"","1429062316",1,3575,"WTF"
"bitshifter52","","","A great shot that didn't contaminate the meat. Yes, I have gone hunting and don't have any guilt. It's called the food chain for a reason.",1433091441,"","False",0,0,"WTF"
"trustworthyboyscout","","","The Japanese military: A Studio Ghibli production.",1431802754,"","False",1,907,"WTF"
"Bane047","","","You should tell them to abort it.",1429920167,"","False",0,0,"WTF"
"Choopytrags","","","IDK, I just feel so bad for the beaver.....Lived his whole life, was killed by a hunter, stuffed into zombie like pose and then the final humiliation - A mobo gets shoved up his ass, DVD drive shoved into his chest.......",1431840117,"","False",1,106,"WTF"
"AriBanana","","","I live in Montreal and this is like a 7/10 on the odd- metro station- occurrence scale. I remember once a really wasted lady tried to get on at Atwater but fell and lay there just as the doors closed, getting pinned. Suddenly, she sprung to life and climbed through the pinching doors, which pulled down her jeans. I guess she figured ""Well I'm halfway there, Tabernac!"" because she just squatted down and started peeing right there in the front of the train car. She stood, pants still on her ankles, and screamed as we took off.
 
While she shuffled around angrily a beautiful thing happened. Strangers, looked at each other, silently motioning warnings as the pee moved up the aisle. Spreading just a few seats before the icky river, the human spirit showed itself in nods and pokes and nudges and gestures. No one wanted to alert her to their unique presence so this was a subtle game. Feet and purses where silently lifted and as we pulled into Guy-Concordia a communal sense of relief was felt. We had been the perfect faceless crowd and yet spared each other from urine soaked shoes. 

Before having to choose if I should get off or not, two burly STM cops came and wrestled her out. So I stayed in my seat, and warned a new passenger of the source of our small stream. Most people just stayed on and played the foot-lift wave until our respective stops. The pee flowed back and forth with each stop and was oddly mesmerizing. 


Edit: thanks for the gold",1426490582,"","1426576854",1,1809,"WTF"
"Mr_jon3s","","","Be nice to people you never know if they are crazy enough to break into your parents home at night and stab them to death for something you said.",1427930362,"","False",1,144,"WTF"
"teapotjunction","","","Gotta look good for the girls. ",1424452219,"","False",0,4,"WTF"
