"author","author_flair_css_class","author_flair_text","body","created_utc","distinguished","edited","gilded","score","subreddit"
"nordoceltic","","","While its pretty WTF to paint it on your house, if you are curious why this person cares about male circumcision here goes:   

http://www.historyofcircumcision.net/index.php?option=com_content&amp;task=category&amp;sectionid=8&amp;id=73

US circumcision has its rootes in the super-Christian victorian days of the 19th century where people like John Kellog touted the genital mutilation of boys and men to stop the ""horrible"" illnesses of masturbation and fornication. It was widely thought it would make sex less pleasurable and thus encourage their ideal of holy chastity.   Curious that Muslims today do a very similar procedure, for the EXACT same reasons today and we call it barbaric.  

And then at the same time that they thought the bumps on your head legitimate gave insight int your health, and the electro-shock butt plugs could cure anything but a lack of kinkiness, they claimed it would reduce the spread of VD's.   

Modern medicine has shown there is little no significant risk of disease or legitimate reason to preform circumcision for health.   There is a very small reduction in the transmission of HIV, but its nothing compared to the protection a good condom provides.  Bascially in the 2000's there is no compelling reason to preform widespread circumcision automatically at birth other than tradition.  

Then it became tradition, pushed by a small number of doctors on infants with no respect to their rights.   Apparently parents are allowed to tell doctors to lop any ol' part off their kids at infancy with no respect to the rights of the child.   

Granted male circumcision is nowhere near as brutal or debilitating as female circumcision.   That still doesn't make it ok though.  The issue at point is that its done often at the moment of birth, and yes it has on occasion destroyed the penises of baby boys.   Any surgery or body mod should be done under informed consent.  

Personally I don't care if you wanna get cut.  By all means.   But it should be illegal to circumcise anybody under 18 who doesn't give informed consent themselves to undergo the procedure.  I can't fault my parents because they didn't know any better, but I now wish I hadn't been myself.  ",1427223420,"","1427223682",1,108,"WTF"
"GangleMonster","","","/r/fatpeoplehate",1428255619,"","False",0,1,"WTF"
"steve_the_pirate2","","","What is that thing ",1429773460,"","False",0,2,"WTF"
"Elindomiel","","","When I was a little girl, I used to play fight with my sister. One time she fell off the couch and cried a lot. My parents warned me that if I'd hurt her badly, she'd pee black and we'd have to go to the hospital. I stayed up all night crying and praying that she didn't ""get the black pee-pee.""",1429499704,"","False",0,1,"WTF"
"Leonardo_DiCapricock","","","She's beauty, she's grace, she's Miss United States.",1430080905,"","False",0,2,"WTF"
"temporad","","","[you are doing it wrong](http://i.imgur.com/utDaaj2.gifv) (NSFW)

Edit: Holy shit! my first Gold, Don't believe I deserved It since I merely posted an already existing GIF but Thanks anyway.",1426170106,"","1426171751",1,39,"WTF"
"TheEthalea","","","This is very common in elderly people. If you see an elderly person beginning to fall you are better served to try to get beneath or beside them, do not grab onto them, and allow them to slide down your body until they're in a sitting or laying position on the floor. 

Once they're safe from falling any further, cover them with a blanket, and check to make sure they're not dizzy. Get another person or two and in a smooth motion raise them up enough to get them in a chair. Once they're able to stand again you should be okay and not have to deal with any skin tears or broken bones. ",1421033352,"","False",1,1924,"WTF"
"Foamparties","","","Maybe it's waiting for the sleeper carriage",1421545150,"","False",0,0,"WTF"
"cgimusic","","","What's vagina and why does it

what's the word? Buuurrrnnn?

Edit: thank you for the gold anonymous Redditor.",1429027535,"","1429037300",1,530,"WTF"
"Tapeworms","","","This is so incredibly stupid.  One gust of wind and his Windex bottle will fall, rendering his task impossible.",1431456649,"","False",1,4630,"WTF"
"wrapped_in_clingfilm","","","Hello Folks, botanist here! First thing first, this is a Abulamus Africanus botfly, which places it in a class of its own. In other words, this is no ordinary communal garden variety of botfly, no siree. This is a killer larvae! Unfortunately, our generous OP host has exposed himself to an unusual bacteria that uses the Abulamus Africanus as its host. This bacteria (spridufiliminous accumalatristisus) attacks the temporal lobe area of the human brain, specifically the area that deals with restraint/social behaviour. To cut a long story short, there is a strong and present chance that our beloved OP will start openly masturbating in public places without any sense of shame or self-restraint whatsoever.

I am not a botanist, I really don't give a fuck, this is disgusting, fuck you.",1422052788,"","False",1,1237,"WTF"
"Smeeee","","","Please tell me I'm not the only one who saw one of [these guys]( http://i.imgur.com/JVzIrXt.jpg), between the nipples and the bulging skin graft.",1421864869,"","False",1,319,"WTF"
"jrock1979","","","sticker was probably made in china",1424326647,"","False",0,4,"WTF"
"Cold417","","","Did you guys see that DeLorean?",1427340209,"","False",1,7,"WTF"
"slingmustard","","","Anyone got any Fritos Scoops®?",1429411782,"","False",1,3680,"WTF"
"asbhopal1","","","Theres a joke here which involves the word ""hoe"". As soon as i have I'll get back to you

EDIT: My first gold...thank you stranger. Now lets stop ""whore""sing around",1422709792,"","1422733902",1,324,"WTF"
"quesito4","","","It looks painful but is it- ...  Is it weird that I want one for my dick?",1425795600,"","False",1,1365,"WTF"
"wishiwascooltoo","","","I've heard of getting wood but this is ridiculous!",1423979260,"","False",1,1566,"WTF"
"JesusSlaves","","","Now he can count to six",1428093851,"","False",0,0,"WTF"
"KristyWaffles","","","You may now Motorboat the Bride ❤",1423347172,"","False",1,2502,"WTF"
"Apcidefur","","","No, that red nub is NOT the tail, its an oil gland above the actual tail that chickens use to coat their feathers to clean them. Same as ducks but theirs adds a waterproof layer. Have you ever noticed when they preen their feathers they rub back over their tail then over their feathers? That's what they are doing.",1422435599,"","False",1,417,"WTF"
"God-of-Mercy","","","So the third image baffled me, but i think ive come up with a pretty well thought out explanation,   enjoy   http://i.imgur.com/xxzw9k7.png

(yes those are rocket hands)

Edit: wooo! my first gold! thank you kind stranger :) 
",1432072646,"","1432136901",1,1651,"WTF"
"theuselessgeneration","","","So my son had a heart transplant at 12 months due to hypertrophic cardiomyopathy. The average 1yo heart is 55 grams. His was 137. This picture is showing how thick his heart walls got before they stopped working.",1423926851,"","False",1,1507,"WTF"
"soopninjas","","","Hamsi and his half-brother just out for a stroll.

Edit: I'm quite ashamed to receive gold when making a joke about half a man.",1427486872,"","1427504894",1,1374,"WTF"
"paliperidone_2014","","","[NSFW - Another photo of the practice of ritualistic eyes gouging](http://i.imgur.com/ka4RihU.jpg).

&gt;local festival held biyearly in a town called Jaskarupi in south India. Participants spend several days parading through village expressing strength in mind over matter or Vidalou (the use of one's 3rd eye or mind's eye) by performing self mutilation. This picture depicts finale of the three day event and ritualistic removal of the physical eyes to be devoid of physical sight and become one with their Vidalou.

credit :/u/NANEWA",1427358800,"","False",1,2,"WTF"
"GoldenBacon","","","Talk about a paper cut.",1427269322,"","False",0,1,"WTF"
"ILOATHESEAGULLS","","","Does he check his watch at end?

""Damn it takes this long to die?"" ",1429817082,"","False",1,4145,"WTF"
"Vornehmlich","","","I think it's maybe not made for eyes ...",1426646397,"","False",0,2,"WTF"
"selstice","","","Ask her *how long it's been since she's seen her cousin It.",1428776508,"","1428778981",0,19,"WTF"
"KimNotCom","","","Didn't make sense until I found [this](http://i.imgur.com/enmocp8.gif).",1424049266,"","False",1,466,"WTF"
"Krasstrout","","","
License plate should be blurred",1425435392,"","False",0,1,"WTF"
"frozenchimp","","","My ancestors are smiling at me Imperial, can you say the same?",1430071803,"","False",1,2320,"WTF"
"holocaustic_soda","","","That arm took a slight left turn there",1427595080,"","False",0,6,"WTF"
"BrightenthatIdea","","","This looks like a place were they probably got saved from drowning but then two people pulled up on a scooter and shot them",1423000761,"","False",1,140,"WTF"
"ChumleesCumRag","","","Neither is misspelling ""to"" .",1432491098,"","False",0,1,"WTF"
"Obeeeee","","","It seems to me that the only thing coming out of Rochester is icy lies. ",1424350581,"","False",0,1,"WTF"
"MacLeodDaddy","","","*I'm sitting on the dock of the bay,  
Watching my fingers get smashed away*

(Wow, gold! Thank you kind stranger.)",1428248821,"","1428288814",1,216,"WTF"
"brandonbruce","","","She's hot. Lost interest in story when I saw her. ",1423958590,"","False",0,1,"WTF"
"nanoakron","","","Sugar cane grinder. 

And there's not much else he can do about it really...no point in freaking out. ",1426313448,"","False",0,1,"WTF"
"jakjg","","","Your neighbors are Australian?",1421698072,"","False",0,3,"WTF"
"monkeiboi","","","This shit again?

Newsflash! If you store food products in a low humidity environment (e.g. Inside) it will dry out and not rot away as you expect them too.

We have mummies from Peru that are hundeds of years old and still look perfectly edible",1427164392,"","False",1,2934,"WTF"
"mypethuman","","","did he died",1428176729,"","False",1,-2,"WTF"
"gordonfroman","","","he fell back and grabbed the chick which caused her to swivel and for some reason defy the laws of physics and she ended up with him.",1431819664,"","1431820284",0,2,"WTF"
"GingerTats","","","Ever since I was about 3 I have hated chimpanzees. Long before I knew anything about them or their behavior, I just recall seeing an image of one and being immediately filled with a raw, powerful, seething fucking hatred. I mean owning a wild animal is fucking stupid, and that's why this happened. I doubt chimpanzees are murderous psychopaths. But still.

I would pay an exorbitant amount of money to be able to fucking shoot every single chimpanzee on this planet in the face with a 10 gauge. ",1421833369,"","False",0,0,"WTF"
"zundish","","","*Seen on a dating website:*

""So, tell me something about you""

""Like what""

""Something personal maybe. Oh I know, are you an 'innie' or an outie?!""


",1421876488,"","False",0,22,"WTF"
"kwyjibohunter","","","http://i.imgur.com/DvdW2kM.gifv",1430401770,"","False",0,1,"WTF"
"dilapidated_dice","","","The point is to punish the parents, to make the parents change their behavior. She whines to a reporter instead of trying to make positive changes. She even says in the article (or maybe it was the grandma) that her car doesn't always start up so, knowing that, you need to make other arrangements for your child in preparation for things like this. Either it happened once and she just wants attention or it happens so many times the school is fed up with the parent not being responsible. Personally, I used to be dropped off 45 minutes early so that if the car didn't start I could ride a neighbors bike or find another way. When my sister took her kids to public school, she made sure they had a back up. It's not that hard to make sure your kid is at school on time everyday and having a piece of cardboard around them isn't going to destroy your delicate little flower.",1425743800,"","False",1,-6,"WTF"
"Kayoto","","","_""So aim a little higher,_  
_If you want to go drier.""_

(﻿ ͡° ͜ʖ ͡°)",1429024311,"","False",1,1950,"WTF"
"weatherbys","","","Concrabulations! ",1428894817,"","False",1,46,"WTF"
"hippoinc","","","saw the first picture and noped out.",1430315085,"","False",0,1,"WTF"
"gokism","","","Mr. Hunter killed a sentient being outside an animal shopping mall no doubt built by other sentient creatures besides humans.  Why was a human allowed to hunt outside an animal shopping mall?  Why wasn't there proper security from mall rhinos or other pigs?

What kind of monetary systems does the food court accept.  Bones?  

Did the pizza have any meat on it and if it was sausage did anyone think it was weird?  How did the animals make the pizza?  Were humans employed by the animals and if so how were the humans paid?

Why didn't the dog just ask the pig if he could eat the pigs vomit?  You know if the hunter didn't show up all the dog would've had to do is make the pig run.

What the fuck indeed.",1423711521,"","False",1,245,"WTF"
"77bc","","","Just trying to suntan that beave...  What's the problem?",1426172331,"","False",1,3,"WTF"
"Macaroni2552","","","How to win a [gunfight](http://youtu.be/dQw4w9WgXcQ)",1429845164,"","False",0,7,"WTF"
"GamingArts","","","Hahaha ""He wanted to go out *softly*"". ",1428478693,"","False",0,2,"WTF"
"PaperMoonShine","","","Any more pictures? or does it turn into a bloodbath?",1432591966,"","False",0,1,"WTF"
"smilingwineo","","","Video was removed from YouTube. Can't watch it :/",1422995710,"","False",0,1,"WTF"
"Cactus_Sack","","","fuckin' octopocalypse.

Edit:  Super thanks for the gold!",1423226754,"","1423247386",1,2026,"WTF"
"Fenghoang","","","[Hmm...](http://i.imgur.com/rKAcgq6.gifv)

EDIT: Thanks for the gold, kind stranger!",1427198380,"","1427277603",1,173,"WTF"
"steinsi","","","Which part of the pig is that ",1424788547,"","False",1,261,"WTF"
"Lychosand","","","One of the reasons I have one... but I'll continue to cut up water bottles for shits ",1428769200,"","False",0,1,"WTF"
"crunchy_wumpkins","","","People keep saying good for them for trying, but I get the impression that they're messing around in a hotel gym room or something just for kicks. None of them are wearing sneakers and I know from experience that the treadmill belt hurts bare feet pretty quickly. The one girl is even jogging on it, there's no way that couldn't hurt. ",1426626263,"","False",0,0,"WTF"
"yoyoball27","","","These all look like enemies from Dark Souls.",1428689776,"","False",1,816,"WTF"
"beerpop","","","Sailor: how's it hangin there Frank?

*Talks out of side of mouth: not great Jim I only asked for a little off the top!

Sailor: hahahaha

*Side of mouth: hehehe

Edit - thank you for the gold!!!!",1421809790,"","1421893237",1,1520,"WTF"
"nofukslefttogive","","","The downs all over this one",1425163619,"","False",0,-2,"WTF"
"superguyguy","","","The murder weapon.  You just solved the Jimmy Hoffa killing.",1430527466,"","False",0,1,"WTF"
"Seven7greens","","","I used to make videos and edit them too. Just never made it like this one.",1426040920,"","False",0,2,"WTF"
"captainsciencepants","","","Friends of the road. ",1427465301,"","False",0,0,"WTF"
"yellowstickynote","","","I just saw the perfect motorcycle helmet for him yesterday...

[Reference](http://www.reddit.com/r/pics/comments/2w77vk/that_moment_you_realize_a_helmet_really_saved/), by popular demand. :)

EDIT: Gold, really?! You guys are too kind, thank you!",1424282427,"","1424290922",1,409,"WTF"
"Ben_Deroveur","","","This is in a parking lot with spots on each side of the driving lane, that isn't very long.

You can see in some pictures that the car was actually pushed over a metal pole also. ",1427424065,"","False",0,2,"WTF"
"Connaghan","","","I was thinking that looks very nice actually. Then I saw it was on wtf, noticed the roach.
Now I've looked at it long enough to think I'd probably just eat around it. I'm hungry.",1430953204,"","False",0,1,"WTF"
"fortune_c00kie","","","Wound bed looks good. Pink edges, no sloughing. 👍 impressed with interventions so far. ",1424029015,"","False",1,649,"WTF"
"SkyPork","","","Motherfuckers need to stop harassing possums.

**OBLIGATORY ""THANKS FOR THE GOLD!"" EDIT:** Thanks for the gold! 

**EDIT #2:** Okay this is my first Gold, so I'm new at this. I can't find anywhere on Amazon to enter Gold as a form of payment. Anyone have a link? Or tell me how to convert it to Bitcoin?",1425088544,"","1425140147",1,2635,"WTF"
"Snutchy","","","That was definitely a cadaver, but it was interesting and educational!",1430874871,"","False",0,2,"WTF"
"Justavian","","","Harlem Shake.",1430417434,"","False",0,1,"WTF"
"JohnDillingerdied4u","","","Any one else picturing the end of Poltergeist?",1431001654,"","False",0,1,"WTF"
"tripled153","","","Hopefully you catch this under all these posts but what you should do is put it somewhere safe where it isn't a fire hazard. as long as the battery isn't punctured or put under any excess pressure it shouldn't ignite. The expanding is actually part of a safety mechanism to prevent this.  Next contact the manufacturer, for a lot (I know apple will does on most mobile devices) will replace or repair the unit at no cost. (Apple will do this out of warranty.) I dont know if this one will in particular but hey give it a try. 


After doing that depending on their instruction you will most likely have to bring it in to a service center if they have one or dispose of it in a safe battery disposal location which most technology stores like best buy will have. ",1430532044,"","False",1,4820,"WTF"
"Psandysdad","","","That is ghoulish. If I looked like that I'd go find another tiger.",1425089087,"","False",1,262,"WTF"
"LeSTEMLibertarian","","","What did they expect to happen dropping impact grenades? ",1430271319,"","False",0,3,"WTF"
"Honkadoo","","","You want a foot? I can get you a foot, believe me. There are ways, Dude. You don't wanna know about it, believe me. Hell, I can get you a foot by 3 o'clock this afternoon... with nail polish. These fucking amateurs...

Edit: Wow, gilded! Big Lebowski every time.",1421851828,"","1421866016",1,528,"WTF"
"jlo095","","","Ki**ss** -
**ss** -
Coincidence? I think not",1426009378,"","False",0,-3,"WTF"
"jetcool8","","","Thats there so that the kid getting paid minimum wage to make you food, and clean the bathroom doesn't get a random person's needle stuck in them. These need to be in all public bathrooms.",1432599650,"","False",0,2,"WTF"
"digitalinfidel","","","What a fucking degenerate",1431539905,"","False",0,1,"WTF"
"GreySoulx","","","This is why you don't open blast your hash oil while driving people.  
Silly Coloradans or Washingtonians. ",1431569268,"","False",0,-1,"WTF"
"NebraskaJ","","","PLAYER 2 HAS ENTERED THE GAME",1432765595,"","False",1,728,"WTF"
"ClintonHarvey","","","The hottest one is still alive fo sho.",1424943676,"","False",0,1,"WTF"
"GeneralMachete","","","They hate us because they anus",1420839754,"","False",1,1125,"WTF"
"dleap2011","","","Oh Jesus I wish I didn't have zoomed in on that... Wtf is all that nastiness! ",1424861723,"","False",0,2,"WTF"
"bigdongmagee","","","We need more llamas in public places.",1421532377,"","False",0,1,"WTF"
"Chaos_edan","","","the most terrifying thing a burglar or home invader can see: a homeowner, overweight, naked, except for a pair of socks, holding a katana, skating across the floor towards them",1428761113,"","False",1,2720,"WTF"
"EllaShue","","","""Loves to travel and drink beer?"" ""Has absolutely no morals?"" Seems to dress well from what we can see? Aside from the genital warts, she probably doesn't sound half bad to a lot of people. The scorned wife who printed these really should have focused on the negative: 

""Smells like a ripe cheese soaked in an alcoholic's saliva."" 

""Gets really bad period shits two weeks out of the month."" 

""Loves babies. *Loves* them. Might be the next Duggar."" ",1431067520,"","False",1,397,"WTF"
"DabbinGirl","","","I know where that is hahaha yeah it used to be a mobility scooter store on the left and an employment place on the right haha",1431224469,"","False",0,1,"WTF"
"JaqueHoff","","","Hey, guys! Marine biologist here and I recognized that immediately. It's a Norwegian Jumping Tadpole. They tend to like damp areas like swamps and fuck you, you cocksucker.",1421319988,"","False",1,3323,"WTF"
"CatInManSuit","","","It's like someone glued an acorn to the bottom of his torso.",1425504252,"","False",0,1,"WTF"
"olookcupcakes","","","ooo sick",1426438298,"","False",0,1,"WTF"
"fwatair","","","Everyone that has Dr. Who tattoos ought to do that. ",1424565936,"","False",0,1,"WTF"
"Mundfein","","","I don't get it. Where is the WTF?",1430078745,"","False",0,4,"WTF"
"StopSayingSheeple","","","Getting acquainted with the lawn care business early, I see.",1425825748,"","False",1,1629,"WTF"
"Mutt1223","","","Everyone knows you face the corner while aquaspanking... fucking amateur. ",1427125249,"","False",1,3771,"WTF"
"Neilmurp","","","Use that hand to take all of the bee syrup.



Edit: blah blah blah reddit gold Oscar speech.",1422233932,"","1422246453",1,2021,"WTF"
"Skribbz","","","Mmmmm",1430359915,"","False",0,1,"WTF"
"JeF4y","","","A simple note.  ""Dude, stop pissing out your window.  It's fucking gross and we don't appreciate the show""  XOXO your neighbors

And then call the cops.",1425579760,"","False",0,9,"WTF"
"kaotik-weevil","","","It's things like this that makes me wish the Olympic Committee abolished countries who knowingly abuse children for the sake of nationalistic glory of all worthless things.

Granted, I haven't given a single dry fuck about the Olympics in forever now, but this is literally state-sanctioned child abuse.",1426435444,"","1426447961",1,3794,"WTF"
"TimPwb","","","Pussy!",1432171586,"","False",0,1,"WTF"
"sighbourbon","","","civilized people like us poop into a gallon or two of *drinking water* in a big special white ceramic throne, and feel very righteous

edit:  thank you kind stranger for the gilding!  now i feel twice as righteous  =;-)",1431194579,"","1431195701",1,7,"WTF"
"ZXNova","","","This subreddit should be renamed to /r/shocking

EDIT

Apparently this is a real subreddit...",1429483527,"","False",0,1,"WTF"
"jeffhand","","","AHHHHHHHOOOOWWWWW",1422623485,"","False",0,1,"WTF"
"Iwouldlikesomecoffee","","","Saving that one for later, are we?",1421803503,"","False",0,1,"WTF"
"codefreak8","","","You know why it looks disgusting? Because bad lighting+ugly tray, and a misunderstanding of what ""food"" is supposed to look like compared to the fast food a lot of you are used to. It's really not a bad meal. Vegetables (corn and green beans), Meat/Protein (Steamed Fish Filet) and Grains (Toasted Wheat Roll).

At the same time, however, food can be both good for you and look appealing, something that this clearly doesn't do.

EDIT: How this got gold, I will never know. Thanks, anonymous stranger!",1429211487,"","1429213724",1,8,"WTF"
"Ybgur","","","The dog would be far better off if they didn't live in Cleveland...",1433017375,"","False",0,1,"WTF"
"astronomydomone","","","Is that Paul from American Horror Story?",1420548334,"","False",0,11,"WTF"
"Royal-Al","","","D:",1422849791,"","False",0,1,"WTF"
"thebarberstylist","","","Nothing, because these are gulls.",1430860238,"","False",1,3,"WTF"
"Xerene","","","I dont know, but it shouldn't be on your fucking hand.",1430693625,"","False",1,4428,"WTF"
"mark_i","","","I have found my new porn.",1427644345,"","False",0,2,"WTF"
"dredawg","","","[Hes been to Mars?](http://25.media.tumblr.com/tumblr_m0eh3fZ3We1r3eyr4o1_400.jpg)",1423935356,"","False",0,8,"WTF"
"MadCarlotta","","","my best guess here is that a raccoon found a turtle nest, broke into the eggs, stole a half formed turtle and went to wash it in your friend's pool. Then he saw the garbage on the side of your friend's house and abandoned the turtle fetus in favor of rotten Taco Bell.

Edit: Hey wow - thanks for the gold!",1421331364,"","1421360700",1,3100,"WTF"
"joebags666","","","Rented a car in TN at the airport around midnight. Driving to my hotel. Radio was preprogrammed to some metal channel. Girl DJ says ""this next song is called haha, your wife left you by Anal Cunt"". I listened to the whole song and when I got to my hotel I was in a better mood. Next day at the site I was in town for,  I told my coworker, who was also traveling, about this sweet song I heard on the drive to the hotel. He said ""was it by Anal Cunt?"". We shared a 'looking at the same moon' moment. ",1430971479,"","False",0,2,"WTF"
"jophis_stalin","","","This must be in Germany. 
",1422493457,"","False",0,1,"WTF"
"smartlikedumptruck","","","Daredevil died when Ben Affleck accepted the role. ",1422469292,"","False",1,2064,"WTF"
"ThatGirl_","","","Macadelic.",1420157684,"","False",1,299,"WTF"
"Succubic_Unicorn","","","They'll say ""aww Topsy"" at my autopsy!",1422457034,"","False",1,347,"WTF"
"gradolph","","","Dem diabetic piss bottles doe...",1423321856,"","False",0,1,"WTF"
"XCryptoX","","","I'd follow him and then shove it so far into his ear that it dusts off his little pea brain.

I probably actually wouldn't because I'm a pussy but I would like to think I would.",1430334478,"","False",1,1729,"WTF"
"monkeyseconds","","","Jelly Fishes have taken to the sky.",1423118471,"","1423151694",0,1,"WTF"
