"author","author_flair_css_class","author_flair_text","body","created_utc","distinguished","edited","gilded","score","subreddit"
"drimilr","","","this reminds me of the gold buddha.

a 5.5 ton gold buddha was found underneath what was thought to be just a plain old big ass plastered buddha. they dropped it and the plaster cracked off and then AHHHHHHH gold!

http://en.wikipedia.org/wiki/Golden_Buddha_%28statue%29

edit: gold?!?! wow! i should start preparing an acceptance speech. but no, really, thanks. not sure what do with it. maybe sell it? it's going for 300/oz now i think, according to one redditor anyways ;)",1424536118,"","1424545920",1,402,"WTF"
"JimNazium","","","You mean... ""What happens to a pro wrestling show when the pro wrestlers don't show up?""",1424709230,"","False",0,1,"WTF"
"jayizdrunk","","","Keloids are a huge bitch of a problem. They are uncomfortable, can cause immense amounts of pain, they disfigure your body, they can become infected and do so much damage....I can't explain with words how difficult my life has been while having keloids. 

There's no cure, you just have to hope that surgeries and procedures can help and have the luck of the draw that your specific version won't come back[caption](http://imgur.com/yXBhA04.jpg) me before surgery and after [caption](http://imgur.com/dluCmLU.jpg)

Edit: Man you Redditors are fucking awesome. I have always been super shy about speaking about my condition, and yet all of you have truly made it worth taking the shot to post. In all of my 31 years, this is the first time I'm happy I spoke up. Thank you all, sincerely,  you people are great.

Edit 2: Again, thank you guys so much for everything. Whomever gave me the gold, I'm honored you thought I was worthy of it. Thank you all.",1432155063,"","1432219978",1,1011,"WTF"
"kayjay25","","","That's why it's taking so long....they're using Windows^tm",1429876533,"","False",1,2584,"WTF"
"EvilJamesMay","","","Dickmutt",1431327046,"","False",0,0,"WTF"
"LeftySurprise","","","Shit. This was fast in the 90's for the average person. I was hitting Mach 56.6kb back then. ",1429671710,"","False",0,4,"WTF"
"bontgomery_murns","","","I guess the apple doesn't fall too far from the tree, this guy is [Alejandro Jodorowsky's](https://www.youtube.com/watch?v=HHiA3w6Y3KA) son.",1429275203,"","False",0,2,"WTF"
"wiltedtree","","","This is how a ratking gets started.",1427184745,"","False",0,2,"WTF"
"windofpazuzu","","","symptoms of an std",1423291608,"","False",0,-1,"WTF"
"iia","","","Mary pushed the writhing termite queen into her small mouth. It barely fit. She felt the egg-sac pulsing on her tongue. Carefully, she bit down. The sac exploded, filling her mouth with creamy, gray termite pulp. She pushed her tongue against the roof of her mouth to wring every drop of the greasy fluid out of the sac.

Once she was sure it was empty, she carefully pulled the queen and the now-empty sac from between her lips. It dropped to the floor like a discarded condom.

Mary crossed the room to where David was waiting on the bed. He smiled at her. She did her best to smile back without spilling what was inside. David tilted his head toward her and puckered his lips. Mary kissed him passionately and began snowballing the termite mulch into his mouth. 

The passed it back and forth for a while as their nude chests became slick with what had dripped out. Finally, they swallowed their mouthfuls. They cuddled in their comfy bed, content with their lives together. It's so rare that one finds their perfect match. ",1431014490,"","False",3,1851,"WTF"
"mycroftxxx42","","","Family Story Time:

There used to be an airforce base in Houston, Texas - Ellington Field.  It's used by NASA now, I think, but in the 60's it was active in the southeast part of the city.  

Pasadena, Texas, is a suburb of Houston on it's east side, and was mostly strawberry fields at this time (It's now mostly poor and refinery now).  The flight path for airforce craft had them avoiding the small residential area of Pasadena and flying over these fields.  From wherever they were coming from, this was a notable detour and not every pilot bothered.

This irked my 9-year-old father to no end.   One particular craft, the Fairchild C-119 ""Flying Boxcar"" was apparently in common use of the time and the pilot used to fly these prop driven aircraft at exceptionally low altitudes occasionally dipping below twenty feet.  The noise, as you might imagine, was rather extreme.

One day, my father was playing in the back yard with his older brother's bow and arrow.  A c-119 flies slowly over his neighborhood and in a fit of pique, my father raises the bow and shoots at it.  

Imagine his shock when the arrow not only hits, but penetrates the wing and sticks!  After being scared for the rest of the afternoon - fearing not only the government, but an older brother's wrath at losing ANOTHER arrow - my father mostly calms down and forgets about the incident over the next week or so.

A bit over a month later, an airforce vehicle parked itself in front of my grandparents' home and two men stepped out to stand guard while an airforce officer came up and knocked on their door.  My grandmother answered and he asked for my grandfather by name.  Shocked, since she assumed that a family friend who had been using their address while deployed in vietnam had died, she left the officer on the porch and got my grandfather.

Eventually the officer is shown inside and surprises everyone when he asks about my father, who is still nine years old.  My grandfather steps outside and whistles for my dad, who comes inside just as the officer is opening his briefcase to reveal... an arrow.

Apparently my fathers first thoughts  were, after ""CRAP!"", wondering how much a C-119 cost, and how long it would take him to pay one off at his allowance.   The officer asked him if he fired this arrow at a plane and when he shamefacedly concedes that he did, proceeds to tell my grandfather the story.

The pilot was very surprised when a civilian shot his aircraft, and expressed that surprise vocally.  Unfortunately, the cursing and exclamation of ""the little bastard shot me with an arrow"" went out over a live microphone back to the base.  Apparently, the pilot's commanding officer was waiting on the side of the runway when he got the plane down to verify that there was an arrow sticking out of the plane, and additionally cite the pilot for conduct unbecoming an officer, deviating from a flight plan, endangering civilians, and whatever other charges he could get out between laughing at this poor schmuck.  The details of the charges weren't ever really made clear to my dad, unfortunately.

At that point, my grandfather had to do some of the best acting of his life to date not to let on how amused he was at the situation and secretly proud of my father he was.  He was very stern with my dad and nodded along with the officer when he told my father that he was not allowed to shoot at US aircraft any more, and that they would be avoiding his house in the future.

My grandfather did ask for the arrow, but was told that it was going to be used as evidence.  While no details are known as to the arrow's eventual fate, it's assumed that it was kept around as a memento and story-prompt by someone, probably the officer.
",1423399377,"","False",1,3163,"WTF"
"SirTickleTots","","","So fucking metal.

/r/EAF",1427341855,"","False",0,1,"WTF"
"rockin_robin84","","","I'm now curious to know what causes this?",1423249228,"","False",0,1,"WTF"
"Professor_Matrix","","","Lance it with a needle, let's see what comes out. I'm curios ",1425846106,"","False",0,0,"WTF"
"LewsTherinT","","","I believe, and i could be wrong though i never am, by the look of the wound he lost it in a fight with a large mammal most likely a North American black bear that was charging a lost child. He saved the child and escaped with this one injury. The child, not old enough to talk and parents oblivious to the disappearance never found out about your heroic child saving family member.",1427373624,"","False",1,74,"WTF"
"ThatsWhatSheepSaid","","","Good call on the boots, but it probably would have survived the weather if it would have worn a jacket as well. ",1422652397,"","False",1,284,"WTF"
"darkskim","","","(@p)",1429898703,"","False",1,956,"WTF"
"Nightmare713","","","Feast your eyes on this. http://gfycat.com/TautHatefulKakapo


**Thanks for the gold!",1422654872,"","1422678764",1,1047,"WTF"
"OilNmashedKeefBlunt","","","Did they keep the old windshield?                                                 
",1427602335,"","1427663751",1,2080,"WTF"
"Murgie","","","༼ つ ◕_◕ ༽つ PRAISE DOME ༼ つ ◕_◕ ༽つ",1423088194,"","False",1,258,"WTF"
"CaptainSnotRocket","","","Those wounds make a gun look like [an elegant weapon for a more civilized age.](https://www.youtube.com/watch?v=0aRtupiY9Dw)
",1428755822,"","1428782674",1,3982,"WTF"
"Onyxena","","","Cute how so many are rushing to defend the dog that did this. Maybe we don't have the entire story, but maybe he wasn't a horrible owner. People are so quick to automatically assume the owner must have been abusing it to make it do this. This breed is well known for doing this and it doesn't require training or abuse to bring out a bully/pits killer instinct. Yes I know I know, yours is so sweet and wouldn't hurt a fly and reads bedtime stories to orphans. But many do maul and kill. No different than retrievers wanting to fetch sticks or hounds wanting to sniff out game trails all day. I'm not a hater, I actually know several pits I like well enough. I just wish people would acknowledge to power and capability of these types of dogs. If these attack were not happening weekly they wouldn't need a brigade of apologists constantly defending them. ",1429622229,"","False",2,1516,"WTF"
"The_Pale_Blue_Dot","","","Erm... more context? Where exactly is it? Have you challenged them about it?",1428700135,"","False",0,-1,"WTF"
"kristamhu2121","","","They can't all be winners kids",1431969943,"","False",0,0,"WTF"
"plugindementia","","","Fire for you and you and you",1426246531,"","False",0,0,"WTF"
"howardkinsd","","","http://i.imgur.com/DKaFTDH.jpg",1431625896,"","False",1,354,"WTF"
"russianbear1995","","","It's a cell phone store",1424466634,"","False",0,28,"WTF"
"MikeHunturtze","","","What happens when one of them has to poop?",1421182700,"","False",0,2,"WTF"
"Art_Van_Delay","","","It's an optical illusion",1424709143,"","False",0,1,"WTF"
"Wheeeler","","","To be fair, one of these five is practically begging for it",1426631147,"","False",1,174,"WTF"
"flowgurt","","","She has to be shopped into the picture. I mean who just leaves their kid out in the middle of a bike race?

edit: http://i.imgur.com/AUTEf.jpg",1422567278,"","1422589355",1,56,"WTF"
"DirtySouthCityBoi","","","I love the effort to protect the couch with a sheet. It's all ok now. Other wise a person would think she were not a tidy lady.",1424484393,"","False",0,2,"WTF"
"luannyboyz","","","[Unexpected jihad](https://youtu.be/nZlkzhi-a5M)",1431226465,"","False",1,191,"WTF"
"nikolaiownz","","","Even without the rat I wouldn't eat that. ",1420843528,"","False",0,1,"WTF"
"and_the_cueball","","","Niece or nephew visited earlier?",1430351610,"","False",0,1,"WTF"
"NewYorkDash","","","Soak it in some slightly salty hot water for a few minutes and then follow the other comments advice. ",1426471917,"","False",0,1,"WTF"
"IloveyouGTA","","","god damnit, this is just gonna reinforce the stereotype of my people :(

Edit: Thanks for the gold kind stranger!",1421449486,"","1421507981",1,5,"WTF"
"shepards_hamster","","","I am Mohamad Messes, look at me!",1430443705,"","False",1,0,"WTF"
"Chrissylte","","","It is a NOPE-bug.  
",1430695534,"","False",0,1,"WTF"
"oblivious_drawguy","","","YER AN OSTRIDGE NOW JENNY

edit: [you bastards will throw gold at anything don't you](http://i.imgur.com/jS6Jjjs.jpg)",1425754804,"","1425762868",3,2124,"WTF"
"soplias","","","Tell the manager that the new mustard dispenser is here.

**Edit:** Removed edits. Ask and you shall receive.  ",1428365980,"","1428393358",2,2416,"WTF"
"KaptainKoala","","","So I see this cop didn't decide to shoot him in the back 8 times. Good guy",1430244196,"","False",0,-4,"WTF"
"Stanislav1","","","Could be a frat pledge. Or bath salts.",1424557583,"","False",1,2986,"WTF"
"huggythejerk","","","Who put all these delicious cakes on the ground?",1432985525,"","False",0,1,"WTF"
"shitterbug","","","/r/ConfusedBoners",1420927727,"","False",0,1,"WTF"
"freetoshare81","","","They have nice legs. ",1428872466,"","False",0,32,"WTF"
"lost_in_thesauce","","","For anyone wondering, this is what they make you do before reenlisting in the Army. The convulsions at the end are because she's reciting the oath of enlistment while crying with joy. ",1427640285,"","False",1,1197,"WTF"
"NthngSrs","","","Cool story, bro... ",1424034178,"","False",0,2,"WTF"
"AlHubbard","","","I thought I was going to see a girl covered in bruises.

Edit:  Thank you, sir may I have another?! -[Kevin Bacon] (https://www.youtube.com/watch?v=qdFLPn30dvQ)",1426005132,"","1426100344",1,144,"WTF"
"Patches67","","","Yeah, a home that needs thousands of dollars in renovations and after all that work is in a neighbourhood that possibly will not receive any utilities or municipal services.  ",1427380241,"","False",0,1,"WTF"
"Sweepy_time","","","Looks like he french fried instead of pizza'd.  
Edit: Wow, Gold for a South Park Reference, Thank you kind stranger!",1425404694,"","1425439405",1,771,"WTF"
"Moquai","","","Nope nope nope nope nope",1421612287,"","False",0,1,"WTF"
"bureauofrenegades","","","I'm the original poster. Thanks for the steal lol I'll post follow ups",1424055574,"","False",1,2567,"WTF"
"Philippe23","","","Here's a compilation of the same from the US: http://afv.com/",1422309045,"","False",0,-1,"WTF"
"imaketrollfaces","","","Untrained drivers get trained.",1426687063,"","False",2,1070,"WTF"
"insouciant_squirrel","","","The real shame is the missed opportunity of a cone hat",1423447392,"","False",1,556,"WTF"
"StarFuryG7","","","I'm sure the clown that did it was thinking *'Why Not?'*",1420079021,"","False",0,2,"WTF"
"Leberkleister13","","","As a test of your neighbour's sanity I suggest you gather up a bunch of cigarette butts &amp; leave little piles under some windows.  Smoosh them a bit with your foot.

If the windows are all boarded up the next day, he/she is nuts, if cops show up, there is still hope for them.",1429556772,"","False",0,3,"WTF"
"Bomberhead","","","Hey! That's [Siegmeyer of Catarina] (http://darksouls.wdfiles.com/local--files/npcs/siegmeyer-of-catarina-large.jpg) from Dark Souls on the far left!

Edit: [Holy crap! Someone gave me gold! Thank you!] (http://media0.giphy.com/media/SgpSaVNdtcHQI/giphy.gif)
I like that Dark Souls is getting love. ",1426794165,"","1426873225",1,65,"WTF"
"scrolldown11","","","Eat mor chken",1428934477,"","False",1,1634,"WTF"
"GameSlice","","","This would go well in /r/wince.",1427486442,"","False",0,1,"WTF"
"DickweedMcGee","","","Looks like it was made by the same people who made [Taft's Bathtub](http://i.imgur.com/S5nTyaB.jpg)",1428938602,"","False",0,1,"WTF"
"Mac2TheFuture","","","Are cops allowed to use infrared technology to investigate without a warrant?",1422650882,"","False",0,1,"WTF"
"stalking_horse","","","this is uncharacteristic for Chopper's Bitch -- usually she makes rational, deliberate decisions. ",1432838021,"","False",1,4611,"WTF"
"shelleythefox","","","That's the saddest looking Toothless I've ever seen. :(",1431111628,"","False",0,1,"WTF"
"al3699","","","...should i throw play money?                                            ......................................................................................................................................................................................................................................................................................................(Kennyyoli threw Reddit Gold thankyou)",1432898780,"","1432915721",1,104,"WTF"
"bcfromky","","","Thanks for the love and well wishes guys and gals! I can't wait to get him home Saturday morning. I'm gonna make sure he knows he was missed and that he's loved. This dog is special to my family and he's gonna be fine! ",1427368040,"","False",1,68,"WTF"
"akaJimothy","","","If that came out your butthole instead it would be an assterisk  
  
edit: Blessed be you, fair stranger for gilding my butt joke so very close to my birthday. A toast to you!",1426855582,"","1426928791",1,213,"WTF"
"Xenuthorzha","","","It was called the ghostrider shot.",1428002305,"","False",1,135,"WTF"
"cowzgoquack","","","This happened to me when I was younger. I had an Arizona desert king. He was very picky, he wouldn't eat anything other than white mice (idk if it was smell or not). One day my dad bought some nice, one gray the other white. He ate the white one no problem but was kind of running away from the Gray. I fell asleep watching and waiting and the next morning, I woke up and started crying. I saw the gray bastard standing on my snakes back and eating him as my snake casually strolls about the cage. A puddle of blood on his back next to his spine. Id say maybe a quarter inch deep. I took the mouse and threw him outside out of rage (I was 13 and stupid I guess). My snake ended up being fine. I didn't have enough money for the vet. So I thought about my options.. Do I cut his head off? Put him out of his misery? I couldn't do that.. So I was selfish and I picked him up. Walked to the bathroom and soaked up the blood with gauze. Then I grabbed some hydrogen peroxide and just poured. . I felt my snake tighten up on my arm and hiss in pain. I felt so bad. I stopped putting and saw it bubble up. I waited and grabbed some neosporin and covered the hole. I noticed my snake had called down. So I started doing it two times a day. I would cover it with a cut up bandaid and then let it breathe a little every day. He's fine now, about 12 years old and strong. He's got a badass scar too. So I guess happy ending.


Pic of nicely healed scar: http://imgur.com/a/553Ld",1426212619,"","1426218235",1,1569,"WTF"
"bert4560","","","I would clear-coat that blood it looks bad ass.",1424250992,"","False",0,1,"WTF"
"nc863id","","","The cat lost a tire, so it's dead, but it looks like the driver's okay.",1421085874,"","False",0,1,"WTF"
"RT345HEMI","","","He is in the ER so there isn't much blood because. They cleaned it up and it probably scabbed up. Would suck when they pull it out though. ",1422991472,"","False",0,14,"WTF"
"Detective-Mittens-","","","It is not nice to take picture of peoples medical problems without permission, certainly not in a doctors office. ",1427681392,"","False",0,8,"WTF"
"jdeputy","","","Start making friends with your local drug dealer because that parasite will be taking over the school. ",1430692213,"","False",1,18,"WTF"
"Chopsdixs","","","Bet if this person put that thumb in their mouth, for whatever reason, all that skin would slough off and slide down their throat without them being able to stop it. That's fall off the bone tender. 
Edit: Thank you, kind stranger danger. ",1430551034,"","1430596381",1,217,"WTF"
"fleetber","","","Helluva way to advertise a car.",1426174761,"","False",1,1,"WTF"
"doteman","","","Now the only thing that separates me from this dog is a student loan ",1424281141,"","False",1,4614,"WTF"
"CiscosPal","","","Well, it was done wrong, but the wart should, indeed, fall off.",1432319307,"","False",0,3,"WTF"
"hikingboots_allineed","","","We had a similar thing with our cat, Sparky. She went missing one night in November 2013. My Dad found her body almost a year later under an ivy that he was clearing. We think she got hit by a car and then crawled under the ivy since it was a dark space. The weird thing is that on windy nights, we could hear the bell on her collar ringing. My sister is really into the paranormal so assumed it was her ghost whereas my parents thought that maybe she preferred life as a stray but returned home occasionally at night. The reality was just that the ivy would have been brushing against her bell in the wind. :(",1429711915,"","False",1,677,"WTF"
"hip_hop_opotimus","","","It would be terrifying to have hawks be a legitimate fear.",1429808063,"","False",1,1400,"WTF"
"Ravensmoon666","","","""Aww guys, it's nothing! Just gotta rip it off quick like a bandaid""",1432842181,"","False",1,12,"WTF"
"SmugFunny","","","God, fuck, shit, damn. You got me r/WTF. For the first time in a long time, an image is making me quit reddit for the day. That was terrible. I couldn't even upvote it.",1420855368,"","False",1,598,"WTF"
"knightmare4","","","Nature man.... Shits crazy.   ",1420262861,"","False",0,1,"WTF"
"ColeopteranCrosswalk","","","NSFL might be appropriate, but it would ruin the surprise.",1421280681,"","False",0,-7,"WTF"
"AquariusAlicorn","","","Nah, that's just Hades. Our is our Satan? Anyway, flame-head's the only one with glowing red eyes.",1420955770,"","False",0,1,"WTF"
"ucantsimee","","","I bet that having your leg shawarma'd like that really hurts the next day. And the day after that. And pretty much every day for several months. ",1422552787,"","False",1,2534,"WTF"
"stuntmonkey420","","","""if i dont let him get that pillow he's just going to cum on everything else anyway.""",1423459714,"","False",1,4249,"WTF"
"DeadHead-","","","If you go to the beach you can see some ships ....                                                                                         
but, if you go to the pool you can sit with the semen.",1427124921,"","False",1,2190,"WTF"
"Iamthesmartest","","","I hadn't clicked on this all day. 

Said ""fuck it, how bad can it be?""

I had to close the window after literally one second of seeing it, that is the most disgusting fucking thing I've ever seen.",1429141459,"","False",0,1,"WTF"
"HockeyCannon","","","No shoes, you know how this ended.",1430176170,"","False",0,568,"WTF"
"MrBrowntowne","","","That little shit is touching the exhibit! Someone get Ricky Gervais!",1431714246,"","False",0,11,"WTF"
"Agitatedleader","","","I'm a three time cancer survivor with li-fraumeni syndrome. I'm only 19 years old and I've had over 20 surgeries in the past 5 and a half years. One major arm surgery on my right humorous and three surgeries on my right lung and one on the left. I've also had two surgeries on [my brain](http://m.imgur.com/a/yu4OK) to remove a tumor and alleviate pressure causing seizures. So I can relate to your battle worn body with your illnesses.

Edit: Obligated to say thank you for the gold kind stranger was not expecting this at all.",1420428073,"","1420466127",1,222,"WTF"
"Emerald_Triangle","","","AS...

YOU...

WISH...",1431199887,"","False",1,1910,"WTF"
"guywithcrazyideas","","","Describe the owners.",1422123292,"","False",0,3,"WTF"
"Death2Snowden","","","even black people don't know if they are human or not",1430557678,"","False",0,1,"WTF"
"dotheevolution1","","","Eenie Meenie Whiney Mo, Hit a batter with a throw, when he hollers let him know, next time in the head fo sho

Edit: Thanks for the gold! ",1431612140,"","1431636241",1,1156,"WTF"
"Mattchoooooo","","","Here is a documentary from David Guetta showing the history of the pointy boots. Mexican Pointy Boots: https://youtu.be/5dbEhBKGOtY",1431550656,"","False",0,8,"WTF"
"Ferfrendongles","","","American's- Racial Characteristics: judgmental, stereotying ass holes who have repeatedly caused misery and death wherever they went. They drive big big cars, eat big big meals, and feel good about themselves when they make their $5 donation to Feed the Poor. Uneducated, yet seemingly infinite in their capacity for pride and confrontation. They pray for rain and pay for pain, adopt African children, and all it's citizens believe they live in the best nation on Earth, despite having the highest rate of incarceration, per capita of any nation, Oligarchical tendencies, and have by far the most serial killers, mentally ill, and suicidal individuals. They make great BBQ. 

Anecdote containing American's:

An American goes to order at a fast food restaurant, and order the largest item on the menu and asks for a small drink. 

I never thought of my first reddit gold being so bittersweet (mostly sweet), but thank you very much, kind gold giver!
",1421256582,"","1421343117",1,-17,"WTF"
"leather_interior","","","I literally said GROSS, outloud, to myself, in an empty room.
",1423390752,"","False",0,3,"WTF"
