"author","author_flair_css_class","author_flair_text","body","created_utc","distinguished","edited","gilded","score","subreddit"
"GIRATINAGX","","","Translations: ""OH MY ALLAH, OH MY ALLAH, WE ARE GOING TO HAVE MEATLOAF AS DINNER TONIGHT""

Edit: First Gold! Thank you very much, stranger :)",1432899774,"","1432946894",1,175,"WTF"
"CptBananaBits","","","oh it's HER again, I've seen her push so much stuff out her ass now I feel I need her name.",1422664211,"","False",1,875,"WTF"
"archlinuxfreak","","","did you have the luft-waffles?",1432252278,"","False",1,1710,"WTF"
"ProbablyARob0t","","","It's for her tinder profile. ",1432233554,"","False",0,1,"WTF"
"al3699","","","on the floor, just out of shot, is the genie lamp that he emerged from",1423255050,"","False",0,1,"WTF"
"KeystoneGray","","","*""We weep for the blood of a bird, but not for the blood of a fish. Blessed are those with a voice.""*",1429730160,"","False",1,1080,"WTF"
"Guppy-Warrior","","","As a guy with a deviated septum. ... thisb I sbthe stuff I fantasie about",1420092267,"","False",0,1,"WTF"
"avktm","","","those hairs are weird they're double stranded ",1425157892,"","False",0,2,"WTF"
"reptiliansentinel","","","It's the rare Cockulonimballs cloud formation!  Previously only seen in the depths of Uranus!

edit:  Thank you thank you!",1423175622,"","1423203579",1,323,"WTF"
"Sendit_allday","","","By popular demand...    http://imgur.com/06Vpjls
My ring finger was re attached with what was left, the middle finger re attachment was not attempted due to it looking like hamburger meat ;) ",1428262506,"","False",1,122,"WTF"
"RobinBankss","","","Has anything Worcester than that ever happened there?  ",1431893232,"","False",0,1,"WTF"
"Forcekin420","","","Disappointed by the lack of poop",1428377844,"","False",0,1,"WTF"
"Y-Cha","","","I'm sorry for your loss. I hope you're able to find some comfort during the coming days, and that you have friends and surviving family that care. I think that helps.  As cliche as it might be, remember the good times. Hold on to those.

I recommend, if you're open to it, and when you're ready, to see a grief counselor.  And talk.. Even if it's a repetition of things you've already said, and even if it's not to a counselor, to boot. That seems to help.

Next month will mark a year since my mother (and last surviving parent) died unexpectedly. I never thought it would be like this, or so soon (both parents just over 60 at their deaths), or even that time would pass by so quickly. 

I wish I could take all of my own advice, because things still feel shitty. Time softens the edges, but maybe not fast enough for me.  

My outlook on life is different these days. I feel like I put more time into what is personally meaningful, and cut out the bullshit - from both myself and others.  I am trying to enjoy what I can, and not sweat the small stuff - honestly, so much pales in comparison, and I've realized how mundane, petty, and trite certain things can be (and fuck *that*).

My apologies for the ramble.

Hang in there, I know it's rough.
",1420129790,"","False",1,333,"WTF"
"IAmBecomeGay","","","Why not just bring the dog to your own house and wait for the neighbor? Maybe leave a note at the door so they don't freak out when they get home?",1429837458,"","False",0,-3,"WTF"
"thewtft","","","I wonder if the dude who decided to spread his asshole and post it on the internet ever finds himself on occasion. Imagine him walking down the street, seeing that billboard and going, ""heh, yea, those were the years.""",1431251514,"","False",1,3535,"WTF"
"chicorafa1","","","He went to LSC. ",1426805985,"","False",0,1,"WTF"
"drphilthay","","","Doctor here! This is a classic example of someone what got themselves a nasty old fucked up wound on their ass. His guts and bones are all spilling out and it makes me fuckin sick. ",1429148799,"","False",1,11,"WTF"
"TsarGriz","","","Fuck shadowfax? Bitch fuck you",1428019605,"","False",1,78,"WTF"
"teeohdeedee123","","","I can't see the posterior of the person holding it, but I assume he doesn't have buns because the anaconda don't want none.",1431922027,"","False",1,4206,"WTF"
"nightflesh","","","Such a gutsy driver",1426165632,"","False",1,59,"WTF"
"freckleybear","","","boop",1428346269,"","False",1,1,"WTF"
"s70n3834r","","","Gotta keep a spare key out there somewhere; or perhaps in the wallet.",1426972720,"","False",0,1,"WTF"
"10minAIDS","","","The cow doesn't want to be fed.  It wants to hunt.  
  
Edit:  A big Thank You to whoever gave me gold on this!",1428937239,"","1428962838",1,990,"WTF"
"Moloth","","","The Nast-Fu is strong with this one.",1432826368,"","False",0,1,"WTF"
"ethiopianwizard","","","So this is where my wallpaper comes from.

http://imgur.com/ybNifaZ",1423155675,"","False",1,195,"WTF"
"rantstanley","","","Laughed hard about the title. Ah, thanks. ",1425917780,"","False",0,0,"WTF"
"BiggerLongerAndUncut","","","why my GF won't do anal",1426526291,"","False",0,1,"WTF"
"nothingpersonal_","","","i'm fairly drunk atm but that doesn't look very hidden to me.",1420089959,"","False",1,4460,"WTF"
"YoMommaIsSoToned","","","""LOOK AT YOUR STUPID HUMAN FACES ONE LAST TIME.... before my people rise up and eat you"" ",1420625404,"","False",0,1,"WTF"
"Wearestarstuff84","","","Damn. Did the guy just snack on a 24 pack of highlighters?",1428370026,"","1428378911",1,2318,"WTF"
"Alarmed_Ferret","","","Well, I'm bored and have time to kill. Let's do some transcripting!

Starting at the very top: ""Signup all things win prize art puzzles. Com $""

""John **Kennedys** 1963 Dallas trip shot. CAn be identified here on this page. Would that be of any interest to you? In regards to the 'Washington DC' court case Hoffa and the truckers. Hoffa being a snake stealing truckers insurance money? And if you could bring to understand their point free media communications read in diction *(Bones is underneath this, not sure why. Perhaps Hoffa's bones?)* ""organize"" just 1, 2 pages. It's simple Hoffa missing. Later meaning a logo taking (They like it) since WWII. Pointing too health is your insurance. And the health logo being a T and a snake or two (1,2) as in the PHD (3) **R610** 257 manuals. On fibrury R 6 0 2573. A/A-ILL example. Controls and so messaging to another party. as they do take your logo WWII **Standard Oil Logo**[ then swastika] symbol taken. As preplanned to will be your health. Futures of base smith as one as you are new logo ""USA Health"". Choosen as my family held and used Smith a 1950 sound sturdy dependable stablety [Stability] ambition and USA name SMITH I'll tell you why; married Robert Smith after Nuremburg trials. 1948 to Erika bronner born **Herman,** Nuremberg 5 sisters 1 brother. On the citys catholic church large wedding including trails and officers of **preplan** intent. A large wedding. So **Washington** attendees. Kept in truck funding fates 1950, I was born we lived in Atlanta. Our house lured taped letters of my mother were intercepted as pictures. Stories included a ""[unintelligible] birthday party"" of Beth Walker age 6 and girlfriends to the Georgian Motel private room with setting each girl had a real flower magnolia **Hawaiian** styled placed on the table before us. As the meal was served the flowers were removed otherwise the plates placed on top of the flower would cause the dinner to be slanted at a angle. As it all becomes just that ""as it unfolds"" the hoffa as well as the Howard Hughes case. Also in ""OC"" 1956 his plane crash is also a ""Organza connection"" *Above it says concentration*. pointing a something other the TV media time to tell next T move or in his case, it wasn't Howard Hughs at all but the NEXT step on the plan of telling color print powder fading a error and print pands a ""futures"" trials and judgements of the people ere. A newsystem developing of what they are preparing you for ""puppura"" similas ""Match Co"" va **Mexico + 1977** Coca Cola.""


Whew. That's the first page. If anyone is interested I'll do the next. So far it looks like a large conspiracy to take our symbols and change them, which somehow involves Jimmy Hoffa, Howard Hughes, and Nazis.

Edit: I decided to cut out the extraneous edits and am going to just update this one. I just finished page 5, it's in the replies to this post. Not sure how to link to specific comments. /u/popepeterjames has deciphered some of the [Unintelligible]s for me. Post has been updated in bold where affected.

Thanks to whoever for gifting the gold.

~~Page 6 will be up soon. This one is really odd and looks like the scanner slipped on the top part, so it's missing some bits.~~ Page 6 is done, Page 7 on the way.

Edit: Okay, so.. I did a little digging. I think I'm going to stop this transcribing and guesswork now because I have found her. I found Delia Smith. Details about her match details in the papers. I think it'd be a good idea if OP censors the imgur images as they DO contain her phone number and full name. I'm sending him a message to that effect. Thanks for the fun times guys, but this got a little too real for me.
",1427473512,"","1427495337",1,933,"WTF"
"TreAltrix","","","My best friend is an army ranger and says something like that all the time. It's kind of disturbing. Diversity benefits all people who aren't close minded.",1426095267,"","False",1,-8,"WTF"
"salv3tor13","","","Well its good to get your car waxed",1430336808,"","False",1,1821,"WTF"
"Yeazelicious","","","Riding that probably takes a lot of concentration.

Edit: Wir danken Ihnen, großzügig Fremder!",1425697069,"","1426211204",1,1937,"WTF"
"Dospunk","","","Fish heads fish heads rolly polly fish heads",1429453210,"","False",1,2,"WTF"
"EPluribusUnumIdiota","","","My stomach's been messed up for six months now to the point they've got me on a liquid diet, that freakin fish and roll look so damn good.  I would kill for a good breaded cod sandwich on a crusty roll and some lemon slices and a cup of fresh made tarter sauce...for this school lunch I would only maim someone though.",1429218591,"","False",0,1,"WTF"
"Danbob6","","","I used to work at the Jobcentre here in the UK. One of the many roles I had during my time there was a crisis loan officer. This essentially is where people have had benefits but either lost or spent them before their next lot was due, we could give them some of next times. Really not good economics but you legally can't let someone go hungry. The biggest reason was that they'd simply spent it on drugs so it made me very jaded. 

One day I took a call from a happy sounding guy. This was weird because most people who came through were either genuinely at the end of their tether or had a sob story ready to try and get money from you for more drugs. I asked what his need was and he said that he'd spent all of his benefit. I had a big check list of things to ask him. The first and most obvious being what had he spent it all on so soon. He told me he'd been to the local pound shop where they were selling copies of Jaws on DVD for £1. Seeing an opportunity he had bought as many copies as he could afford - 191. 

191 copies of Jaws. I asked him how it was going. He said he hadn't sold a single one. He was now hungry and had no money for food. We had to give him something so we issued £10 so he could go and get some tins etc. Of course in these situations we had to take whatever evidence they had to justify the loan. I asked him if he could take the DVDs to our counter which was downstairs in the building I was in. Sure enough ten minutes later I get a call from downstairs telling me that he had brought in ""a shitload"" of Jaw's DVDs. I authorised the payment and asked them to put him on so I could go through the standard terms of the loan etc. We finished up and I asked if there was anything else I could do for him today. He simply replied:

""Wanna buy a DVD of Jaws?""",1426919589,"","False",1,308,"WTF"
"Isansa","","","Horny toad. Yep my dad would catch those and bring them home a lot when I was little. I would try over and over to startle them and get them to squirt blood. Nothing :( ",1426620337,"","False",0,1,"WTF"
"breaking_jackpots","","","How does that beaver get online?

He logs on.

Edit: Thank you!",1431834967,"","1431844163",1,2486,"WTF"
"louisbo12","","","No wonder Robert baratheon got fucked up by one.

Edit: thanks for the golden dragon",1425143737,"","1425160640",1,2533,"WTF"
"iia","","","I knew the minute I had to brush forest soil off my penis in order to fit a carpenter ant into my urethra that I was a unique individual. Still, I was always taught to celebrate differences. With that in mind, I stripped off my remaining clothes and sat directly on the anthill.

The ants swarmed over my pale body. Their little pincers gripped my skin, worried that I might be a threat. I wasn't upset. Soon they'd know I just wanted to give them a new home.

I lined up the ants with the help of a little sugar and started walking them up my cock. I could feel them walking and sometimes biting inside. Eventually they stopped, though, and moved forward. Some went into my bladder, some went toward my prostate. Most of them loitered in my urethra, patiently waiting.

It's been about a week, and every so often I feel an ant crawl out of my penis. It always comes back, though, carrying either a crumb or a piece of another bug for his friends to eat. The other day I saw a couple tiny ones. They're having babies in there. I wonder if I helped fertilize those eggs. I'd be a mommy *and* a daddy. *And* an ant house. This must be how Mother Earth got started.",1426715713,"","1426762059",2,1361,"WTF"
"EarthRester","","","The first one looks like a female version of [David Zayas.](http://i.ytimg.com/vi/ONuEMOCdx7A/maxresdefault.jpg)",1424513367,"","False",0,1,"WTF"
"Stella_Splendens","","","A little Asiago in my Macchiato 


",1420577013,"","1420604565",1,419,"WTF"
"1leggeddog","","","[Glorious Nippon steel](http://i.imgur.com/y2kxVaW.gif)",1423058924,"","False",1,11,"WTF"
"77bc","","","So she slaps the cop, and the rest of the porno happens back at the station. ",1426171350,"","False",1,4,"WTF"
"zico_","","","Good for them for not giving a shit that everyone thinks they're ""weird"".... Ya hear that MOM? Other people make out with pillows. I told you it's cool now.",1423507379,"","False",1,2010,"WTF"
"AWW_BALLS","","","It's draining men, hallelujah

edit: Thanks!",1423007892,"","1423072198",1,9,"WTF"
"az_max","","","My Flight Instructor told me two things:
Any landing you can walk away from is a good landing.
Take-off is optional. Landing is mandatory.",1429843873,"","False",0,1,"WTF"
"Neltech","","","Sadly, the town's most famed envelope factory was consumed in the flames.",1420139997,"","False",0,7,"WTF"
"johnq-pubic","","","Isn't his dick going to swell up for days, preventing him from pissing?   Sure sticking your dick in a fire ant colony *seems* like a good idea, but I don't think he really thought it through.",1421443099,"","False",1,947,"WTF"
"sheeponfire","","","I'd eat it. Like a blood sausage.",1420940090,"","False",0,3,"WTF"
"G00bernaculum","","","Wait, hold on. This doesn't make any sense. I thought it was supposed to look pixelated.",1426164935,"","False",1,3,"WTF"
"Muntjac","","","A few New Years Eves ago, while I was visiting family for the holidays, my Dad came home absolutely fucking wasted with his stupid friend. Dad passed out on the kitchen floor and his stupid friend just LEFT quietly before I realised what was going on. I tried to move Dad onto a couch but he wouldn't/couldn't get up and was fairly unresponsive, so fuck, off I go to get pillows/blankets so he can enjoy his embarrassing kitchen nap. Halfway up the stairs I heard him choking on vomit and had to run down and roll him on his side to continue vomiting without dying. That's when he shit himself. Oh god, the smell :C I cleaned up all the puke I could get to, he's been drinking bloody mudslides, kitchen stank of manshit and baileys. Called Mum(she was out with her friends) and she's also drunk, too drunk to care or come home to help. Thanks Mum. Dad puked again, still unconscious, so I panicked and called for an ambulance. Paramedic came in and managed to get Dad awake, Dad swiped at him and told him to ""fuck off out of my house you cunt"", then apologised after he realised the guy was a paramedic, thanking him for doing a good job. No hospital for Dad tonight. Paramedic can't(or won't) help me move him though, fuck. Stayed up all night making sure Dad didn't roll over and choke on vomit. Yay New Years.

Mum recently told me that Dad likes to proudly tell the story of his daughter diligently looking after him on New Years Eve. She always makes a point to remind him to add the part where he shat himself and slept in it.",1425400432,"","False",1,72,"WTF"
"dj-_-jb","","","am i the only 1 who finds this fucking gross? I just imagine her insides all fucked up. . . ",1431426812,"","False",0,1,"WTF"
"seasond","","","Ugggghhh. Is that track lighting?",1430870549,"","False",1,1,"WTF"
"DontToewsMeBroh","","","Wow that guy is so skinny, he must work out",1432913377,"","False",0,-1,"WTF"
"Mr_Potamus","","","As I was driving home from work blasting my music incredibly loud I turn to see this fucking guy in a car covered in bird shit taking a picture of me...",1430013074,"","False",1,3534,"WTF"
"boernelakebadboy3","","","Plot twist : OP planted the device in hope of recording a sex tape but OP's counterpart found it. Now OP has to play it off by posting it on reddit.

Edit: Woah I don't even remember posting this, thanks for the gold.",1420097720,"","1420140501",1,3146,"WTF"
"Comfort_Twinkie","","","He probably parks his truck in 4 parking spaces in the front of the lot. 

Edit: I'm so glad I made this guy the scapegoat for everyone's pet peeves. Some of you have some really weird and specific pet peeves... ",1431967032,"","1431982577",1,2898,"WTF"
"Prid","","","Star (fish) wipe",1429227910,"","False",1,927,"WTF"
"iia","","","I knew a girl who would do something similar to this. The big toenail on her left foot was really fucked up. There was some fungus under it and it was infected for good measure. And, of course, she never got it checked out. Anyway, one of the ""features"" of this toenail was that it could be lifted about an inch from its bed and she could clean underneath it with her pinky. She'd pull up the nail, it'd sound like ""thfffft,"" and she'd scoop a pinkyfull of the bacteria/fungus/pus and wipe it under an unsuspecting person's nose. 

We used to fuck. It was nice. The tip of my tongue fit perfectly under that nail.",1424907444,"","False",1,2142,"WTF"
"terrainrunner","","","""I boinked her!""",1427059002,"","False",1,64,"WTF"
"ChaosGoliath","","","http://thegunwriter.blogs.heraldtribune.com/files/2015/04/KelTec-injury.jpg",1430153548,"","False",0,0,"WTF"
"ElBrownSound","","","So is this a lose/lose or what?",1431148507,"","False",0,8,"WTF"
"WheelchairEpidemic","","","I hope they at least sterilized the razor...",1425849313,"","False",0,2,"WTF"
"CrappyInternetGuy","","","A few things I noticed as an employee of an Electric Cooperative.. that was a 1 in a million deal right there.  The line fell ON the cows.  I've seen cows killed by a fallen line that didn't blow a line fuse but never one that fell on top of animals....That line is no more than 7200 volts which is way plenty to kill pretty much anything but the bells on the pole is 7.2kV framing.  Also, just judging by the look of the pole top that was a VERY old pole that should have been replaced several years ago.  Not knowing where this pic was taken I'd say that this pole was set in the late 60s, maybe early 70s at the latest.  It also has a transformer on it to step the voltage down to 120/240 phase-ground/phase-phase as well as service attachments that lead me to believe that this pole had open wire secondary attached rather than the (now) typical aluminum triplex.  Also, it used to be a deadend pole that had a new tap built off of it at some point....The wire on one side looks like #4ACSR, the wire on the other side (where the cows are) appears to be #6 amerductor which where I work hasn't been used since the mid 70s.  The top wire is the energized conductor, the bottom is the system neutral.  Luckily for your dad he took this picture after crews had already arrived on scene and grounded the line (the jumper going between the primary and neutral with the red flag).   I see liveoak trees in the background to the left....Where in Texas are you?  
Lastly, as I have seen in my 20 years in my electric cooperative that looks like about $60,000 worth of cows....Yeah to you they're just cows on property used for ag exemption, but it's amazing how no-count cattle become amazingly awesome breeding specimen who have won countless awards as show cows when they are killed by a power line.  Thu-End.",1428624994,"","False",1,2727,"WTF"
"Sempais_nutrients","","","Siggy socky Siggy socky oi oi oi! ",1421819202,"","False",0,2,"WTF"
"MrRubberbandball","","","We call this the ""Everlasting job-stopper"".",1430049374,"","False",1,1461,"WTF"
"Anne314","","","Doesn't he know he should wear brown shoes with blue, not black?",1427980091,"","False",0,0,"WTF"
"Squalor-","","","That thing was deeper in her than you'll ever be.",1425996397,"","False",1,3397,"WTF"
"Morgand1","","","Omg I'm beyond hungover why in the hell would I watch that?",1431806210,"","False",0,1,"WTF"
"TheGhostofLanePryce","","","I actually screamed out loud when I saw this",1425860450,"","False",0,1,"WTF"
"turnipsmom","","","When we were 18 3 of my friends and I went to a club. One of my friends (let's call her Sally) absolutely did not know her limits (and still doesn't at 26 ffs) and was predictably hammered. She went downstairs with one of our friends to go to the bathroom and after a bit my other friend and I realized she had been gone longer than usual. We went downstairs as well to find the friend she went with sitting outside of the bathroom on a bench playing with her phone and waiting for ""Sally"". We went in the bathroom and immediately heard crying. I opened the only closed stall door (shitty club, bad stall locks) to find her with no pants and shit all over herself. She had shit herself and ruined her underwear and tights, which we promptly threw in the trash. While one friend and I were helping to clean her up the other friend ran upstairs and came back down with a trash bag from the bar. So we carried our friend out of the club, in full view of everyone, while she was wearing a shirt and a garbage bag diaper. I still don't think she's lived that one down. ",1425398030,"","False",1,2499,"WTF"
"karkahooligan","","","Shit like this was done repeatedly by those rapscallions from Jackass.",1423943023,"","False",0,1,"WTF"
"CheckBaby123","","","9/11 Would not recommend.",1427319900,"","False",1,596,"WTF"
"kamkilla","","","What's the price for one of those? ",1425683973,"","False",0,1,"WTF"
"brock_lee","","","Well, she seems to have lots of free time, since she doesn't spend it cleaning.",1423584422,"","False",1,3341,"WTF"
"AdmiralVonJackass","","","You kids don't appreciate the hardships one has to endure to be this desensitized to social condemnation. There are no social events once you are passed the age of 30, and you'll be there sooner than you think due to perceived time acceleration. 

Most of you will end up a prisoner in your own house, isolated due to fear of judgement, remembering the fulfilling social lives you used to have and how your weekly board game night just doesn't provide that same thrill.

This man is saying no to that fate, and gives zero fucks about your scowls and cliques. His happiness and appreciation is made clear in his expression, and you hate him for it. He is free from that gnawing teenage need for external approval, and that confounds you. 

I laugh, as youth and beauty fades, and your friends retreat to the suburbs, what will be left in your minds but a field of dust. The once plentiful social waters vaporized by the rigors of time. The starving fool with no character of his own to lean on, cursing the gods at the cruelness of life.

I understand this best, as that fool is me. 

",1423409209,"","False",1,145,"WTF"
"Trubbles","","","Catholic school?

Or just ignorant school?",1429026295,"","False",0,1,"WTF"
"PW_IS_obvious","","","Am I the only one bothered by the fact that the like cut away isn't centered on her butt hole? Call me anal but that bothered me.

Edit: Thanks for the booty!",1429228119,"","1429282632",1,3814,"WTF"
"MindlessSponge","","","What the hell? It isn't even that nice of a car.",1426164966,"","False",1,9,"WTF"
"Ratelslangen2","","","So THATS what they're for.",1424265392,"","False",0,1,"WTF"
"hurdur1","","","Top LiveLeak comment: ""It's draining men!""

By magicrat.",1423000633,"","False",1,2696,"WTF"
"Dud3wtf","","","What is this? A Game of War advertisement?

Edit: Kate Upton's boobs got me Reddit Gold",1423345040,"","1423376927",1,3817,"WTF"
"skelebone","","","PUSSY WRITE ESSAY   
PUSSY DO TAXES   
PUSSY ENGAGE IN FRANK AND HONEST DISCUSSION ABOUT GENDER ROLES   
PUSSY EAT ICE CREAM   ",1424143187,"","False",1,2820,"WTF"
"michaeladams94","","","This bear walks like C-3PO",1431070056,"","False",0,1,"WTF"
